comment_id,post_id,debate_group,comment_user_name,commented_user_name,comment_body,comment_score
kxu3zzq,1bulhj9,11,Madeche,micheeeeloone,"Sì il dollaro è il nuovo standard, ragione per cui (teoricamente) l'America rischia anche più di noi. Un sorpasso dello yuan sarebbe una cosa catastrofica per loro, e basta qualche errore di calcolo, come è successo agli inglesi e agli olandesi prima di loro. 

Cmq noi non siamo un paesello da niente, ce ne sono di misure per evitare la bancarotta pesante stile Grecia, e non è che usiamo la lira, siamo coperti dall'Euro e dalla BCE ma il nostro debito pubblico è qualcosa di mostruoso proprio perché abbiamo ""stampato"" soldi (leggasi chiesto alla BCE) senza avere un ritorno, mangiati da chissà chi.

Mi sembra un discorso totalmente inutile in ogni caso. Per il cambiamento climatico abbiamo due ministri (ambiente e trasporti) convinti che siano ""cicli"", ci scherzano sopra, e per loro nulla è attribuibile all'uomo; l'ESA e ogni altro dipartimento di ricerca climatico dicono solo fuffa, abbiamo Salvini che ""legge un po' di storia"" e sa che i ghiacciai non si sciolgono perché gira col SUV.

Scusa in anticipo per il rant.

Per l'inquinamento e il livello di corruzione che c'è dietro hai a disposizione km di articoli e documentari, la plastica nessuno è riuscito a fermarla dagli anni '80, un macello pieno di propaganda (in particolare blame shifting) e mazzette. 


L'America ha detto per anni che il gas metano è un passo verso il rinnovabile, ma non solo non è vero (il metano è molto inquinante) nel 2021 escono fuori delle osservazioni tramite satellite e i loro giacimenti di metano ne emettono tonnellate nell'atmosfera ma visto che sono autoregolati, dobbiamo solo ""fidarci"" dei loro report. 

Vogliamo parlare dei rifiuti di tutti i giorni e dove vanno a finire? Basta dire che abbiamo la terra dei fuochi, che abbiamo inquinato l'Algeria (reporter sono morti cercando di fare luce su questo), non ci sono posti per riciclare efficacemente i vari tipi di plastica, continuiamo a darla all'India, Bangladesh etc e loro sono sommersi da questa valanga di plastica. Perché? Perché nessun politico in tutto il mondo ha mai avuto il coraggio di dire ""ora solo questi tipi di plastica entreranno nel paese, e in ogni regione avremo siti per riciclarla tutta"", visto che proprio non possiamo eliminarla.

Le banche italiane sono tra i maggiori investitori nei combustibili fossili pur sventolando bandiere green, in America la Exxon ha uno scandalo ogni due mesi, è uscito fuori un ""piano"" degli emirati di costringere l'africa a diventare dipendente dal petrolio piuttosto che costruire infrastrutture per energia rinnovabile. Davvero c'è una lista enorme di cose immorali e illegali fatte negli anni da gente a cui frega solo dei soldi. Il bello è che gran parte è anche alla luce del sole ma non sembra creare scandali.",1
kxtp22w,1bulhj9,11,Madeche,micheeeeloone,"""difficilmente ne subirà le conseguenze"" lol ma su che base... Cmq cosa credi sia il debito pubblico? l'Italia negli ultimi 30 anni si è basata sul ""ma sticazzi stampiamo soldi"", miliardo più miliardo meno dalla banca centrale ed è fatta.",0
kxtwcb3,1bulhj9,6,Ambrogio_2,ElleOsel997,"Assolutamente, sono anche d'accordo sul limitare in qualche modo il nostro stile di vita ma parlo di limitare l'eccesso, non di andare a vedere il pelo nell'uovo di ogni singola persona, un esempio è, quando sono pieno di vestiti in ottime condizioni, al posto di comprarne di nuovi indosso quelli (non penso che uccida nessuno non avere vestiti alla moda ogni giorno dell'anno), cercare di non usare la macchina quando è possibile avere alternative ad es. Farsi un bel giro in bici e altre cose simili, non sono invece d'accordo sul divieto di circolazione per macchine eurocazzi, cosa che andrebbe più che bene se qualcuno ti comprasse un'altra macchina ma non succede",2
kxtvmhy,1bulhj9,6,Ambrogio_2,ElleOsel997,"Traduco in termini semplici quello che sta dicendo l'altro utente, tiene in considerazione una disparità abissale di inquinamento tra noi persone comuni e i super ricchi, gira questa notizia che l'1% dei ricchi inquini più dei 2/3 delle persone presenti sul globo e per quanto possa essere generalizzato e poco attendibile, più o meno si parla di cifre simili, ciò significa che se tutte le persone (eccetto ricchi e le associate multinazionali) smettessero di inquinare totalmente, avremmo comunque il problema",12
kxuygrg,1bulhj9,4,nyar_182,robnet77,"Spoiler: un singolo avocado richiede circa 5 litri, paragonato alla carne è poco",1
ky4o4ht,1bulhj9,4,nyar_182,ImpressiveCourage466,"Per produrre 100g di manzo, che sono circa 290 kcal servono 1500 litri di acqua. Un avocado che è circa 250 kcal ha bisogno di 5 litri di acqua. Quindi il paragone è ridicolo. Prova ora a sostituire l'avocado con cibi vegetale più comuni e nutrienti come riso e legumi, e metti in conto anche le emissioni di metano e co2. I miei conti sono approssimativi ma ne trovi a centinaia online",1
kxug37k,1bulhj9,4,Dajmoj,Norel19,Ci si guadagnerebbe anche in termini di produzione elettrica,2
kxvo5wd,1bulhj9,4,romanissimo,AndreaLuke,Guarda che l’inquinamento dell’ambiente in Africa e Cina è dovuto alla globalizzazione (cioè lo sfruttamento di mano d’opera a basso costo approfittandosi della mancanza di leggi su ambiente e lavoro) non necessariamente alla tecnologia (produzione di batterie).,0
kxu04fk,1bulhj9,11,micheeeeloone,Madeche,"Evidentemente sai anche meno del poco che so io. 

Essendo l'economia ""leader"", la moneta americana, il dollaro, è la valuta rifugio. Questo perché la maggior parte degli altri stati fa affari con gli usa e le transazioni sono in dollari. Per questo non corrono gli stessi rischi che l'Italia, e in generale paesi più piccoli, corrono stampando moneta.",1
kxtlwlx,1bulhj9,11,micheeeeloone,Madeche,L'america può perché essendo l'economia leader difficilmente ne subirà le conseguenze. L'italia meno.,0
kxti9b9,1bulhj9,4,MrPinguinoEUW,Fergus74,"Non per essere cinici, ma ha ragione: già una popolazione di 1 milione di persone basta e avanza per evitare problemi genetici...",7
kxu9scj,1bulhj9,4,MrPinguinoEUW,Expert_Owl_2109,"Perché stronzi? È un dato di fatto che siamo troppi e consumiamo troppe risorse. Se ci fosse una gestione senza sprechi di tutto forse sarebbe possibile mantenere la popolazione attuale, ma senza aumenti. Invece il capitalismo sfrenato porta a produrre e buttare, creando prodotti senza creare valore e sprecando risorse preziose.",1
kxtomty,1bulhj9,4,MrPinguinoEUW,DocKuro,"Sono due cose distinte: un milione basta per la sopravvivenza della SPECIE, diverso è il mantenimento di uno stile di vita. Che poi è un problema da primo mondo: miliardi di persone vivono con livelli tecnologici molto più bassi senza troppi problemi.",2
kxtl6id,1bulhj9,4,IlBo0,VamosAlaPlaya75,"Intende che era un commento ironico/sarcastico, perchè qualcuno si inalberasse e gli rispondesse. Cosa che secondo me è abbastanza noiosa oramai nel 2024, tanto più che online ste cose non fanno troppo ridere, il sarcasmo e l'ironia sono molto meglio esercitati dal vivo, con risultati migliori. Fare incazzare un amico con un commento a caso mentre parla seriamente fa spaccare.",2
kxtygrh,1bulhj9,6,VenetoAstemio,Ambrogio_2,">l'1% dei ricchi inquini più dei 2/3 delle persone presenti sul globo

Si, quello più povero.

Alla fine, circa il 50% delle risorse e quindi dell'inquinamento, è prodotto dal 10% della popolazione che sta meglio. E come hai detto te, possiamo anche decurtare del capo l'1%, o anche il 10% più ricco se è per quello, il problema rimane comunque.",3
ky2v8u6,1bulhj9,4,de_kommaneuker,ImpressiveCourage466,Non è quello che intendevo dire. Io critico la retorica che prevede che ai tempi dei nostri nonni si mangiasse meglio. Pure i vegani mangiano più sano e più vario dei nostri nonni.,1
kxugpzb,1bulhj9,4,de_kommaneuker,BetterUseFakeAccount,"I nostri nonni però morivano di fame, non è un buon paragone.",1
kxtmftz,1bulhj9,4,SavingsManager3850,Dylan_Cane,Vai a vedere i report sulla Land Degradation Neutrality. Ti si aprirà un mondo. O sul consumo di suolo dell’ispra,2
kxudqdr,1bulhj9,4,Rough-Confidence-232,sourfuture,"Ho letto poco fa un tuo post dove facevi domande riguardo il lavorare nella catena ""La Piadineria"". E' di un anno fa, ma alla fine com'é andata?",1
l10irf7,1bulhj9,4,umbertocsaba,sourfuture,Anch'io sono curiosa!!,1
comment_id,post_id,debate_group,comment_user_name,commented_user_name,comment_body,comment_score
l6m094q,1d5h5h6,12,OldOwl7119,L4ppuz,"Sono d'accordo.
È assurdo come ormai sia diventata una guerra al ribasso anche in settori che su carta dovrebbero essere l'eccellenza, il fiore all'occhiello, quello che tiene il paese in piedi",12
l6lxvh5,1d5h5h6,2,New_to_Siberia,poisson_89,"Mi rendo conto che sei sarcastico, ma dato che la cosa può risultare interessante ecco qui il [rapporto INAPP 2023](https://oa.inapp.org/xmlui/bitstream/handle/20.500.12916/4120/Inapp_Rapporto_2023_capitolo1.pdf?sequence=1&isAllowed=y). Faccio riferimento soprattutto alle figure a pagina 21 e 26 (numeri di pagina del documento). 

Effettivamente sarebbe utile poter avere una panoramica più dettagliata, in particolar modo dal punto di vista delle diversità salariali nei vari ambiti lavorativi e settori economici e di come cambiano le progressioni di carriera negli stessi. Il panorama comunque non è roseo.",2
l6nawc2,1d5h5h6,2,New_to_Siberia,colowar,"Mi sto candidando a corsi magistrali nel centro/nord Europa, vediamo dove mi prendono. ",3
l6mrpxd,1d5h5h6,2,New_to_Siberia,colowar,"A quello concordo appieno, mi sono semplicemente limitata agli aspetti più economici del discorso. Io sto cercando di emigrare, sia per le ragioni che ho già citato sia perché onestamente qua non mi trovo molto bene. ",7
l6mrzrj,1d5h5h6,2,New_to_Siberia,ModsOnMeds,"Attuale nel senso di odierna e che riguarda anche il passato recente. Poi riguarda anche un passato meno recente, ma mi sono limitata alla prospettiva più immediata, una volta le cose erano un pelo meglio.",4
l6qveg3,1d5h5h6,2,New_to_Siberia,OldSeaworthiness1567,"Se tutto va bene presto sarò tra quel milione di giovani di cui parla l'articolo. Le difficoltà sono tante, e le prospettive in Italia non esattamente eccelse. Emigrare non è per niente facile, però se voglio crearmi una buona vita, mettere su famiglia qua non posso (e soprattutto non voglio) restare.",1
l6qr7oo,1d5h5h6,2,New_to_Siberia,OldSeaworthiness1567,"Il discorso case non so quanto sia applicabile, visto che il problema è abbondantemente presente anche all'estero (seppure spesso con sfaccettature diverse). Ci vorrebbe un cambiamento delle leggi che protegga maggiormente gli affittuari e renda più facile rimuovere inquilini in mora. 

Il discorso figli invece effettivamente è molto rilevante, tanto se uno è costretto a trasferirsi in ogni caso meglio andare in un posto con più risorse e più supporto per mettere su famiglia. Con tutti i discorsi sul ""bisogna fare più figli"" poi gli asili mancano, hanno lunghe liste di attesa e costano davvero molto (sono ancora giovane, però dalle mia parti so che si va da un minimo di 240 a un massimo di 600 euro mensili al pubblico, il privato costa di più), nonostante spesso non sia economicamente sostenibile per una persona nella coppia restare a casa.",7
l6ohhrq,1d5h5h6,5,giangikok,mustard_ranger,"Beh probabilmente si, ma avresti dovuto sentire la recruiter della Leonardo quando descriveva l'azienda, altro che AWS. Quando rifiutai l'offerta di 28k la recruiter non ci poteva credere, affermando che stessi facendo una follia a rinunciare di lavorare per una delle aziende più prestigiose al mondo con progetti che cambiavano il corso della storia (testuali parole). Se siete così importanti e fondamentali alla razza umana allora la paga dovrebbe essere non dico competitiva, ma almeno decente, no?

Per tutti i problemi che ha, AWS mi ha trattato con 1000 volte più rispetto.",1
l6oi40g,1d5h5h6,5,giangikok,mensmelted,"Beh innanzitutto ho avuto un gran bel relocation package. Poi ho l'assicurazione sanitaria (la sanità pubblica in Irlanda è pietosa), ho avuto la bici gratis e ho una serie di altri benefit che però non sono nulla di che. Quello che c'è di buono in Irlanda è che il turno di reperibilità ti viene retribuito a livello economico e come ferie extra. 

Ovviamente le spese sono molto maggiori rispetto all'Italia, ma nonostante tutto riesco a mettere da parte in un mese ben più di quanto avrei preso in Italia come stipendio intero.",2
l6nwxpq,1d5h5h6,5,giangikok,mensmelted,100K sarebbero circa 5200 netti mensili. Con il signing bonus di 20K arrivo sui 6000.,6
l6lxdwz,1d5h5h6,5,giangikok,sonobanana33,"https://www.levels.fyi/companies/amazon/salaries/software-engineer/levels/sde-ii/locations/ireland

Ecco la media di total compensation in Irlanda. Che è tra l'altro la fonte che ho visto prima di comunicare la mia RAL richiesta ad HR.",10
l6lvva8,1d5h5h6,5,giangikok,sonobanana33,"SDE II ad AWS a Dublino 100K è l'offerta media. Sono entrato come middle, non junior. Ho amici entrati come junior con base pay a 80k. Se credete stia dicendo cazzate basta controllare su GlassDoor",16
l6lpt64,1d5h5h6,5,OnlyRugrats,pettingpangolins,L'avevo capito mera per dire che siamo più livello antananarivo,7
l6lpj63,1d5h5h6,5,OnlyRugrats,pettingpangolins,Stai skesando? Cluj è un gioiello comparata a Milano. Oramai l'Italia può solo ambire ad essere come alcuni paesi dell'est Europa. Romania in primis ci ha superato in moltissime cose.,42
l6lngdi,1d5h5h6,5,OnlyRugrats,Marble05,Anche. In Italia la politica pensa a confermarsi il posto. Ergo paese per vecchi che fa leggi per vecchi. Ci fosse un partito che propone forum e rete 4 h24 diventerebbe la forza politica numero 1,25
l6ldc7t,1d5h5h6,5,OnlyRugrats,Eim96,"Per noi che ci viviamo. Per chi ci dirige, che ha le fabbriche, è una mamma dal cielo. Gente da sfruttare e che tiene in scacco gli italiani che impegnati a far lotta con loro non si ribellano.",32
l6m31uq,1d5h5h6,5,OnlyRugrats,Beneficial_Tone_4430,Shkopare ragassa,1
l6lgofo,1d5h5h6,13,MassiveConstant6995,Economy-Chicken-589,"Questo sentimento di voler ripagare lo capisco fino a un certo punto. Se lo stato ti ha aiutato con borse di studio o agevolazioni posso capirlo, ma altrimenti i tuoi genitori hanno pagato tasse e messo da parte soldi per tutta la loro vita, io infatti non mi sento in colpa ad andarmene",28
l6ljpo8,1d5h5h6,13,MassiveConstant6995,chris90italy,"Perché il 90% dei lavori senza laurea paga una miseria, e in più i datori di lavoro hanno pure il coraggio di lamentarsi che non trovano nessuno, ma alzare lo stipendio mica si può fare eh, meglio affossare tutto finché non arriva lo schiavo di turno. I miei genitori hanno lavorato tutta la vita per permettermi di studiare, mi hanno pure detto ""guarda che se inizi a lavorare e non finisci gli studi sarà molto peggio più avanti"", quindi non intendo mandare tutto all'aria per venire pagato 1200€ al mese",3
l6lld6k,1d5h5h6,13,MassiveConstant6995,lojag,"Si ma negli USA ci devi entrare. Un azienda deve sponsorizzarti (quindi pagare) il tuo visto H1B, che è estratto a lotteria e prendono a caso in media uno ogni 5/10 candidati, e per questo le loro aziende preferiscono candidati già in america. Un'altra opzione è il master, ma non ho i soldi per permettermi di farlo là. L'altra opzione è essere trasferiti internamente dall'azienda da Europa a Usa tramite visto L1, ma ti devono prima assumere qua e consentirti di spostarti di là dove ti devono pagare di più per allinearsi con gli stipendi americani",8
l6lendd,1d5h5h6,13,MassiveConstant6995,Auron1992,"Infatti non ho interesse a andare negli States, perlomeno non a inizio carriera che sarebbe un suicidio economico. Ma il resto d'Europa lo sto analizzando attentamente",30
l6lfi37,1d5h5h6,13,MassiveConstant6995,Maori7,"Sinceramente non è che sia meglio questo, cosa le formiamo a fare tutte ste persone all'università se tanto non la possono usare e si ritrovano a lavorare per due spicci e una pera, mentre i lavori ad alto ritorno economico (per l'individuo e lo stato) li fanno da altre parti?",12
l6lkr81,1d5h5h6,13,MassiveConstant6995,KaleidoscopeOdd7127,"Si ora il mercato fa abbastanza schifo, so che è ciclico quindi spero si sblocchi nel momento giusto, anche perché ora non sto cercando attivamente ma sto solo guardando. A parte la ST che ha molte posizioni in Italia (nell'ambito che ho menzionato), le altre ne hanno poche, e la maggior parte degli annunci sono per senior con almeno 7/8 anni. Forse mandando il curriculum comunque o andando alle fiere universitarie a parlarci direttamente magari qualcosa in più trovo, ma l'ordine di grandezza credo si sempre quello. Già andando in Germania o Svizzera ci sono più opzioni. Comunque il discorso di entrare con la tesi o facendo un dottorato aziendale sono d'accordo sia l'opzione migliore.",1
l6lijlk,1d5h5h6,13,MassiveConstant6995,KaleidoscopeOdd7127,"Le aziende ci sono ma che offrono posti per analogica integrata (quindi microchip, non PCB o embedded) ce ne sono poche. La maggior parte dei lavori sono verification, reliability e testing, che va bene ma non sono quello su cui mi butterei, gli annunci per design analogico (anche solo internship) si contano sulle dita delle mani",3
l6ll0uw,1d5h5h6,13,MassiveConstant6995,Scor4pest4,"La ST è buona, è comunque mezza francese quindi si allinea abbastanza con quello che fanno là. È l'unica azienda in Italia che fa sul serio, le altre aziende estere del settore offrono posizioni ma non comparabili a ST come numero di posizioni aperte a entry level",3
l6lj3ol,1d5h5h6,13,MassiveConstant6995,Cool_Barracuda_1922,"Il problema è che l'operatore della macchina di precisione ha 185 anni, l'azienda gli alza lo stipendio per non farlo andare in pensione (con mio padre ci hanno provato diverse volte, infatti è restato un anno in più del dovuto) e non assumono il sostituto ",5
l6li64q,1d5h5h6,13,MassiveConstant6995,SolarInvestigator,"Ma onestamente chi glielo fa fare ai giovani di studiare informatica viste le prospettive qua? Ti ritrovi a competere con una miriade di persone non laureate o che ha fatto corsi stupidi, gli stipendi sono mediamente bassi (perché non siamo nella silicon valley) e solo i migliori vengono presi per posizioni un attimo più serie",2
l6lxgjt,1d5h5h6,14,Frontkick999,Aware-Yam4146,"Portame ar mare, ndo te pare….",2
l6n75kf,1d5h5h6,1,Fancy_Ad681,giamboscaro,"Tanto più il governo che si prodiga a spingere la natalità, tagliando appunto un buon numero di possibili futuri genitori.",3
l6lhrjg,1d5h5h6,13,Economy-Chicken-589,MassiveConstant6995,"Ma infatti non mi sento in colpa e un pensiero che mi è venuto pensandoci spesso, perché i miei genitori mi incoraggiano ad andare a cercare lavoro all estero",2
l6lk573,1d5h5h6,13,chris90italy,MassiveConstant6995,"E perché paga una miseria? La risposta é:""perché se non ti sta bene prendo hamed che si accontenta di 700 euro senza fiatare"". Infatti farai ciò che fanno questi ragazzi: ti laurereai e vedrai che comunque prenderai 1200 euro al mese, perché posti per te non ci saranno; soluzione? Vado all'estero. È un loop che sicuramente non si fermerà dicendo:""gli stranieri sono risorse""; lo è l'immigrato regolare, non il tagliagole cocainoma*e sbarcato ieri senza documenti.",4
l6mqhxj,1d5h5h6,13,chris90italy,SimpatiaPazza,Dare di frustrati agli altri in modo random risottolinea la tua inadeguatezza; la prossima argomentazione qual'è? Ti compro e ti metto in giardino a scrivere libri? Sei talmente ridicolo che neanche sai che se ti metti ad insultare persone a caso ti bannano.,1
l6mq6kl,1d5h5h6,13,chris90italy,SimpatiaPazza,"La cultura è l'esatto opposto di come ti comporti tu:
1 dai di alcolista ed omosessuale alla gente senza neanche conoscerla.
2 millanti una chissà quale cultura autoattribuita, che è l'esatto comportamento opposto di una persona colta, ma è quella del supponente.
3 non riesci a capire nonostante la tua infinita cultura che se uno sta 10 anni in un'università senza una giusta motivazione che giustifichi la cosa, o non è portato per lo studio, o è un fancazzista(io tra le motivazioni ho inserito quelle familiari; neanche leggere sai).
4 il mio non è livore, è una conseguenza del punto 3.",1
l6mo0zl,1d5h5h6,13,chris90italy,SimpatiaPazza,"Ennesima dimostrazione: ""non avendo argomentazioni mi metto ad insultare come un 12enne, accennando a presunte frustrazioni inesistenti e usando l'omosessualità come insulto"". Complimenti, sei l'orgoglio della tua università: se leggessero i tuoi commenti, sono convinto che i tuoi docenti commetterebbero harakiri.",1
l6mn2cw,1d5h5h6,13,chris90italy,SimpatiaPazza,"Dall'utilizzo infantile e rindondante di emoji devi essere una delle vittime dell'accessiva semplificazione delle università, evidenziata tra l'altro dalla tua mancanza nell' avere una capacità cognitiva sufficiente per comprendere che qui si sta analizzando un problema sociale dove le università sono solo uno dei punti. Più parli, più dimostri il fallimento dell'istruzione italiana.",1
l6mlwel,1d5h5h6,13,chris90italy,SimpatiaPazza,"Vai tranquillo che uno che si paga la laurea coi propri soldi non sta 10 anni all'università, anzi, fa le corse per finirla il prima possibile. Cos'è, hai la coda di paglia?",1
l6mkx7o,1d5h5h6,13,chris90italy,SimpatiaPazza,"Ah, perché credi che quelli che stanno 10 anni per fare una triennale siano quelli con la borsa di studio? No sono quelli che vanno all'università coi soldi del papi.",1
l6lhlw5,1d5h5h6,13,chris90italy,ElPost27,"Il fatto che l'introduzione di ""schiavi"" stranieri con un tasso di scolarizzazione di un bambino dell'asilo e che non contribuiscono in alcun modo alla ricchezza del paese, ma anzi l'affossano, provocando tagli ovunque, ti dovrebbe far capire che l'aspetto stipendi è l'ultimo dei problemi, anche se quello più evidente.",9
l6lg6ld,1d5h5h6,13,chris90italy,ElPost27,"Ovviamente, ma almeno loro non si nascondono dietro la scusa dell'accoglienza e dell'integrazione.",23
l6llxug,1d5h5h6,13,chris90italy,Zeoluccio,"No è molto più complesso; il comprendere che su questa terra non siamo tutti uguali e come io, che pecco in qualsiasi competenza di natura artistica manuale, non mi iscrivo ad una scuola di scultura, così ci sono persone che non hanno indole per lo studio. Ora vedi pluriripetenti che si iscrivono ovunque consapevoli che tanto la laurea te la daranno per sfinimento. La possibilità ovviamente è giusto che gli venga data, ma poi c'è un limite. Ovviamente mi stanno già arrivando downvote da parte di fuoricorso 35enni perché si sentono chiamati in causa.",3
l6lkuls,1d5h5h6,13,chris90italy,Zeoluccio,"L'ho scritto: 1 test d'ammissione(cosa che molte università fanno); 2 mettere degli obblighi di rendimento. Esempio: entro l'anno devi aver superato x esami. Dare come unica discriminante il pagamento delle tasse universitarie è ridicolo. Ovviamente ci sono persone che per motivi x, di salute magari, non possano rispettare i suddetti obblighi: certificato medico; problemi familiari? Attestati tramite un ente apposito.",6
l6lizyd,1d5h5h6,13,chris90italy,Zeoluccio,"Se permetti a tutti di laurearsi, è ovvio che mancano persone per lavori che non richiedano una laurea; indovina in quali settori c'è maggiore sfruttamento? La politica è questa: i laureati sono troppi, quindi devono andarsene perché ci servono posti per il cugino, il nipote, l'amico dell'ex fidanzata del fruttivendolo; i laureati non vogliono fare lavori umili, quindi ci importiamo gli schiavi e arriviamo a oggi. Chi lo ha fatto il job act? Le riforme universitarie? Non mi dirai mica Berlusconi. Ah, comunque per me il rdc è una boiata, non a livello ideologico, ma pratico, oltre ad essere un mezzo per comprarsi i voti delle classi meno abbienti.",-3
l6lie5x,1d5h5h6,13,chris90italy,Zeoluccio,"Gli imprenditori fanno ciò che le istituzioni gli permettono. Pure l'eccessiva semplificazione delle università perché ""gli studenti, poveri angeli, si stressano"" è colpa della sinistra, provocando un'esubero di laureati. L'istruzione è un diritto di tutti, la laurea non dovrebbe esserlo ed ovviamente la discriminante non deve assolutamente essere di natura economica; sei fuori corso da due anni perché  invece di studiare stai a farti gli spritz? A casa, invece di tenere degli invertebrati fino ai 40 anni nelle università per fare una triennale.",1
l6mll0z,1d5h5h6,13,chris90italy,MorbidoeBagnato,"La classica risposta che evidenzia in modo lapalissiano perché siamo giunti a questo punto: arroganza, 0 argomentazioni e millantatata cultura. Evidentemente sei uno dei suddetti bevitori di spritz.",2
l6lp6tn,1d5h5h6,13,chris90italy,groceriesdaddy,"Si, il mio è un esempio esasperato; serviranno più posti, ma sicuramente non con una proporzione matematica. I concorsi perché li fanno secondo te? Se ci fosse una crescita proporzionale non ce ne sarebbe bisogno.",1
l6loavd,1d5h5h6,13,chris90italy,groceriesdaddy,"No, perché un paese sano ha bisogno di equilibrio tra classe laureata/dirigente e classe manovale: se tutti vogliono fare i dirigenti, mi spieghi la manodopera dove la trovi? Suggerimento; in un continente popolato da persone con la pelle nera e che è disposta a subire ogni nefandezza pur di uscire da una situazione ben peggiore di quella che andrebbe ad affrontare. 
In un'isola con 10 persone hai 6 laureati.
In un'isola di 800 ne hai 30.
I posti per i laureati per entrambe le isole sono 4: fammi ora la statistica di quanti rimangono a spasso?",2
