comment_id,post_id,debate_group,comment_user_name,commented_user_name,comment_body,comment_score
ka6m3yy,17z2hci,24,Shalashankaa,LadyMacSantis,"Cosa c'entra pillon e il GGGGENDER? A quanti di noi hanno insegnato a gestire il rifiuto? Quanti di noi ammazzano? Io ricordo ancora il mio primo rifiuto, mi ha segnato, ci sono rimasto male per giorni, ma non ho ucciso nessuno. Perché mai e poi mai potrei, una persona che uccide non lo FA perché non ha fatto educazione sessuale o affettiva a scuola, state scherzando? Sono milioni le persone cresciute senza educazione sessuale, quanti diventano assassini? La vostra logica fa acqua da tutte le parti. Interessante vedere come chi ha un'opinione diversa da voi sia automaticamente paragonata al bigotto di turno, fa capire molto dei processi cognitivi di chi fa questi paragoni. E qua comunque non si tratta di ""gestire un rifiuto"", ma c'è sotto qualcosa di ben più grave a livello mentale a cui poche persone arrivano, indipendentemente dalla loro educazione aFfEtTiVa",2
ka5g7zr,17z2hci,24,Shalashankaa,LadyMacSantis,"Quindi sei convinta al 100% che Giulia sarebbe viva se il suo Ex avesse fatto educazione affettiva alle elementari? Volete capirlo o no che queste cose sono sempre esistite e sempre esisteranno? Siete maniaci del controllo, non si può controllare uno psicopatico ne si può prevedere quando ucciderà. Non è insegnandogli a volere bene agli altri e facendogli disegnare fiorellini che gli si fa passare la psicopatia. Vi illudete di poter controllare tutto, non potete. La ""massa informe"" ha ragione.",1
ka0mmrh,17z2hci,24,AnDrE9_8,griselde,"Minchia avete sempre tutto contro e mai niente a favore, gli uomini hanno tutto, vivono meglio, possono fare quello che vogliono senza ripercussioni, voi siete degli angioletti e la perfezione  scesa in terra. Come fate a vivere in questo mondo così maschilista e patriarcale?",1
ka0a9po,17z2hci,24,AnDrE9_8,griselde,"Ma perché non è un problema culturale, in Europa siamo al terzo posto in quanto a sicurezza, semplicemente ci sono delle persone deviate mentalmente e sono casi isolati. Parlane quanto vuoi ma ce ne saranno sempre, come ci saranno pur sempre omicidi, non viviamo in un'utopia, e pensare di raggiungere la perfezione è al quanto inimmaginabile. Bisogna lavorarci sopra il più possibile ma tanto ci saranno sempre.",0
ka056w8,17z2hci,24,AnDrE9_8,griselde,"Prova a non usare le percentuali e guarda i numeri reali, ci sono stati 50 (circa) femminicidi in Italia quest' anno, ti rendi conto di quanto è basso questo numero se lo metti a confronto di quante ragazze sono in una relazione? Non è un problema statisticamente parlando perché sarà lo 0,0001%, dunque sono tutti casi isolati tra di loro perché causati da gente problematica. Poi perché sminuire il fatto che gli uomini in generale vengono uccisi quasi il doppio rispetto la donna? Solo perché non vengono uccisi dal partner? Lo slogan che ormai fanno passare in TV ""No alla violenza sulle donne"" è veramente preoccupante secondo me, statisticamente l'uomo viene è più probabile che venga ucciso eppure bisogna solo dire no alla violenza sulle donne. Perché non dire ""No alla violenza"", troppo neutro come slogan? Il dato veramente problematico sono appunto quello dei suicidi, non ci si chiede il perché quasi la totalità di questi sono commessi da uomini? Non ce lo si chiede perché tanto la salute dell' uomo non interessa a nessuno. Pure per quanto riguarda le morti bianche, muore una donna ogni 12/13 uomini, eppure è tragedia solo quando muore una donna. Capisci dove voglio arrivare? È come se la vita di una donna valesse molto di più rispetto a quella di un uomo.",0
k9zintf,17z2hci,24,AnDrE9_8,griselde,"Ma come ci sono ragazzi che fanno queste cose ci sono ragazze in egual misura, fate finta che siete degli angioletti ma fate le stesse identiche cose, magari tralasciando lo scontro fisico (non sempre eh, succede che sia proprio la ragazza che magari da sberle ecc) ma andando su quello psicologico, di cui, non si sa come, non se ne parla mai. E i dati parlano chiaro perché il 77% dei suicidi in Italia è da parte degli uomini. Il tuo discorso lo capisco, gli uomini devono migliorare nel gestire le emozioni, la rabbia ecc ma ti prego di non fare finta che le donne siano tanto meglio, perché alla fine siamo tutti uguali, siamo tutti umani.",8
ka08une,17z2hci,24,AnDrE9_8,krell46,"https://femminicidioitalia.info/lista/2023 eccoti qua un sito dove c'è anche nome e cognome, e data del fatto (qua dice 39 vittime, su altri siti avevo letto qualcosina in più). Poi se no ti basta fare una ricerca veloce, 105 donne uccise in tutta Italia di cui la metà, forse meno, sono effettivamente femminicidi, ovvero vittime di ex o di fidanzati.",1
ka07xaz,17z2hci,24,AnDrE9_8,krell46,"Di quel 105* la metà sono femminicidi, il resto sono omicidi, sono due cose diverse, non ti soffermare ad un post di Instagram dove postano un numero, abbi un po' di spirito critico e vai fino in fondo alle cose per favore. Io non faccio alcun mea culpa, non ho nessuna colpa e non ho la coda di paglia, se te ti senti colpevole di qualcosa caro mio è perché hai fatto qualcosa del genere. Io sono a posto con la mia coscienza e non mi devo scusare con nessuno per quello che un ragazzo psicopatico ha fatto. Smettila di fare il simp per prenderti i likes dalle ragazze per favore.",0
ka046gb,17z2hci,24,AnDrE9_8,krell46,"Il problema letteralmente esiste perché ci sono stati 8 omicidi di uomini causati da ex o fidanzate, non sono 50 come le donne ma le vittime ci sono, dunque il problema al contrario esiste, non serve contare il numero delle vittime per sapere che il problema c'è, le donne nelle relazioni sono tossiche quanto gli uomini né di meno né di più. Basta fare il paladino della giustizia. Gli uomini anche subiscono molestie ma statisticamente denunciano ancora meno perché tanto in questa cultura non verrebbero mai creduti, e se si dice qualcosa gli si risponde con ""beh sicuramente ti sarà piaciuto"".",1
k9x9xov,17z2hci,24,Kaeed_RN,unknhawk,"Ma no, 80 morti rispetto alle milioni di donne che ci sono in Italia NON è un numero rilevante, per quanto lo si possa volere. Sarebbe bello avere i dati per sapere le probabilità di morte ma non credo sia tra le cause principali.
Anche perché come si vede rispetto agli omicidi gli uomini hanno più probabilità di venire uccisi rispetto alle donne, ma qualcuno sente alzarsi voci di condanna da parte delle femministe della domenica?",30
k9xdo3q,17z2hci,24,IsekaiNorbi,unknhawk,"Nono ho capito benissimo e infatti ti ho spiegato che usando la stessa metodologia nell'altro caso la proporzione sarebbe maggiore nei confronti degli uomini e quindi il caso sarebbe più grave.

EDIT: anche perché se non avessi capito ti avrei risposto che 20% + 81% fa 101% il che è impossibile.",8
k9xbmvp,17z2hci,24,IsekaiNorbi,unknhawk,"Però sei proprio in malafede. 40 m 104 f fa 38,4% e 61,6% non puoi fare il calcolo sul totale dopo che hai eliminato con rapidità un intero campione di casi. In ambito familiare le proporzioni non sono 20% e 81%. 

Invece per quanto riguarda i numeri totali 197 m e 127 f fa 64,5% e quindi 35,5%, numeri molto simili al campione analizzato sopra ma velocemente accantonati. 
Il problema del tuo metodo di calcolo dati è che se usassi la tua stessa metodologia per ciò che non è ""ambito familiare"" allora arriviamo a un 14,5% f e 85,5% m rendendolo un fenomeno molto più sbilanciato e, quindi, grave eppure non solo non si prova a risolvere il problema come hai suggerito accade ma non c'è nemmeno questo clamore mediatico. 
Tutto questo senza introdurre le morti bianche per cui continua a non esserci questo clamore. Dovrebbe essere impressione diffusa e comune che si muore sul lavoro e si muore ammazzati da non familiari per gli uomini. Questo però non accade, perché? Perché ovviamente si parla di euristica della disponibilità per una buona ragione. Se non ne parla nessuno non è un problema sentito. 82 morti sono un numero trascurabile e irrisorio, non meritevole di questo clamore mediatico ed energia se il metodo di valutazione è la ""sproporzione"" e il numero assoluto o relativo (ci sono meno lavoratori di esseri umani femmina e maschio)",22
k9xqz0k,17z2hci,24,soviet_enjoyer,unknhawk,">Se ci fossero casi simili

Morti sul lavoro 2022: Uomini 1095 Donne 126

Molto disonesto da parte tua restringerti arbitrariamente a un particolare tipo di omicidio e poi rigirare i dati prendendo come campione le donne vittime di omicidio per far passare il messaggio che sia probabile venire uccisi dall’ex. 

80 su decine di milioni è un numero statisticamente irrilevante. Il “rischio concreto” di cui parli semplicemente non esiste. Questo non toglie che ognuno di questi casi sia una tragedia sia chiaro.",13
k9xsl2b,17z2hci,24,maseioavessiprevisto,unknhawk,"Ma no cazzo che non è un concreto rischio. Quanti episodi di questo tipo ci sono paragonati a tutte le relazioni eterosessuali che ci sono nel paese? Quello è il dato che devi osservare. Un omicidio fa notizia, ma le 99,999 % in cui non succede un cazzo no.",6
k9xrvkw,17z2hci,24,maseioavessiprevisto,Hiro34,Il problema è che pochi idioti fanno tanto casino. Come del resto gli uomini che alzano le mani o uccidono la propria compagna. Tra tutte le relaIoni eterosessuali sono certo che quelle connotate da violenza dell’uomo verso la donna siano una assoluta minoranza. Ma sono quelle che fanno notizia.,25
k9xx0jb,17z2hci,24,maseioavessiprevisto,reginamab,Meglio di quanto tu sappia costruire una frase in italiano.,2
k9xtlcv,17z2hci,24,maseioavessiprevisto,reginamab,"Il classico uomo non ammazza la compagna/fidanzata. Non c’è nulla di classico in questo assassino. Va bene fare educazione, va bene essere indignati, non va bene gonfiare l’entità del problema come se ogni donna corresse il rischio effettivo di essere uccisa dall’oggi al domani.",15
k9znikz,17z2hci,24,maseioavessiprevisto,AlSomething,Pensi che ci sia abuso unilaterale nella maggior parte delle relazioni?,9
k9zmcyn,17z2hci,24,Federal-Bandicoot271,unknhawk,"Però snocciola fino in fondo i dati.

324 omicidi su 60M di abitanti, questo fa lo 0.005% di persone uccise ogni anno.

Di queste, buona parte sono maschi, quindi sono 127 femmine. Conseguentemente 0.002% di femmine uccise.

Di queste, 69 sono state uccise dagli ex, quindi lo 0.001.

&#x200B;

Non saprei, lo 0.001% mi sembra leggermente poco per essere considerato ''rischio concreto di rischiare la vita''",5
ka00008,17z2hci,24,DurangoGango,unknhawk,"> L'impressione che si sta diffondendo è che se una donna dovesse decidere di interrompere una relazione, c'è un rischio concreto che questi possa rischiare la vita.

Per dimostrare questo dovresti confrontare il numero di donne uccise da ex nell'anno X col numero di relazioni interrotte nell'anno X.

Un conto a spanne: ci sono circa 90k divorzi all'anno, su 15 milioni di coppie sposate fa lo 0.6% di matrimoni che finiscono ogni anno. Teniamo questa percentuale anche per tutti gli altri tipi di relazioni, visto che non ci sono statistiche altrimenti.

La popolazione adulta ammonta a 51 milioni, i single adulti a qualsiasi titolo sono 8 milioni, quindi ci sono 21.5 milioni di coppie totali (numero di non-single diviso 2). Ogni anno dovremmo quindi avere 0.6% x 21.5 milioni = 129k relazioni finite a qualsiasi titolo. Non fatemi scremare le relazioni che non includono donne pls, non credo cambierebbe l'odg.

In questo caso 61/129k = 0.05%, detto anche 1 su 2mila.",1
k9xpei0,17z2hci,1,Curiosity-pushed,faratto_,sono in calo anche perché ci sono sempre meno giovani secondo me,4
k9xyjjn,17z2hci,24,Electrical_Total,Astroruggie,*non vogliono capire,2
ka0vs5x,17z2hci,24,Suna96,TKG_YT,"Al bobolo serve creare la retorica del noi contro loro, mandare sulla forca l'ennesimo caso inutile in modo che i problemi sistemici e realmente diffusi non vengano risolti 

(morti sul lavoro, suicidio e assistenza psicologica, criminalità, abbandono scolastico, povertà giovanile ) 


Venire qua, ragionare sul problema e portare dati non serve a nulla. 


Ti invito a fare come esperimento quello di chiedere ad amici o parenti quanti pensano siano i casi di femminicidio all'anno ( nel caso non lo sappiano ovviamente ), avrai risposte che vanno ""dai 500 ai 1000-2000 casi, se non di più"" poi quando sentono il vero numero rimangono sorpresi senza elaborare oltre. 


Ad oggi i media riportano poco più di 100 casi senza contare che i femminicidi [appurati al 100%](https://femminicidioitalia.info/lista/2023) sono 39, ma essendo 39 una cifra ridicola gonfiano a 100 e passa, che rimane comunque ridicola al netto dei casi/coppie esistenti. 

Poi i dati di donne che uccidono il partner ( nonostante di notizie di cronaca ci siano ) sono difficilissimi da trovare, ma magari non esistono? /s",1
ka0xh9g,17z2hci,24,Suna96,Michellall,Ero sarcastico... /s su reddit sta per sarcasm,0
ka0wn1n,17z2hci,24,Suna96,Michellall,Ah quindi non è possibile abolire gli omicidi e i femminicidi per decreto? /s,0
ka2wjxm,17z2hci,1,vorticusw,Scarsocontesto,"Infatti non sto ascoltando più niente, dopo aver ascoltato della cagata del patriarcato, del ""mi vergogno di essere uomo"", o della mancanza di democrazia in Italia (cit. Jebreal). Sembra che le colpe siano ora della scuola ora dei padri. Ora io dico che se c'è stata una persona che mi ha insegnato il rispetto delle donne quella è stata mia madre così come accettare le sconfitte nella vita e nei rapporti.",3
ka2x2yl,17z2hci,1,vorticusw,chrisdove,Adesso però dopo aver sentito la spiegazione di questa presunta società patriarcale ripetete a pappagallo questo concetto che non ha fondamento.,3
ka07376,17z2hci,1,cenof94172,rossi46go,"È questo il punto. 

Il dogma odierno del giornalismo e dei dibattiti in tv è la spettacolarizzazione del dolore e non fare corretta informazione.

La direzione intrapresa è: cosa crea engagement? Cosa fa fare più click? Cosa provoca indignazione e il tifo da stadio?

Io sono DISGUSTATO dal mondo odierno.

Un mondo dove i furbi e gli amorali non si fanno scrupoli a sfruttare gli altri per ottenere vantaggi personali o di categoria, ma anche politici, economici ecc.

Questo è lo specchio della società che si traduce anche nella politica.",14
ka0byra,17z2hci,24,cidra_,AostaValley,"su instagram non c'è karma , c'è il fare follower e sfornare post/storie regolarmente per mostrare al mondo che esisti",1
ka0bo55,17z2hci,1,chrisdove,anidiotwithaphone,Direi che OP è vittima lui stesso di una società patriarcale e non riesce a dare il giusto peso a ciò che è successo. Che si faccia due domande,-3
k9yj5dm,17z2hci,24,paolomic,frds3,"Il problema è che se viene considerato come un “folle”, si rischia di ridurre le sue responsabilità, giustificandone addirittura l’operato. Il ragazzo non è un pazzo ma piuttosto un CRIMINALE. Dietro all’assassinio della ragazza vi era un piano studiato da tempo e di cui lui era ben consapevole.",53
ka05kct,17z2hci,1,notfeelinglikeit,rossi46go,Stampo e incornicio questo commento,3
ka0j8i5,17z2hci,24,dumyspeed,suitorarmorfan,"su 200 omicidi finora in italia 65 sono donne, il resto uomini. cos'è un omicidio su una donna vale più di quello su di un uomo? fammi capire",2
ka0f50f,17z2hci,24,dumyspeed,suitorarmorfan,"perchè si parla di donne uccise? e non di persone uccise? forse spostando il discorso su un piano più oggettivo, quindi introdurre il concetto magari di forza fisica rispetto al sesso  per dire, non sarebbe male. ci sono tanti uomini che sono molto esili e deboli e che se togli il sesso M o D, subiscono lo stesso trattamento.  
Ma come sempre in Italia ci si lascia trasportare dalla moda del momento",2
k9yby9i,17z2hci,24,Goldenscarab_7,Sir_elle,"Assolutamente si, sono d'accordo",2
k9y8qcp,17z2hci,24,Goldenscarab_7,Sir_elle,"Secondo me la laurea è giusta, alla fine aveva gia completato la tesi e avrebbe solo dovuto esporla giovedi scorso, tanto vale dargliela. Poi certo è solo un gesto simbolico, ma ci sta",31
ka3d1m2,17z2hci,24,Goldenscarab_7,arramburi,Ma infatti :( che ingiustizia. Anche per la sorella di lei (non so se Giulia avesse anche un fratello più giovane). Davvero non ci voleva,2
ka3a4nh,17z2hci,24,Goldenscarab_7,arramburi,È vero ma non dargliela sarebbe un po' brutto secondo me,2
k9y3yr8,17z2hci,24,Minimum_Opening_8363,Sir_elle,Correggo che la laurea ad honorem la puoi richiedere per qualunque persona muoia durante gli studi,19
k9zu43c,17z2hci,24,Sil_Choco,nicmel97,"Certo, un genitore non lo direbbe mai e non mi aspetto che al primo comportamento strano uno si aspetti che ammazzi qualcuno, però tutti si erano accorti che questo ragazzo non stava bene, ma il padre insisteva nel dire che andava tutto bene e che aveva una gelosia normale, quando in realtà era praticamente ossessionato. Ovviamente, non dico che doveva aspettarsi che il figlio diventasse un criminale, ma se noto che mio figlio sta male da mesi, forse un minimo mi preoccuperei e mi farei delle domande sulla sua salute e proverei a farlo stare meglio. Poi magari mio figlio non ammazza qualcuno, ma almeno starà meglio con se stesso e avrà  relazioni amorose più  sane.",5
k9ye58f,17z2hci,24,Sil_Choco,Platonex93,"Parlo di chi ammazza persone e spesso ti ritrovi il parente o il vicino di casa che dice ""non farebbe del male a nessuno"", ""salutava sempre"", ""era educato"". 

Il fatto che qualcuno sembri non pericoloso non è garanzia di sicurezza, bisogna prestare attenzione a certi campanelli di allarme, che in questo caso tanti avevano notato, ma nessuno ha provato ad occuparsene.",7
k9y6q74,17z2hci,24,Sil_Choco,frds3,"Invece è un buon esempio, proprio per dimostrare che anche dietro il tipo con la faccia da bravo ragazzo si può  nascondere un mostro. È pieno di persone che ""non farebbe mai nulla del genere"" e poi invece lo fanno.",47
ka07kxa,17z2hci,24,Sil_Choco,mph99999,"No, ma mi pare ovvio che ai loro occhi non ci fosse alcun problema e che il suo comportamento fosse assolutamente normale e che di conseguenza non abbiano fatto nulla. Magari sarebbe bastato parlarci per convincerlo a cercare aiuto, però far finta che vada tutto bene è l'errore più grosso e di genitori che chiudono gli occhi e che pensano di avere dei santi in casa ce ne sono a bizzeffe e sarebbe ora che si diventasse tutti più responsabili.

La rabbia per questo caso, come per altri, è  che si sarebbe potuto fare moltissimo per evitare questo epilogo. Non era un pazzo serial killer con problemi psichiatrici, era un tipo come ce ne sono tanti con evidenti problemi nella gestione delle emozioni.",3
ka07xmk,17z2hci,24,Sil_Choco,ezioauditore456,"Da come ne parla, lui era consapevole che non stava bene e che era geloso, solo che ai suoi occhi la cosa era normale. Non c'è bisogno di controllare whatsapp per capire che tuo figlio sta male se hai un minimo di spirito di osservazione.

Poi ovviamente ripeto, non dico che il padre doveva aspettarsi che questo andava ad ammazzare qualcuno, ma se fossi un genitore e vedessi mio figlio ridotto ad uno straccio per una relazione finita mesi prima, due domande me le farei e proverei ad aiutarlo.",2
k9ztpus,17z2hci,24,Sil_Choco,ezioauditore456,"Ovviamente non pensi che tuo figlio ammazzi qualcuno, ma se noti che dopo mesi è ancora ossessionato da una ex, qualche domanda non te la fai? Non puoi pensare che vada tutto bene e che sia una ""gelosia normale"". Al di là di tutto, c'è anche un grosso problema sull'ammettere il fatto che qualcuno abbia un problema di salute mentale e sull'impegnarsi nell'aiutarlo. È  sempre più  facile illudersi che vada tutto bene",0
k9zpe6v,17z2hci,24,Luigi_delle_Bicocche,Desperate-Pea-2091,"d'accordo in parte. c'è molto da dire sul profilo psicologico, e questo lo stabiliranno i periti, ma che questo non si frapponga tra lui e il fatto che ha accoltellato una che centrava meno che nulla con i suoi problemi.
è chiaro che questo ragazzo avesse qualcosa fuori posto, ha fatto ricerche su kit di sopravvivenza, come se davvero si aspettasse di poter vivere nei boschi per fuggire alla legge. 
il suo piano sembrava il piano geniale di una mente instabile, perfetto in ogni dettaglio, se non fosse che si trattava di un piano pensato per essere attuato in un mondo ed in una realtà completamente diverse da quella in cui questo ragazzo ha cercato di attuarlo",3
k9zohha,17z2hci,24,Luigi_delle_Bicocche,frds3,"purtroppo conosco un ragazzo che, detto molto approssimativamente, mi da le stesse vibes",2
k9zocp9,17z2hci,24,Luigi_delle_Bicocche,paolomic,"un conto è la definizione legale, un altro quella dispregiativa che gli viene attribuita in questa sede meno ufficiale (credo)",9
k9zonm1,17z2hci,24,Luigi_delle_Bicocche,Sil_Choco,"ma in realtà conosco un ragazzo che me lo ricorda molto, e ti assicuro che nonostante molti lo vedano come ""il bravo ragazzo"", a me spesso fa venire i brividi, soprattutto quando approccia altre ragazze, infatti faccio di tutto per fargli capire che ha degli approcci di merda, ma, a quanto pare, vani. e non ha nulla a che fare col ""patriarcato"" il suo essere in quel modo",10
k9zxkvi,17z2hci,24,Luigi_delle_Bicocche,AlbatrossAdept6681,"d'accordissimo, parlavo di ""folle"", che da jna parte può essere inteso come ""incapace di intendere e di volere"" e dall'altra può essere usato come insulto . nel senso che il definirlo un folle non è inteso per ridurne la colpa, ma solo come sfogo personale",5
k9zrk7w,17z2hci,24,Luigi_delle_Bicocche,hangupnegatives,">Se guardi bene tra le righe molto spesso ha un sacco a che fare col patriarcato

d'accordo in parte, mi sembra più incapace di intrattenere rapporti umani col genere femminile, e come conseguenza segue quei guru e quant'altro.

>Btw adoro il tuo nick, sotto il sole ti spacchi le nocche presumo

e da giovane il mio mito era l'attore Dennis Hopper",6
k9yc6kx,17z2hci,1,TrolledSnake,WillyMckenna,"In certi casi si, ma più che ""incel"" sono ""volcel"" (volontariamente celibi): donne che per qualche motivo non vogliono mettersi insieme a qualcuno (e fin qui, legittimo) MA allo stesso tempo ne soffrono molto e sputano bile.

Ne conosco una che si, non sarà Miss Italia ma sa essere empatica e simpatica e invece decide di mostrarsi come acida e scostante a mezzo social.",23
ka0mskd,17z2hci,24,raccot15,South_Creme181,"Ho letto tutto il thread, ti volevo ringraziare per la tua analisi estremamente lucida e pacata. Hai scritto quello che avevo in testa e che non sarei riuscita ad esprimere così bene.

In questo momento - come in tutti i momenti come questo, mi sento molto confusa, triste e arrabbiata perchè sembra che gli eventi si ripetano ogni volta allo stesso modo. 

Sono questi interventi  che mi fanno credere che tutto sommato, anche se nei social c'è tanto rumore, stiamo effettivamente riflettendo come società. 

Grazie a te e tutte le persone che si prendono del tempo per discutere al fine di costruire e non cercare nemici da combattere.",3
k9x5539,17z2hci,24,Nigel_Bligh_Burns,allegrigri,"Così però si finisce per evitare legami sentimentali because killing patriarcato. In generale, estremizzare non è mai bene, ma sui social hai letteralmente solo tifo da stadio che poi non risolve nulla e anzi costringe molt* a non avere proprio nulla a che fare con l'altro sesso.",9
ka1liw5,17z2hci,24,Nigel_Bligh_Burns,ezioauditore456,"Ti direi ""le relazioni arricchiscono l'animo"", ma se vuoi qualcosa di scientifico posso al massimo citare l'apertura verso l'ambiente esterno ed evitare il regressismo.",0
ka03tij,17z2hci,25,msricdt,Clank_8-7,"Che è come vive una donna normalmente, in genere. Sì, è atroce.",0
ka01yty,17z2hci,24,mph99999,LadyMacSantis,"Beh io esco di casa ogni giorno, vado a lavoro, frequento persone, sono fidanzato.

Usando le parole ""cultura tossica del possesso"" ad una persona che legge viene in mente un fenomeno diffuso, sembrano parole dure, molto più dure di quello che avviene realmente, ovvero coppie normali che fanno una vita normale, qualcuno eserciterà più potere sull'altro, probabilmente sarà la persona più attraente dei due che scambia la propria attrattività con più potere nella relazione, ma non lo fa in modo malvagio o tossico, poi ricordiamoci che i partners ce li scegliamo eh.  


Tra l'altro dire a qualcuno di uscire di casa, sembra più un tentativo di sminuire l'altro, ad esempio anche tu ti sei comportata in modo ""tossico"" ora, forse dovresti essere la prima a razzolare bene.",0
ka01a82,17z2hci,24,mph99999,LadyMacSantis,"Si ma bisogna anche decidere le proprie battaglie, non si può allo stesso tempo lottare per l'uguaglianza quando poi si mettono in risalto solo i propri possibili problemi, non è che puoi obbligare le persone a dare priorità ai tuoi quando quelli personali degli altri vengono ignorati, la vita è un dare e avere.  


La vita non è rosa e fiori, la possessività e la gelosia sono emozioni che proviamo tutti specialmente se siamo persone che credono nell'amore e/o nella monogamia ma anche se non ci crediamo possiamo comprendere che chi ci crede provi queste emozioni, ora so che questo può triggerare qualcuno che legge come tentativo di giustificare le gesta di questo ragazzo, ma non è così.  


Non c'è nessuna cultura tossica del possesso, ma ci sono persone che sono infelici, depresse, che provano dolore che poi fanno gesta che possono sembrare folli, nel mondo esistono gli stupidi, i forti, i deboli, i ricchi, esistono persone che non riescono a gestire le proprie emozioni come questo ragazzo, la pagherà molto cara per quello che ha fatto, ma non si può eliminare la stupidità dal mondo, ma si può rendere le persone più forti, o cercare di renderle più felici, perché alla fine quelli che sembrano pazzi sono persone tristi ed infelici.",0
