comment_id,post_id,debate_group,comment_user_name,commented_user_name,comment_body,comment_score
j7g9y64,10v8sey,18,Heisenberg_9373,zultan3,"Non devi aspettare di sapere “come finirà”, è già finita così, basta vedere cosa hanno mangiato al WEF gli stessi che ti dicono di mangiare insetti.",16
j7g81ae,10v8sey,18,Heisenberg_9373,Jekhyde95,"Le élite hanno scoperto che possono guadagnarci molto di più facendoti mangiare insetti che le bistecche. 

Ovviamente si spaccia questo come “sostenibile” come se a qualcuno importasse qualcosa della sostenibilità.",-19
j7g5y18,10v8sey,18,Heisenberg_9373,Simo__25,"Paranoia? L’olio di palma (come anche tutti gli oli di semi) è pressoché veleno e vengono utilizzati perché costano due lire.

Erano critiche del tutto sensate.",-5
j7gae3y,10v8sey,18,Heisenberg_9373,No-Mycologist-34,Gli insetti sono una pessima fonte di proteine consumata in paesi che non possono permettersi economicamente la carne.,-2
j7gi6x8,10v8sey,18,Heisenberg_9373,obihz6,Infatti non mangio nemmeno crostacei.,7
j7ghxkf,10v8sey,18,Heisenberg_9373,rd973,"Friggere negli oli di semi è letteralmente la cosa peggiore possibile, già l’olio di oliva è meglio.",-1
j7g8ws7,10v8sey,18,Heisenberg_9373,acetaldeide,"Si zio tranquillo, vogliono che mangi gli insetti perché sono sicuri ™ e nutrienti ™.

Ti vogliono bene 😌",-20
j7gauok,10v8sey,18,Heisenberg_9373,ciskoh3,"Africa, Asia e Sudamerica cioè paesi poveri che li consumano perché non hanno alternative.

Sono proprio sicuro che tra una bella bistecca e le larve tritate preferirebbero le seconde bro, ne sono sicurissimo, hai ragione tu.",-13
j7kyuot,10v8sey,21,Frequent_Dig1934,RegularAvailable4713,"Ok, ammetto che questo può avere senso come discorso, piuttosto che dire semplicemente ""lol mangia i grilli e stai zitto"" come certi altri su questo post. Non risolve al 100% il problema di cose come le pizzerie però già meglio di niente.",2
j7jt7io,10v8sey,21,Frequent_Dig1934,RegularAvailable4713,"Sì, magari solo sul retro in caratteri piccolini e con un nome strano che non fa capire subito cos'è. Io invece voglio un timbro bello grosso con l'immagine di un grillo al centro della parte frontale, come i timbri ""vegano, non ogm, gluten free"" ecc.

E poi questo non risolve il problema di trovarla in cibo già pronto preparato da altri tipo in una pizzeria.",2
j7gn2f3,10v8sey,18,SnowySoul0,Shiro97x,La logica si è tagliata le vene quando ha letto questo commento,2
j7hc5k3,10v8sey,18,Shiro97x,_Nahual_,"Rispondo per punti. Innanzitutto no, non è affatto vero che chi mangia insetti sia solo una piccola parte della popolazione:

""L'Organizzazione delle Nazioni Unite per l'Alimentazione e l'Agricoltura (Fao) ha stimato che l'entomofagia, cioè il consumo di insetti da parte dell'uomo, è una pratica alimentare seguita da circa 2 miliardi di persone nel mondo (AA. VV., 2013).""

cioè il 25% dell'intera popolazione. 1 persona su 4 in tutto il mondo. 

Secondo punto, hai specificato che ""e secondo me generalmente meno gradevoli di altri cibi"", ed hai perfettamente ragione. Però appunto per questo, è solo questione di gusti e abitudini, niente di più.

Terzo punto:

""siete voi che fate finta di non schifarvi (visto che la gente si schifa davvero per gli insetti, fonti anche di innumerevoli fobie, guarda un po') quando poi al primo grillo in casa urlate e sbraitate, e mangiarli neanche nei peggiori incubi""

Prima di tutto, io assolutamente no, anzi adoro ogni insetto e non mi sono mai lontanamente schifato o spaventato. Ma, a parte questo, davvero credi sia un'argomentazione valida? Tantissime persone schifano e hanno paura dei crostacei e di tanti tipi di pesci. La stragrande maggioranza di persone nel mare salta ogni volta che si sente toccata da qualcosa nel mare o non può neanche guardare tra gli scogli che ha un senso di ansia forse anche maggiore di quello che si ha con gli insetti, ma mi sembra che il pesce e i crostacei siano considerati alimenti più che ottimi, non credi?",0
j7ghbcq,10v8sey,18,Shiro97x,_Nahual_,"C'è una quantità di gente enorme nel mondo che mangia insetti normalmente, considerandoli Ottimo cibo, quindi con che ragionamento sostieni che dovrebbe far vomitare tutti? Basta abituarci, non ci vorrebbe manco tanto. Io per fare la mia (piccola e quasi inutile) parte ho ridotto la carne quasi a zero pur non essendo vegano, ma se ci fossero altre fonti di cibo animale sostenibile le mangerei senza problemi.

È come se tutti i contrari immaginassero di dover mangiare vermi crudi e vivi, magari ancora sporchi di terra. Viviamo in una nazione dove letteralmente mangiamo di tutto, tra interiora, lingue di mucche, cervelli fritti che un botto di gente (me compresa) considera specialità, e poi facciamo finta di schifarci per degli insetti. 

Io vedo solo in """"voi"""" quelli che fanno forzature e  che ""per di dimostrare di essere ""giusti"" direste di tutto"" semicit.",4
j7gddfi,10v8sey,18,Broutythecat,_Nahual_,"Guarda, non vedo il senso di tentare di convincere uno sconosciuto su reddit che i chapulines mi piacciono un sacco e le patatine del discount mi fanno cagare quando tu hai deciso, basandoti sul nulla, che tanto sono una bugiarda. Vai con Dios e congratulati della tua onniscienza.",5
j7lgf9k,10v8sey,18,Propenso,_Nahual_,"Mai detto sia bello e buono mangiare gli insetti.

Molto semplicemente sono molto meno intensivi in quanto a consumo di risorse, il ché potrebbe risultare utile in futuro.

Personalmente non ho provato per cui non ti so dire però si, sembri un po' un boomer retrogrado.",1
j7kpcr0,10v8sey,21,Elpedro30,RegularAvailable4713,"Non ce niente di “ipocrita” nella loro retorica. È un azienda veronese che racchiude la vendita di prodotti tipici della nostra cultura e dieta. Da quel che so la dieta mediterranea non include insetti o altro. Quindi dove è il problema ? Rompete il cazzo sul parmigiano sulle vongole o la pancetta nella carbonara “pekke non è originevole” ma la pizza con la farina di grillo speciale, l ipocrisia è la vostra non quella di naturasi, che continua a rimanere coerente.",3
j7k1tyz,10v8sey,21,Elpedro30,RegularAvailable4713,"Anche a me fanno schifo. Ma su questo Reddit sembra che se partecipi alle loro crociate sei un boomer. Naturasi non vuole mettere in vendita farina di grillo? Sti cazzi vai alla Conad. No invece mostriamo il nostro essere scj dicendo che il colorante x è preso da insetto y, e che una minima percentuale finisce nelle farine di grano. Manco sheldon di bbt era così caga cazzi",2
j7ghmfe,10v8sey,21,Elpedro30,MrAlagos,Si. Ho vissuto in campagna e sono stato tra maiali pecore oche galline e cazzi vari. Qual è il problema se natura si non vuole vendere gli insetti? Ci devono piacere per forza ?,6
j7gb1c3,10v8sey,18,No-Mycologist-34,Heisenberg_9373,"Sono un'ottima fonte di proteine, leggiti almeno [uno](https://www.google.com/amp/s/www.lacucinaitaliana.it/news/trend/insetti-alternative-proteiche-carne/amp/) dei miliardi di articoli che lo provano in tutto le lingue del mondo invece di sostenere complotti a caso.",13
j7ga5by,10v8sey,18,No-Mycologist-34,Heisenberg_9373,"La verità è che in generale dovremmo consumare meno carne, perché la verità è che gran parte dell'inquinamento viene dal metano prodotto da mucche. Abbiamo troppi allevamenti di mucche nel mondo, e non sarebbe male se si prendesse l'abitudine di mangiare carne una volta a settimana invece di tutti i giorni.
E chiamalo come vuoi, ma gli insetti sono una fonte di proteine che viene consumata sia come sostituto sia accostata alla carne in molti paesi asiatici. E probabilmente pure in Occidente fra un po' di decenni.",7
j7gezsl,10v8sey,18,No-Mycologist-34,MrBietola,"Be, gli insetti sono avidamente consumati in molte parti dell'Asia, quindi direi proprio che non sono cancerogeni.
Certo che se ti fai un hamburger di cavallette e lo incenerisci mangiandoti la parte bruciata è cancerogeno.",4
j7gngj8,10v8sey,18,Fvhrry,Ghaladh,Eccomi.,3
j7iq5zb,10v8sey,18,RiLawSkyHigh,_Nahual_,"Ridaje, non hai capito (però ti vedo bello convinto anche su altri commenti quindi non sono io)

Perchè non dovresti volere farina di insetti? 2 motivi:

_ti fa schifo? Come dici tu i gusti non sono oggettivi, quindi questo motivo non ha senso (il mio discorso sulle lumache era una esagerazione per farti capire);

_altro (se vuoi aggiungi tu)

Semplice, nessuno obbliga la gente a mangiare insetti, stiamo solo ragionando",1
j7illyw,10v8sey,18,RiLawSkyHigh,_Nahual_,"Ti spiego: l'unico motivo per cui si va contro a questa storia è ""che schifo mangiare gli insetti"" e posso capirlo.
Ma se ci basiamo solo su un fattore come questo è ridicolo pensare che le lumache (per quanto storiche) siano accettate quando oggettovamente fanno ribrezzo.

Non è una discussione sul gusto, semplicemente un ragionamento neanche troppo complicato; se poi mi dici che non vuoi la farina di insetti per altri motivi va benissimo, semplicemente questo discorso dello schifo per me ha poco senso.",0
j7ihtr0,10v8sey,18,RiLawSkyHigh,_Nahual_,"Quindi i vecchi stanno difendendo la tradizione? Non ha senso quello che dici

Alla gente fanno schifo gli insetti, ed è ridicolo che non gli facciano schifo le lumache, punto.",1
j7ihw9p,10v8sey,18,RiLawSkyHigh,Amsalpotkeh,In parte vero ahah,1
j7id097,10v8sey,18,Dron3_,_Nahual_,"Vengono paragonati ai gamberi per il tema degli allergeni (entrambi hanno un esoscheletro base di chitina) ma almeno i gamberi hanno della carne dentro, gli insetti emolinfa. 

Il mio parere è che la filiera degli insetti puo essere un bel mercato per molti imprenditori. Dal punto di vista economico non dovrebbero essere cosi costosi. Usano scarti organici, poco spazio e la lavorazione appunto in farina necessita l'essiccazione (ovvero gas). Essendo al chiuso possiamo aggoungere il vertical farming se sei furbo e cosi piu sostenibile. Non ci trovo nulla di male, alla fine la gente si muove verso i soldi.

Comunque siamo anche nell'epoca in cui il consumo di carne diminuisce, il consumatore si sposta sui burger vegetali, un attenzione in piu verso quello che si mangia c'è ed aumenta anche la richiestandi proteine. Studi sull'alimentazione ci sono... che cazzo vogliamo di piu? Ancora stiamo a rompere le palle? 

E poi per me questo è progresso, oggi non funziona ma c'è, domani magari prende piede.

 Probabilmente anche quando circolò la prima macchina la gente avrebbe preferito comunque il cavallo. Guarda ora dove siamo..",2
j7ib53i,10v8sey,18,Dron3_,_Nahual_,"Innanzitutto la propaganda sugli insetti non è pressante. Nessuno ti sta dicendo di comprarli o di abbandonare la tradizione, è solo un opportunità in piu che hai di scegliere.

Poi  personalmente ho fatto parte di un panel test in cui ero appunto a giudicare questi prodotti a base di insetti, ho assaggiato precisamente la larva del Tenebrio Molitor e il grillo Acheta Domesticus citato prima. Sono stato chiaro dopo il panel: questi prodotti venduti cosi come li vendete all'estero (francia e olanda gia grandi produttori) in Italia non vanno. Devono essere usati come supplementi nei prodotti come farine, anche per aumentare i valori nutrizionali in termini di proteine (principalmente perche gli insetti essiccati o carammelati non sanno di molto, sanno del gusto che gli dai).

Il formaggio che si produce in sardegna, dal punto di vista dell'haccp fa schifo al cazzo! Far appoggiare una mosca su un formaggio per farle depositare le larve non è igienico. Dove cazzo è stata quella mosca prima di mettersi su quella forma di formaggio? Certo è buono il formaggio, ok... grazie larve che svolgete un ottimo lavoro di produzione di metaboliti.. ma fa comunque schifo se permetti.. 

Se fosse regolamentato e abbia un disciplinare di produzione sarei piu contento ma dettagli...

Su altri temi dove si espressa la comunità europea (vedi etichetta alcol) non mi esprimo. Talvolta danno dei buoni pareri altre volte sparano minchiate. D'altronde è politica anche questa anche se siamo in un mercato europeo",2
j7i8egp,10v8sey,18,Dron3_,_Nahual_,"No ma è ben differente quello che stai dicendo e credo che tu non sia informato a riguardo. Bandiscono un formaggio sardo perche non è normato e la filiera di questo prodotto va contro alcuni regolamenti della food safety. Con me caschi male, perche sono un tecnologo alimentare, ho fatto una tesi sugli insetti edibili e li ho anche assaggiati (quelli sul mercato europeo).

Al momento in europa sono passati solo alcuni insetti autorizzati dall'efsa ma ci sono voluti anni prima di immetterli sul mercato, tutto ciò dopo la crisi della BSE. Il problema degli insetti deriva dal bioaccumulo di metalli pesanti, che a quanto pare, per alcuni insetti attualmente in commercio come l'Acheta domesticus sembra che non diano problemi",2
j7hjajt,10v8sey,1,gatto_21,Flogisto_Saltimbanco,"Carne prodotta tramite cellule staminali credo, appunto sintetica",3
j7hxofu,10v8sey,1,Global-Programmer641,Flogisto_Saltimbanco,Mai bevuta una coca cola? Cosa pensi che sia un succo di frutta?  è tutta chimica e fra l altro la vendono pure al natura si,2
j7iiepd,10v8sey,20,dyprexg,cancerc00kie,"Più che sul biologico NaturaSì è fondata sul biodinamico, che è un ammasso di pratiche non solo pseudoscientifiche ma anche letteralmente esoteriche",1
j7k7v3b,10v8sey,18,l_maf,silma85,Oppure marinare con aglio e prezzemolo. Non plus ultra.,1
j7k7p68,10v8sey,18,l_maf,Trengingigan,"Il vino d'una volta era una solenne merda. Ci vuole scienza e conoscenza, altrimenti ti può venir bene solo a botte di culo.

In sostanza, ci potevi condire l'insalata.",2
j7ju2r1,10v8sey,1,DonquixoteAphromo,dnxpb64,Assolutamente si.,13
j7jtyig,10v8sey,1,Crispino-San,dnxpb64,Come l'olio di palma?,2
j7k7mqw,10v8sey,1,thuiop2345,dnxpb64,Esatto.,2
j7hdtzu,10v8sey,22,were_meatball,zuppaiaia,Nono per cucinare almeno bolgheri. La carne del brasato la devo marinare almeno in 70€ di bottiglia,2
j7hdiwh,10v8sey,22,were_meatball,zuppaiaia,Ma io lo bevo apposta perché l'alcol è cancerogeno e perché mi piace il retrogusto di insetto ovvero artropode,1
j7gppvu,10v8sey,23,sbranzo,luckymethod,O cosa sono le uova,23
j7gqokb,10v8sey,23,sbranzo,Pandinuuu24,Le uova sono le mestruazioni delle galline,26
j7gcrcd,10v8sey,18,Venake666,luckymethod,O nell'olio d'oliva,39
j7h7vhj,10v8sey,18,Venake666,jerdabile87,"""Ho modificato il seme di questa pianta per farla crescere in ogni clima e con una solo goccia d'acqua""

""GnaeeEeE cI vOglIOno MOdifICarE il dNA!!1!1!!""",7
j7h4m1w,10v8sey,18,Venake666,ntonyi,Non hai idea di quante mosche/moscherini stanno sulle olive quando vengono pigiate al frantoio,4
j7gmtew,10v8sey,18,Ricky710_,rd973,E se mangi il miele di melata è letteralmente Sbocco di api fatto con gli escrementi degli afidi 😅,6
j7js3fh,10v8sey,18,The_Eternal_Wayfarer,theCarelessWhisker,Vabbè pollo adesso,2
j7jsh46,10v8sey,18,The_Eternal_Wayfarer,Trengingigan,Come consistenza sono pressoché identiche ai molluschi di mare.,3
j7gn7i6,10v8sey,18,Izzosuke,nucelom,"Sono entrambi cibi che in futuro prenderanno il sopravvento, che fin'ora hanno passato tutti i test di sicurezza risultando edibili, di cui la gente ha paura solo perchè non ha i mezzi per capirli. Ci sta metterli sullo stesso piano",16
j7glygh,10v8sey,18,Izzosuke,MarvelousJarro,"Aggiungerei anche: 3) non è che se nel suoermercato sta la farina di insetti il cassiere ti forza a prenderla, sei sempre libero di scegliere che farina usare. Non rompere le palle a chi non la pensa come te",7
j7ml7e5,10v8sey,18,Izzosuke,jerdabile87,"Non è questione di essere contenti, è una questione di fatti. Quella agli OGM è solo una guerra fatta per partito preso nata solo dalla disinformazione e dall'ignoranza",1
j7gj7ls,10v8sey,18,Izzosuke,jerdabile87,"Gli OGM sono sia validi che sicuri, ma la disinformazione ha convinto la gente del contrario",16
j7gkcat,10v8sey,18,silma85,SaraF_Arts,"Avevo letto ""La carne è meglio anche se equina"" e stavo già concordando e preparando cipolle e limone",69
j7gluxa,10v8sey,18,silma85,_Nahual_,"Per farti capire quanto questo discorso sia scarso e assolutista, proponi un bicchiere di latte fresco a un indiano o pakistano.

Vedi cosa ti risponde.",1
j7gi858,10v8sey,18,jerdabile87,Capable-Reach-3678,sei sponsorizzato dal WEF?,3
j7mk6x6,10v8sey,18,jerdabile87,Izzosuke,contento tu,0
j7grzpa,10v8sey,18,CalabreseSeriale,Capable-Reach-3678,"Ci fosse un'infinità di studi come per la carne, forse scopriremmo qualcosa anche sul consumo regolare di determinati tipi di insetti",2
j7gdifp,10v8sey,18,CalabreseSeriale,Silver_Rms91,"Che noia sti paragoni inutili. Fino a quando non trovate un verme o uno scarafaggio che ha la stessa quantità di carne all'interno, che ha la stessa quantità di interiora facilmente rimovibili, la stessa consistenza morbida e lo stesso sapore di gamberetti/gamberoni, i vermi potete tranquillamente mangiarveli voi e lasciare gli ""scarafaggi del mare"" a noi altri",4
j7jmeu9,10v8sey,18,fucilator_3000,Capable-Reach-3678,Ma mangiateli tu,0
j7jmhsk,10v8sey,18,fucilator_3000,theCarelessWhisker,"Ma chissene frega se inquina meno, mangiati tu i vermi e insetti.",0
j7jml37,10v8sey,18,fucilator_3000,ciskoh3,Infatti spero che molta gente si converta al cibo a base di insetti. Così la carne resta per gli altri 😜,0
j7g51xu,10v8sey,19,SoloUnoDiPassaggio,theCarelessWhisker,*Pollo* poi è un parolone,49
j7gh6ds,10v8sey,19,CalboniGeomLuciano,theCarelessWhisker,"Ho provato un po’ di insetti e dei cracker a base di farina di insetto. Alcuni fanno un po’ schifo di aspetto, anche se non mi capacito di come il mio cervello faccia lo schizzinoso mentre per dei mostri marini come gamberi, scampi e astici mi butta la bava in bocca (anche ora che lo scrivo).

Quelli più piccolini li mangi come noccioline.

Il sapore di fondo è tutto uguale e non particolarmente piacevole, ma spesso sono aromatizzati (dal cioccolato al peperoncino) e quindi sanno dell’aroma che gli viene dato.

Niente di speciale. Attendo con molto più interesse i cibi sintetici, inteso come carne cresciuta in vitro o comunque separata da un animale senziente. Quella si che sarebbe una svolta.",1
j7gg1yl,10v8sey,19,CalboniGeomLuciano,CapitalistFemboy,Se mescoli vegetariano con omeopatico poi finisci tu nel torto.,9
j7ghjec,10v8sey,18,obihz6,theCarelessWhisker,"In realtà non è così male, ho provato i cracker fatto con la farina di insetto e non senti praticamente nessuna differenza da un cracker normale se non per il fatto che è più corccante",0
j7gh5vn,10v8sey,18,obihz6,Heisenberg_9373,Sai che i crostacei sono dei parenti stretti stretti dei insetto,3
j7gdbqa,10v8sey,1,Arkhye,CapitalistFemboy,"Feci un colloquio a NaturaSì anni fa. La proprietaria ( o manager? ) Mentre laddetta faceva le domande, stava dietro ad osservarti per percepire la tua ""energia"" ( dichiaratamente eh!). Non credo ci sia da aggiungere altro.",32
j7ggrz4,10v8sey,1,rosmarino1,CapitalistFemboy,"il motivo dell'associazione di vegano/vegetariano con mamma pancina, antiscientifica e pseudosalutista sarebbe?",3
j7gory6,10v8sey,1,Sufficient-Big5798,Flogisto_Saltimbanco,"Parlano della carne sintetica, ad esempio. Ma fin lì ci può stare, quella ha i suoi problemi",2
j7go5ds,10v8sey,1,Sufficient-Big5798,rosmarino1,"Più che associazione é l’intersezione delle due cose. Non tutte le mammine antiscientifiche sono vegane e non tutti i vegano sono antiscientifici, certamente, é semplicemente il target di natura sì",9
j7g8vmp,10v8sey,18,Thomas_Bicheri,MarvelousJarro,"Lungi da me fare il complottista o il cagacazzo, però per amore di precisione c'è una differenza anche solo ""psicologica"" tra

* contaminante accidentale in tracce non rilevabili  
(come nella farina o nella pasta o nella -ebbene sì- birra)
* colorante/additivo  
(come nell'aranciata)
* ingrediente principale  
(come, mi pare di capire, sarebbe per la farina di grilli)

Secondo me quindi ""ci sta"" se qualcuno fa un distinguo.

Poi tutte le pippe sulle Nostre Tradizioni, sull'UE Kattiva che ci impone cose, eccetera eccetera, rimangono parole in libertà con ben poco senso dietro, ci mancherebbe.",24
j7g9jyk,10v8sey,18,Thomas_Bicheri,Jekhyde95,"Costano molto poco da allevare, in termini di risorse e spazio, e hanno un'alta densità proteica.

Nell'ottica di combattere il cambiamento climatico di recente l'UE ne ha autorizzato (con determinati paletti) la commercializzazione.",2
j7gfl72,10v8sey,18,rd973,MarvelousJarro,"vero anche quello, ma i crostacei son brutti tanto eppure  la gente mica li schifa! ![gif](emote|free_emotes_pack|joy)",4
j7gcqza,10v8sey,18,rd973,MarvelousJarro,ti suggerisco un altro punto: il miele è sostanzialmente vomito di api,13
j7gdm41,10v8sey,18,rd973,Jekhyde95,L'Unione europea ha emesso una normativa che consente la vendita di insetti a fini alimentari. Non obbliga nessuno ad usarli o consumarli. La gente da fuori di matto perchè... perchè boh.,7
j7gje0k,10v8sey,18,rd973,Heisenberg_9373,controlla il punto di fumo dell'olio di palma,3
j7ge5vz,10v8sey,18,rd973,Heisenberg_9373,ecco bravo... continua a friggere con l'olio d'oliva che fa più bene /s,4
j7gcz7o,10v8sey,18,rd973,CountryInteresting,per quanto ne sappiamo potrebbe essere anche più buona...,5
j7ggshs,10v8sey,18,rd973,PrettyCombination6,e i molluschi... non  dimentichiamoci dei molluschi e la loro dieta!,6
j7ggk3i,10v8sey,18,rd973,ReactionHot6309,e i molluschi mangiano violette....,5
j7gbtmx,10v8sey,18,Marcello70,theCarelessWhisker,"Il problema è, se invece c'è sotto qualche secondo fine, se non faranno di modo che diventi la sola e unica fonte di cibo con qualche artificio e imposizione ""per il bene di tutti"". Già ""Bill il buono"" sta promuovendo la vaccinazione animale e vegetale obbligatoria, nonchè che si deve dar da mangiare carne sintetica ""ai paesi ricchi"" e quella naturale ""a quelli poveri"". Poi ci si mettono quelli che tentano di corroborare le sue posizioni facendo della scienza una religione, appellandosi a quel che la prima dice sulla ""sostenibilità"", quando è vero piuttosto che esista un esubero di produzione di carne invenduto e che nessuno ""stranamente"" vuole utilizzare. Mangiamo carne da 50k anni e non è mai accaduto nulla: sarà ""riprovevole"", ma tra queste proteine e quelle di insetti sarebbe meglio usare le prime o  al limite nessuna delle due, dato che sussistono valide alternative alle proteine animali nel mondo vegetale, senza abbrutirsi come dei Renfield e a costo triplicato.",0
j7gg2xs,10v8sey,18,Marcello70,MarvelousJarro,"Certo, certo: l'importante è che utilizzino ancora (fino a esaurimento) L'UNICO esempio con cui stanno tentando di farti mangiare il bacarozzo ""per il tuo bene"".",2
j7gc3b2,10v8sey,18,Marcello70,MarvelousJarro,"Prove che il mondo degli insetti sia già addirittura il 90% di ciò che mangiamo? In secondo luogo, la famosa cocciniglia apportata a mò d'esempio per cui si deve mangiare l'insetto, a parte che si usa da millenni, ormai è desueta: i suoi utilizzatori vanno a scorte d'esaurimento, da quando hanno scoperto che fa malissimo, al pari di altri coloranti rossi chimici.",5
j7gnzdk,10v8sey,18,Marcello70,zultan3,"Ma perchè, ce l'avevano?",3
j7ggv1g,10v8sey,18,Marcello70,zultan3,"Il bello sai cosa? Che sono ipercapitalisti e ricevono supporto da chi si spaccia per filo-socialista, specie se ragazzini. Sono riusciti pure in quello: ma non era molto difficile.",8
j7gcodj,10v8sey,18,Marcello70,zultan3,"Il problema magari non è che li vogliono vendere: ci potrebbe anche stare, se hanno un mercato di chi li compra... Ma che stanno iniziando a discriminare altri alimenti per far sì che la maggioranza della popolazione occidentale passi a mangiarli.",11
j7gjspr,10v8sey,18,Marcello70,Silver_Rms91,E' adeguatissima.,1
j7gchx4,10v8sey,18,Marcello70,Silver_Rms91,Gerdo gerdo...,0
j7gcqyb,10v8sey,18,Marcello70,Heisenberg_9373,"Esatto. Però non diciamolo senò è ""gombloddo"".",17
j7gctsv,10v8sey,18,Marcello70,Heisenberg_9373,And own nothing.,11
j7gatfd,10v8sey,18,Marcello70,No-Mycologist-34,Gerdo gerdo...,2
