comment_id,post_id,debate_group,comment_user_name,commented_user_name,comment_body,comment_score
l52d6tu,1cwqkqe,0,Good_Anywhere1616,AirlineUnited,"Bah penso che dovresti essere tu ad informarti meglio sulla gente a cui dai il voto ed interrigarti sull'opportunismo di certe alleanze, ad ogni modo penso che intraprendere una doscussione con qualcuno che vota renzi carfagna et simila sia una perdita di tempo. Ciao ciao",2
l51mc66,1cwqkqe,0,Good_Anywhere1616,AirlineUnited,Che c'è gente che non ci vede un problema e ancora li vota,2
l4xzsgs,1cwqkqe,2,Bourbaki88,Stev-svart-88,"Continui a fare il paragone con Sgarbi, come se fossero gli unici due candidati. Il bello è che in un altro commento sopra hai scritto:

> Serve rappresentanza seria, competente e soprattutto moderata in Europa

E poi vai a difendere una che non ha nessuna competenza e soprattutto non è per niente moderata. Non è la persona giusta, non importa molto se riesci a trovare di peggio.",15
l4xybvh,1cwqkqe,2,Bourbaki88,Stev-svart-88,"No, quel processo è ancora in corso. 

È condannata in Italia per resistenza a pubblico ufficiale, invasione di edifici e altre. Più un bel po' di denunce. Sgarbi non mi interessa, è un corrotto, ma la Salis non ha alcun rispetto per le istituzioni ed è una facinorosa.",11
l4xx1s6,1cwqkqe,2,Bourbaki88,Stev-svart-88,"Anche la prima candidata di Alleanza Verdi Sinistra è una pluricondannata. Lungi da me difendere Sgarbi come politico, ma se vuoi criticarlo meglio farlo da un altro angolo.",14
l4znvjt,1cwqkqe,2,Duke_De_Luke,lgr95-,"Boh, per qualcuno con un briciolo di memoria queste cose contano. Non si cancella il passato.",0
l4znwdb,1cwqkqe,2,Duke_De_Luke,shushi77,"Marco Pannella era perfetto, infatti non lo votava nessuno.",5
l4zo78g,1cwqkqe,2,Duke_De_Luke,IsidoroAsap,"Verdi contro il nucleare LOL fa già ridere così.

Peccato perché se ci fosse un partito ambientalista per non bifolchi lo ascolterei con interesse. Ma prenderebbe tre voti....",0
l50g8r2,1cwqkqe,2,Duke_De_Luke,AtlanticPortal,"Sono N domande, non c'è solo l'Ucraina. Sono neutrale rispetto alla questione (a dire la verità tendenzialmente favorevole, ma con limiti ben chiari).
Ad ogni modo il punto non è analizzare le mie vedute politiche...",2
l4zo0ak,1cwqkqe,2,Duke_De_Luke,KosmoKrato,"Beh è il limite più grande della democrazia. I candidati fanno ciò che vuole la gente affinché siano votati, non ciò che è realmente necessario.",3
l4zxa6x,1cwqkqe,2,lgr95-,Duke_De_Luke,"È la politica.
Assieme al PD, per esempio, cerano anche i partiti comunisti in passato. Questo vuol dire che ORA il PD è un partito di estrema sinistra e non di centrosinistra? 

Se quell' alleanza non c'era Calenda non poteva presentarsi alle elezioni del 2022. Il fatto che due anni fa si siano alleati per potersi presentare alle elezioni (alleanza poi revocata dallo stesso Calenda), non penso abbia un influenza alle elezioni attuali.",2
l4ztpyr,1cwqkqe,2,emberedfieldsadust,Mr87Robb,"Sì, assolutamente. È un discorso che in linea di principio condivido, infatti non mi sento disincentivato dal fatto che AVS potrebbe non superare la soglia, il mio dubbio è sui programmi e i candidati.",3
l501v6x,1cwqkqe,2,emberedfieldsadust,AR_Harlock,"Sì, ma se entra AVS la politica nucleare non è a rischio, dato che anche i popolari sono a favore. Preferisco votare su altre cose dato che ho la certezza che una legge sul nucleare passerebbe comunque",1
l4zyas6,1cwqkqe,2,strangeaslove,WryNail,"Le mie idee sono fondamentalmente social democratiche, non voterò mai liberali. Siamo su due pianeti completamente diversi in quanto a politiche economiche, welfare e ruolo dello stato.",1
l4zraep,1cwqkqe,2,strangeaslove,Budget-Solution-8650,"Ma infatti! Ma poi industriale imprenditore, palesemente messo la da confindustria per tutelare i loro interessi, ha spaccato il fronte di sinistra alle ultime elezioni favorendo in maniera importante la vittoria di meloni, e ancora esce fuori alle europee? E menomale che reddit è lo spaccato dell'Italia intelligente.",8
l4zni3w,1cwqkqe,2,strangeaslove,KosmoKrato,Ma scusa quando mai si è attenuto a quello che aveva promesso in campagna? Bisogna guardare anche alla credibilità di certe promesse.,4
l50cezh,1cwqkqe,2,CapitalCan6257,teorm,Si. Esattamente. I più grandi sostenitori di vannacci stanno a sinistra. Prendera tutti i voti grazie a gente come Parenzo,1
l4zui7w,1cwqkqe,2,CapitalCan6257,teorm,"Ho gia preso un paio di red flag dopo essermi esposto su putin, e altre cazzate…non vorrei essere nuovamente bannato. Diciamo che non sono di destra ma odio la sinistra radical chic",4
l4zwsq3,1cwqkqe,2,WryNail,Duke_De_Luke,Credo sia il meno peggio nello scenario di tutti gli altri politici che abbiamo.,2
l50byyx,1cwqkqe,2,WryNail,strangeaslove,"Hai criticato un approccio al voto desueto, dicendo che per te é vetusto votare liberale. Per me invece è desueto votare su ideologie e stilemi che neanche esistono più, piuttosto che votare programmi e piani di azione.",2
l4zxwmb,1cwqkqe,2,WryNail,strangeaslove,"Secondo me stai facendo politica ad personam e sbagli. Guarda i programmi di Azione e degli altri schieramenti, ti renderai conto che non c'è proprio paragone.",2
l50c9i9,1cwqkqe,2,WryNail,Gerxx,Peccato che il tuo meno peggio è talmente variegato che è un po’ come buttare una monetina nella fontana di trevi.,5
l50bpe5,1cwqkqe,2,WryNail,Gerxx,Non ho capito,2
l4zo1c1,1cwqkqe,2,shushi77,Duke_De_Luke,Vero!,1
l4zfip8,1cwqkqe,2,shushi77,strangeaslove,">ma adesso si sa bene chi è.  

Cioè? E il cavaliere senza macchia e senza paura in Italia chi sarebbe? La Meloni? Salvini? Schlein? Per piacere...",5
l4zteiz,1cwqkqe,2,shushi77,Resident-Trouble-574,Non credo che sia il suo progetto politico.,1
l4zj840,1cwqkqe,2,shushi77,samuele_v,Touché!,2
l51mp7r,1cwqkqe,2,shushi77,Zealousideal-Comb700,"Non è alleato con Renzi alle europee. E ha lasciato l'alleanza con il PD perché si sono alleati con il M5S, non con +Europa, se non sbaglio. L'alleanza del PD con il M5S in effetti è da nausea per me.",2
l50e7ki,1cwqkqe,2,GuybrushT79,Bourbaki88,Solito qualunquismo sui 5s,1
l5ftrn0,1cwqkqe,2,GuybrushT79,bister_is_here,Stai mostrando i limiti di non capire la differenza tra una norma e dei truffatori,1
l5fqk88,1cwqkqe,2,GuybrushT79,bister_is_here,"Sulla carta sono inoccupabili, visto che probabilmente hanno la terza media, età alta e questa specializzazione difficilmente documentabile.",1
l5ai8k2,1cwqkqe,2,GuybrushT79,bister_is_here,"E se la gente truffa lo stato è colpa del reddito? Come ho già detto, allora togliamo le pensioni di invalidità visto che ci sono comunque molte truffe",1
l5007mb,1cwqkqe,2,eulerolagrange,FilippoArezzo,"Voterei un partito più a sinistra in Italia se ci fosse un partito di dimensione e organizzazione simile al PD, quindi mi ""accontento"" della componente socialista democratica del PD.

Diciamo che in Francia ho apprezzato l'esperienza della NUPES. In questo momento votare un PS alla Glucksmann è come avere un PD con capolista alle europee, non so, Guerini. Se il PS non vuole fare il ""campo largo"", voterò La France insoumise (per quanto io non ami molto Mélenchon).",2
l55abz1,1cwqkqe,2,IamSmartNotYou,bister_is_here,Devi essere un gentleman del 1800,1
l4xztlb,1cwqkqe,2,thirdarcana,IsidoroAsap," È una posizione piuttosto stupida, sono d'accordo.  🙂


Ma sono d'accordo con il resto, quasi tutto.",7
l50cqdo,1cwqkqe,2,Gerxx,WryNail,"E rimane preferibile riempire la fontana di Trevi che tenerla in tasca, così da non permettere allo stolto di dire che lo scolo dalla fogna è più importante solo perché ne sono cadute di più in proporzione.",2
l50c4m6,1cwqkqe,2,Gerxx,WryNail,"Voto il meno peggio per non far ingrassare i numeri di chi invece vota, ma vota il peggiore.",3
l5049b0,1cwqkqe,2,Gerxx,WryNail,Votare loro per non fare arrivare coloro che si promuovono per quegli esatti motivi per il quale non li voti.,0
l50ejdj,1cwqkqe,2,Blissard,ilMarsh22,Verissimo,1
l50eown,1cwqkqe,2,Blissard,WryNail,Alleati perchè da soli non arrivavano manco al 2%,1
l4zkoxw,1cwqkqe,2,Chjji22,shushi77,"Perché hanno tutti partiti personali, tranne il PD e Avs",3
l550c1f,1cwqkqe,2,Chjji22,bister_is_here,"Punto di vista interessante, però rimane l'unico partito con una guida contendibile. Con un miliardo di difetti, che mi hanno portato a non votarli quasi mai, anche per ragioni politiche. Crescendo apprezzo invece questo aspetto, che dovrebbe essere strutturato diversamente e non come è ora, come hai descritto bene tu. Però proprio perché c'è una guida nuova che prova a dettare una linea a me più vicina, voglio provare a darle sostegno, per quel che vale il mio voto. Anche perché la conta interna non sia a vantaggio die vari Tarquinio

Un'altra cosa che apprezzo è che non nel PD tendenzialmente non hanno la ""bava alla bocca"" come la maggior parte dei politici nell'area di centro",1
l4zq8ml,1cwqkqe,2,Chjji22,No_Boss_1496,"Non li ho mai votati in sostanza, voglio dare fiducia a Schlein, il percorso sarà lungo e imperfetto, ma ho una flebile speranza che porti un po' più di sinistra nel principale partito dell'area progressista... Voglio sostenere questo percorso, anche perché io credo nei partiti plurali e tutto il resto sono quasi tutti partiti personali",1
l4zqk0z,1cwqkqe,2,IsidoroAsap,Duke_De_Luke,Sogno il giorno in cui l'avvocato dell'atomo & boldrin facciano un partito.,0
l4xzgjz,1cwqkqe,2,IsidoroAsap,thirdarcana,Partito che non vuole il nucleare in Italia ☠️💀,20
l4xznzd,1cwqkqe,2,IsidoroAsap,Stev-svart-88,Eh? Che delirio,4
l5giypv,1cwqkqe,2,IsidoroAsap,monsty62,"""In Italia è troppo tardi per introdurre il nucleare""

Anche no, abbiamo fino al 2050 per ottenere risultati concreti. Meno valutazioni ideologiche e più dati grazie. 

https://www.ilsole24ore.com/art/nucleare-impatto-italia-45-miliardi-e-500mila-posti-lavoro-entro-2050-AFJuqWQC",1
l5g8wx2,1cwqkqe,2,IsidoroAsap,monsty62,"Non può partire nulla se prima non si trova un'intesa con le aziende, i lavoratori ed i sindacati. Inoltre l'opinione pubblica è ancora troppo divisa. Sicuramente eleggendo un partito contro otterremo risultati migliori 👍🏻

Il parlamento europeo è importante anche per l'Italia altrimenti come pensi di far approvare le leggi? ☠️",1
l4ztc4i,1cwqkqe,2,Resident-Trouble-574,shushi77,"Penso che Calenda punti su quello. Fa tante cazzate, ma tutte da cinque minuti, così se nel mezzo ce n'è qualcuna più grave, nel giro di pochi mesi finisce sommersa da tante cazzatine più recenti.",2
l4zylmu,1cwqkqe,3,Klutzy-Weakness-937,teeodeeo,Il fatto che il solo dire che voti a destra è trattato online in questo modo incrementa notevolmente la mia voglia di votare a destra. Downvotatemi in cabina elettorale lol,1
l52jc9f,1cwqkqe,2,Capelion22,shinodaxseo,"Ok, comunque il tuo ragionamento fila alla grande",1
l4zjogs,1cwqkqe,2,Capelion22,shinodaxseo,Forse volevi scrivere 140k? 14k annui è la metà di quanto guadagna una figura junior,0
l4zmc15,1cwqkqe,2,Interesting-Will-382,lgr95-,"Non me ne frega un piffero, dopo la porcata che ha fatto alleandosi con un doppio giochista pugnalatore alle spalle, figlio illegittimo del berlusca,  ha dimostrato anche la sua pochezza.",11
l4zn4y4,1cwqkqe,2,Interesting-Will-382,shushi77,"Un errore del genere, si paga tutta la vita. E chiunque decidesse di allearsi con quello mollusco di uomo merita eldi essere segnato a vita.",-3
l51q50o,1cwqkqe,2,Interesting-Will-382,Alive_Subject_7853,"Lo farò. Davvero. 

Rimane che Renzi , ha poi sentito il bisogno di frantumare anche quel poco/nulla (qualora hai ragione) che fosse rimasto dell articolo 18. 

Come uno schiaffo simbolico a tutta la classe lavoratrice dipendente. 

Rimane una merda di essere umano. 

Ho molto molto molto più stima del puttaniere, figure di merda internazionali, colusso mafioso che fu Berlusconi. 

Saluti",1
l50kg4n,1cwqkqe,2,Interesting-Will-382,Alive_Subject_7853,"La Fornero aveva indebolito l'articolo 18. 

Venne cancellato nel 2015 dal Jobs act. 

Informati.",1
l4zms4n,1cwqkqe,2,Interesting-Will-382,Alive_Subject_7853,"Ma come fai a votare SUE con Renzi e Mastella?? 

Ma come fai!!  

Dopo che Renzi ha cancellato con il benestare del PD l'articolo 18. Unica forma di tutela che avevano i lavoratori. 

E non mi venire a dire che bisogna riformare il mercato del lavoro, che oltre a quell' atto non ha modificato nulla più.",4
l4zn1g7,1cwqkqe,2,Interesting-Will-382,Raikkonen716,"Purtroppo la gente ha la memoria corta, anzi cortissima...",3
l4zmwil,1cwqkqe,2,Interesting-Will-382,r_m_z,Vero. Non bisogna votare con l'idea delle soglie a condizionarci... Altrimenti ci buttiamo la zappa sui piedi.,7
l4zp2ah,1cwqkqe,2,Interesting-Will-382,LoETR9,"Ricordo benissimo. 
Perché stavo per votarlo, aveva già raccolto tutte le firme necessarie per un suo simbolo, e solo dopo il suo simbolo si alleò con Renzi facendo due calcoli di convenienza alla cazzo di cane. 

E sinceramente, puoi parlare furbescamente quanto vuoi, e puoi avere anche ottime idea, ma le azioni valgono e comunicano molto di più... 

Con quell' azione hai dimostrato nei fatti di essere 
1) semplicemente coglione,
2) non avere sensibilità del popolo, ma vivere e respirare solo aria del palazzo, e giochi tattici da tavolino
3) non avere dei principi guida. Perché chiunque con dei principi saldi e stabili, non si allena con chi cambia direzione con ogni sfogliata di vento. 

Ripeto, se ti allei con Renzi, meriti di scomparire dal contesto politico. Stessa cosa con gente come Mastella e tutti i vecchi croci scudati che pensano solo a star attaccati alla poltrona.",-1
l4zz926,1cwqkqe,2,FilippoArezzo,eulerolagrange,Fra ma tra LFI e PD c'è un abisso. Visioni politiche COMPLETAMENTE opposte,1
l4zua7x,1cwqkqe,2,FilippoArezzo,Budget-Solution-8650,Lol,3
l4ztwxd,1cwqkqe,2,FilippoArezzo,Budget-Solution-8650,"Reddit Italia è pesantemente influenzato dalla cultura liberal e woke Americana, normale che loro per sinistra intendono diritto umanesimo, snobismo da ZTL, antifascismo di facciata, neoliberismo thatcheriano da macelleria sociale in campo economico",14
l4ztz52,1cwqkqe,2,FilippoArezzo,Educational_Solid382,"Fra, tutto l'arco parlamentare è turboliberale on steroids",2
l4zz4a1,1cwqkqe,2,FilippoArezzo,ilGeno,Appunto. Nessuno che parli di monetizzare il debito,1
l507fhs,1cwqkqe,2,FilippoArezzo,Nash_41,"Sì io ti parlo di quello che vedo di come mi sembra funzionino le cose a me. Ti do assolutamente ragione sul fatto che, purtroppo, c'è un grosso stacco tra il piano delle idee e quello della realtà, dove si infilano ipocrisia e opportunismo",3
l504xje,1cwqkqe,2,FilippoArezzo,Nash_41,"Monopoli e rendite di posizione, insieme al fatto di mettere lo stato al servizio dei capitali privati e non semplicemente limitarne l'influenza che ha su detti capitali sono l'essenza del neoliberismo e ciò che lo differenzia dal liberismo classico rendendolo estremamente eversivo e pericoloso.",3
l4zhlkn,1cwqkqe,2,Alive_Subject_7853,strangeaslove,Per la cronaca: il taglio dei vitalizi è del governo Letta,7
l65jfu6,1cwqkqe,2,Alive_Subject_7853,Interesting-Will-382,"Evidentemente perché nessun mafioso ha ammazzato dei tuoi parenti.

Umanamente fai pena. Addio",1
l50l2im,1cwqkqe,2,Alive_Subject_7853,Interesting-Will-382,"Non sei informato: c'è una sola differenza a livello di licenziamento senza giusta causa tra uno e l'altro.

Se non la sai, è bene che tu approfondisca

PS: ""indebolire"" non vuole dire nulla, occorre essere più precisi",1
l50clfa,1cwqkqe,2,Alive_Subject_7853,Interesting-Will-382,"Primo: l'articolo 18 lo ha cancellato la Fornero nel 2011 con il governo Monti, informati.

Secondo: voto solo affiliati ALDE.",1
l4zj5ii,1cwqkqe,3,Both-Sector-7560,teeodeeo,"Ti va di argomentare perché Meloni? 

Cosa ti piace del suo programma? (tra l'altro non ci andrebbe lei, ma uno dei suoi meno popolari, quindi non vale ""ha un bel carattere, non si fa mettere i piedi in testa, è una del popolo""...)",3
l4zsi4p,1cwqkqe,2,Mr87Robb,emberedfieldsadust,"Secondo me anche se un partito non sfonda l'1% ma è allineato alle nostre idee va votato, altrimenti si rischierebbe che i partiti piccoli non riusciranno mai a sfondare la quota minima proprio perché ""tanto non passa la percentuale"", ma se iniziassimo a votarli allora la % aumenterebbe.

Spero di essermi spiegato",9
l4xz4ws,1cwqkqe,2,Stev-svart-88,Bourbaki88,"Eh sai com’è, è anarchica, ha scelto una posizione anti-politica in un paese conservatore di centro destra da 24 anni.

Meglio una giovane anarchica ma con le idee chiare, che ha qualcosa da dire anziche un vecchio bavoso corrotto puttanone che ricopre ruoli costituzionali e al quale paghiamo il vitalizio.",-16
l4xxeoa,1cwqkqe,2,Stev-svart-88,Bourbaki88,"Condannata per aver pestato un neonazista? Lo trovo ridicolo, i neonazi se lo meritano.

Vediamo un po’ il curriculum di Sgarbi: frode, furto, falso, evasione fiscale, vilipendio, offese pubbliche…devo andare avanti?",-13
l4z5rt2,1cwqkqe,3,teeodeeo,Defiant-Muscle9379,"Hai letteralmente riprovato ciò che ho detto. Vota chi ti pare, se pensi di non prendermi sul serio per chi scelgo di votare ribadisco, è un problema tuo e di quelli come te. Un saluto",-5
l4zrdaz,1cwqkqe,2,Raikkonen716,Budget-Solution-8650,"Verissimo. Da sempre più anni i termini sinistra / destra vengono usati a sproposito per indicare quello che fa più comodo, ma ormai non hanno quasi più nessun valore rispetto agli orientamenti ideologici che si sono creati. Il popolo di Reddit è decisamente giovane, lo si vede anche nella presa (interventista) che fa la guerra.",4
l51fn3r,1cwqkqe,2,drunkside41,teorm,"no, controlla bene",1
l517j3i,1cwqkqe,2,drunkside41,teorm,in appello è stato smontato praticamente tutto,1
l4zvu88,1cwqkqe,2,teorm,CapitalCan6257,Quindi non voti a favore di Vannacci ma contro la sx in pratica,6
l4zocdp,1cwqkqe,2,teorm,CapitalCan6257,Cosa ti convince?,1
l50ivy0,1cwqkqe,2,teorm,GuybrushT79,"La penso come te, hai praticamente descritto i governi del nord Europa che difatti sono i miei preferiti avendoli sperimentati.",3
l51b0hy,1cwqkqe,2,teorm,drunkside41,"Sì ma per prescrizione, non assoluzione per non aver commesso il fatto",1
l512vd2,1cwqkqe,2,teorm,drunkside41,Ma non ha commesso truffa e vari altri reati?,2
l552dsu,1cwqkqe,2,teorm,bister_is_here,"Perché? 

Le uso anch'io e per nozionismo che trovi pure su Wikipedia non vedo alcun problema. 

Cosa ha riportato di sbagliato?",1
l550ols,1cwqkqe,2,teorm,bister_is_here,"In realtà sono un mix. 

https://chatgpt.com/share/f81d080b-ebde-4e81-86a6-413fc7ddda45",1
l4zznfe,1cwqkqe,2,Froslass638,Ciwabacca,"Calenda Prime quando era candidato a sindaco non era affatto male, perché era l'unico con un programma a prova di bomba e ben documentato. Poi va bè, era ovvio vincesse Gualtieri visto il sistema totalmente mafioso dei voti a Roma, però c'era almeno l'intenzione 

Convinse persone anche politicamente lontane dalla sua area come il sottoscritto",6
l5594m3,1cwqkqe,0,AirlineUnited,Good_Anywhere1616,"Top argomentazione, grandissimo. Persone come te sono quelle intelligenti della famiglia",4
l5292ec,1cwqkqe,0,AirlineUnited,Good_Anywhere1616,"Io non vedo il problema e li voto

Però effettivamente vorrei capire perchè si dice questo. Potresti spiegarmi o mandarmi info/articoli a riguardo per capire meglio?",1
l4zyklh,1cwqkqe,0,AirlineUnited,Good_Anywhere1616,Perchè qual è il problema?,-2
l5g687t,1cwqkqe,2,monsty62,Bourbaki88,"in realtà il programma dei 5S mi ha sorpreso, uno dei più completi, coerenti e interessanti. Non avrei mai pensato di prenderli in considerazione per il voto, anche se penso che non li voterò in quanto non fanno parte di nessun partito e/o gruppo europeo",1
l5g9csp,1cwqkqe,2,monsty62,IsidoroAsap,"Otterremmo gli stessi risultati, in Italia è troppo tardi per introdurre in nucleare, e inoltre sull’opinione pubblica ancora pesa molto il referendum",1
l5g73l4,1cwqkqe,2,monsty62,IsidoroAsap,"sticazzi sinceramente, in italia abbiamo già la maggioranza che è a favore del nucleare, eppure non stanno facendo nulla. Qui si sta votando per il parlamento europeo, non per l’Italia",1
l5gaox5,1cwqkqe,2,monsty62,magalas_79,non è che tutti siano favorevoli alla democrazia eh,1
l5g92j4,1cwqkqe,2,monsty62,AccurateOil1,mi dispiace,1
l4zt2y9,1cwqkqe,2,tlcd,Duke_De_Luke,Questa fa male.,5
l50t43o,1cwqkqe,2,Status-9417,Duke_De_Luke,Ho fatto il test e mi é uscito Italia Viva 72%. Aspetta un attimo che vado a farmi una pinta di candeggina.,6
l4ztied,1cwqkqe,2,Tomisido,Duke_De_Luke,Che test?,2
l4znov4,1cwqkqe,2,GLeo21,Duke_De_Luke,Grosso errore,1
l4zwg66,1cwqkqe,2,AtlanticPortal,Duke_De_Luke,Se hai fatto il test ed è uscito Santoro sarai contro il supporto all'Ucraina. Meh.,-2
l4zwp2m,1cwqkqe,2,AtlanticPortal,LoETR9,Certo che era quella l'idea ma poi ha sentito la puzza di avere il M5S dentro. Ed è scappato. Su quel punto almeno bisogna ammettere la coerenza. Da sempre contro.,1
l4zwddo,1cwqkqe,2,AtlanticPortal,pretzel567,Per mandare su gente contraria ad una politica energetica intelligente e che quindi spingerebbe ancora una volta la UE nel baratro? No grazie.,12
l4zxvzj,1cwqkqe,2,Ciwabacca,beavisorcerer,"Io non so quelli che votano Calenda come fanno, questo in base a come si sveglia cambia idea. 

Dai commenti che leggo pare che sia il ritorno al nucleare quello che attira di più verso Azione e potrei anche essere d’accordo ma ci dimentichiamo che siamo in Italia… ora che dovessimo riuscire ad avere una centrale nucleare funzionante saremmo già oltre il 2050, ci serve qualcosa di più rapido per affrontare crisi energetica e cambiamento climatico…",4
l501xvg,1cwqkqe,2,Ciwabacca,ilGeno,"Eppure dopo 6 mesi, se veramente lo credevano così negativo, avrebbero potuto fermare il superbonus. In 6 mesi solo pochi cantieri sarebbero partiti, invece la bolla come dici tu l’hanno lasciata crescere durante il governo Draghi. 

Tutti lo volevano prorogare, tutti eh perfino Fdi che era all’opposizione, quindi dare tutta la colpa ai 5S è il solito scaricabarile all’italiana.",1
l4zy7vb,1cwqkqe,2,Ciwabacca,ilGeno,"Dire che l’ha lasciata agli altri è una bella bugia visto che l’hanno fatto cadere Renzi e company. 

Inoltre il superbonus doveva essere a scalare negli anni proprio perché sapevano che non era sostenibile nel lungo periodo invece Giorgetti ( che ripeto l’ha gestito per 3 anni e mezzo, Conte 6 mesi scarsi ) l’ha tenuto uguale.",0
l4zwlus,1cwqkqe,2,Ciwabacca,ilGeno,"Sta storia del 110 è vecchia, ti ricordo che chi ha gestito il superbonus negli ultimi 3 anni e mezzo è Giorgetti nei governi Draghi e Meloni. Se era così devastante avrebbe avuto tutto il tempo per toglierlo e invece no, tutti i partiti da Fdi al Pd hanno sempre votato per continuarlo. 

Il governo Conte l’ha introdotto nel luglio 2020 ed è caduto nel gennaio 2021. Praticamente non ha fatto neanche in tempo a vederne gli effetti.",-1
l50tpnz,1cwqkqe,2,Ciwabacca,elasticboundary,"Il problema è che in Italia è più probabile il mai che il 2050 per il nucleare. 

Questo articolo ( [intervista](https://www.today.it/economia/energia-nucleare-italia.html) ) dice 15 anni per 15 reattori nucleari ma sappiamo bene come funzionano le cose da noi. Bisogna almeno raddoppiare 😅",1
l54zcik,1cwqkqe,2,bister_is_here,beavisorcerer,"Non voto Calenda ma non capisco il problema.


Cioè magari voglio fare il sindaco ma se non sono eletto sindaco non mi interessa fare il consigliere e perdere il mio tempo inutilmente e vado a far altro. 


Dove sarebbe il problema?",2
l5l55c2,1cwqkqe,2,bister_is_here,GuybrushT79,"Man pensala come vuoi,  a una certa non ho interesse a convincerti.


Per me non vanno fatte leggi che facilitano la vita a chi vuol truffare come dici te.
 Se fai una legge che mette soldi in mano a 40 enni, operai specializzati, è piuttosto ovvio che quelli tenteranno di prendere quei soldi e lavorare comunque in nero.


Soprattutto se poi i controlli sono zero.",1
l5ft7yq,1cwqkqe,2,bister_is_here,GuybrushT79,"Al di là dell'età di questi (che comunque uno ha meno di 40, e gli altri due sono sotto i 50)
Stai mostrando tutti i limiti e la miopia di chi ha concepito il reddito.


Dai soldi a chi potenzialmente è in grado di lavorare e di fatto lo fa facendolo in nero",1
l5di9ts,1cwqkqe,2,bister_is_here,GuybrushT79,"Io ho contestato che ""La gente che prendeva il reddito era gente inoccupabile"".


Questo non è vero, stop.
Ciò che stai dicendo adesso è un altra cosa. ",1
l54z4wm,1cwqkqe,2,bister_is_here,GuybrushT79,"""La gente che prendeva il reddito era gente inoccupabile""


In ditta di mio zio ci sono 3 persone che lavorano in nero per avere anche il reddito di cittadinanza.


Operai specializzati, che quindi o teneva così o gli mancavano quelle figure.",1
l550u1z,1cwqkqe,2,bister_is_here,generic-user-jpeg,"I miei zii votano PD da sempre.
Quest'anno hanno sbroccato di brutto.


Cito:
""Ma basta, dicono una cosa, poi ne fanno un altra, poi negano di averla detta, poi negano di averla negata, ma poi in realtà uno del PD era a favore, un altro era contro, non si capisce un cazzo!""


hanno promesso di non votarli mai piu",2
l550vi9,1cwqkqe,2,bister_is_here,IamSmartNotYou,"Per ora, presto promuoveranno quella di 24ore",1
l54ztz0,1cwqkqe,2,bister_is_here,Chjji22,"Il PD è omni personale.
Nel senso che ognuno dice la sua a nome di tutto il PD.


Se ti senti tutte le interviste e dichiarazioni vedrai che per ogni argomento loro sono sia a favore che contro, ma a volte non si esprimono, per dire che poi erano contrari, per poi votare a favore.


Perfino Mio zio, che li votava da sempre, dopo aver realizzato questo comportamento ha sbroccato e ha deciso di non votarli mai più.",2
