comment_id,comment_body,sentiment_pos,sentiment_neg,sentiment_pred,emotion_predict
k9yfohd,"Il vero problema è l'immensa orda di giornalisti e altra gente che non vede l'ora che accada una tragedia per parlanne per settimane, strumentalizzando la notizia, manipolando l'opinione pubblica cercando di dividere le persone in più correnti di opinioni per poter avere dibattiti continui sull'argomento.

Questo finche la notizia non interessa più a nessuno, e magicamente tutti si dimenticano dei dibattiti montati sopra un morto, e allora si può tornare all'unica possibile conclusione che chi ha ucciso è giustamente in prigione, e chi è morto lo è ingiustamente.

Quello che resta impunito è chi ha guadagnato soldi e share televisivo da queste tragedie.",0.012861035764217377,0.9865027666091919,negative,anger
k9xjbzd,"Non è un idiota l'ex ragazzo, è un assassino, punto.",0.04244903102517128,0.9567722678184509,negative,anger
k9zies2,Sono sti ragazzetti sui social che ormai han perso la testa e ogni tipo di personalità e o fanno i cinici finti redpillati o le suffragette a tempo perso ormai ogni cosa nel mondo è A o B e sui social i ragazzetti ci vanno dietro senza pensare.,0.05957745760679245,0.9389570951461792,negative,anger
k9xb0xr,"Non fatevi influenzare dai post, continuate ad essere uomini civili e dimostratelo. Le mele marce ci saranno SEMPRE",0.1061030849814415,0.8851577639579773,negative,anger
k9xmjhd,"ti da fastidio perchè percepisci giustamente che qualcosa nel circo mediatico stona. tutta questa voglia di esprimere giudizi, articolate quanto strampalate ipotesi sociologiche sui perchè e i percome, le strumentalizzazioni, la tv del dolore e della caccia alle responsabilità nascondono il bisogno disperato di avere  il controllo, o meglio l'illusione del controllo. perchè se vogliamo essere lucidi, questo è il tipo di eventi impossibile da prevedere e la gente spaventata celebra i suoi rituali di esorcizzazione grotteschi proprjo per questo motivo (oltre naturalmente ai media che ci mangiano sopra)",0.012424958869814873,0.9870753884315491,negative,anger
k9xj3td,[deleted],0.998242974281311,0.0012967521324753761,positive,sadness
k9zeqj7,"Io sono basita, nei commenti ho letto moltissimi dire che è colpa dei genitori e ancora di più della madre. Capisco che l'educazione e l'esempio siano una parte importante della personalità, ma deresponsabilizzare così un ASSASSINO è una vera follia: non c'è educazione al mondo che ti fa oltrepassare certi limiti.",0.01555083878338337,0.9841273427009583,negative,anger
k9xdoak,[deleted],0.998242974281311,0.0012967521324753761,positive,sadness
k9zsz6f,"Senza niente togliere al grave fatto che è successo, ma non vi scassate il cazzo a fare i finti paladini della giustizia sulla scia dei media vari che portano all'esasperazione ogni dramma solo per fare un po' di audience e click in più? Io non ci credo che ci sia gente che pensa davvero che con un hashtag possa cambiare la natura dell'essere umano, sono 2000 e passa anni che la gente si ammazza per le cose più stupide e non sarete voi a cambiare questa cosa. È successa una cosa terribile, le forze dell'ordine e compagnia bella han fatto il loro lavoro. Basta. Smettetela di fare le cazzo di pettegole di paese. Non è una storia che vi riguarda, non è una storia che riguarda nessuno di noi se non le famiglie coinvolte.
E non venitemi a dire che lo fate per ""fare vedere il problema a tutti"", perché tra una settimana non vi ricorderete nemmeno che sia successo. Un po' come per le migliaia di persone morte in Ucraina, ma ormai quello non fa più notizia, giusto?",0.005428701639175415,0.9941260814666748,negative,anger
k9x4zrt,"Sono un ragazzo di 25 anni e ho seguito molto intensamente la vicenda in quanto veneto e in quanto ero nel ristorante di fianco a dove hanno mangiato loro quel maledetto Sabato.
Non c'è nulla da dire, straziante e dir poco aberrante.
Detto ciò ne ho piene le scatole di quest'odio generico nei confronti di qualsiasi elemento maschile.
Si ci sono delle merde, uomini volgari e ignoranti, soprattutto sul posto di lavoro e molti altri luoghi ma oltre a questi ci sono uomini di uno spessore infinito, uomini che si comportano con grande rispetto, così come ci sono donne volgari e ignoranti e donne di uno spessore altissimo.
L'odio non porta mai da nessuna parte, è solo un catalizzatore di un altro inevitabile disastro, che senso ha screditare milioni di persone per l'atto di un pazzo che ha perso il controllo? Nessuno",0.0037979469634592533,0.9956967830657959,negative,anger
k9y9fmu,"Vorrei dire una cosa, che tra quelle che ho letto sotto personalmente ritengo la peggiore: di questa brutta vicenda, tra una settimana nessuno se ne ricorderà più. Il nome della ragazza scenderà nell'oblio e diventerà un numero da riportare in dati ISTAT che saranno dati al supporto del prossimo caso di femminicidio. Non c'è memoria collettiva, non c'è una vera propensione da parte di nessuno a risolvere il problema, è solo fare casino. Il fatto che queste cose diventino casi mediatici all'istante e spariscano dalle nostre menti poco dopo è secondo me la riprova del fatto che siano solo usate per fare caciara. I social ci hanno reso un gregge di pecore, tutti che belano per risolvere un problema ma nessuno che ne analizza le radici, provi ad identificare uno schema o proponga soluzioni. E mentre sui social divampa la polemica, nella nostra mente piano piano si spenge il volto della ragazza, il suo nome, la vicenda. Tra un mese il ciclo si ripeterà, ma nessuno farà mai effettivamente qualcosa, continueranno solo a sfruttare i nomi delle vittime e il dolore delle famiglie per fare casino finché la gente non si dimenticherà di loro. Che tristezza",0.0028746342286467552,0.996823787689209,negative,sadness
k9wwpa2,Chi scrive #yesallman sono delle 104 mancate,0.24117715656757355,0.7582196593284607,negative,sadness
k9y4eev,"Spesso, le voci più assillanti nei momenti di tragedia sono quelle di chi non ne ha fatto parte, mentre nella quiete rimangono la disperazione di una famiglia che ha perso una figlia e di genitori che dovranno convivere con il senso di colpa delle azioni del proprio figlio.
È importante discutere di queste tematiche, ma alcune conversazioni creano solo danni e diffondono stereotipi. Gli uomini non sono tutti mostri, e le donne non sono tutti angeli, personalmente mi piacerebbe vedere il discorso affrontato da una prospettiva e non come il solito ""al rogo il mostro"". perché questo gesto del ragazzo? Vi era forse qualche disturbo psicologico mai diagnosticato per negligenza? O forse era un concetto di ""relazione e amore"" sbagliato?. Trattare l'argomento così, potrebbe aiutarci anche a riflettere sul bisogno di educare i ragazzi alle relazioni, non solo da un punto di vista sessuale ma anche emotivo e aprirebbe anche la possibilità di prendere veramente sul serio la salute mentale dei giovani. 
Ma a nessuno importa veramente di cambiare qualcosa, vogliamo tutti sentirci gli eroi del momento, dalla parte del giusto, e senza queste tragedie non potremmo.",0.1353714019060135,0.8579708933830261,negative,sadness
ka012fg,"Un uomo uccide la sua ex --> tutti gli uomini vanno rieducati

Un immigrato ruba --> tutti gli immigrati sono delinquenti

Io sta generalizzazione non la capirò mai. Tanta colpa è dei media in generale",0.0703996792435646,0.9290760159492493,negative,anger
k9x9z3j,"E niente, presunzione di innocenza rip

https://preview.redd.it/ypw5gjrsvc1c1.jpeg?width=1080&format=pjpg&auto=webp&s=f29df6e1c59a6625b1946549720b1e5e9c478820",0.9885798096656799,0.010138248093426228,positive,anger
k9xd13t,"Ho visto talmente tanti post e commenti che si schierano ai due poli opposti. Donne e uomini che gridando alla pena di morte, non capendo che perpetuano la stessa violenza che la ragazza ha subito. La morte del tipo non cambia nulla anzi izerebbe solo odio. La pena di morte e da società primitiva, il carcere serve proprio a questo a farti penare per riacquistare l umanità che hai perso. (funziona o non funziona lo scopo è questo). Il bello è che le stesse donne, una piccola parte di queste, incoraggano questa morte anzi addirittura l evirazione, non accorgendosi che non sarebbero diverse dal tizio.

Un altra categoria è quella che scrivi post sui segnali d' allarme, che lo prevedevano e io qui aggiungo che invece di fare i detective conan su internet perché non si alzano e non vanno a manifestare in piazza per introdurre una funzione scolastica dove si insegna l educazione sessuale, intesa anche come educazione affettiva, perché protestare quando si può fare la saccente sui social. 

Ci stanno donne che dicono che TUTTI gli uomini sono violenti e che stanno venendo massacrate, vabbè qui nemmeno bisogna aggiungere altro.

 Ho letto uomini che si scusano di essere uomini, che deficenti porcodio, ma che l hai uccisa tu. Ma che sei stato tu a compiere questo omicidio, una stupidità clamorosa. 

Io da uomo l unico cosa che posso fare è condannare un azione palesemente da deviante, ma non mi devo scusare di nulla. Certe che sui social fino al giorno prima erano gelose, volevano il ragazzo possessivo, geloso etc... Oggi che fanno? Condividono questa robba. Boh di una bassezza infinita. Io non do nessuna colpa alla ragazza perché che colpe ha? Condanno il tipo? Certamente. I social inibiscono l abilità critica delle persone, il fatto che tutti possano avere una voce poi così positivo non è, si genera solo un odio inutile, verso l altro sesso in questo caso.",0.01082482747733593,0.9886375069618225,negative,anger
k9xochb,"Io non so mai cosa dire a riguardo. Quindi mi ricordo che in questi casi è meglio stare zitti. Ma ho l'ansia per il giorno in cui qualcuno/a mi rinfaccerà questa situazione, e penso che l'unica cosa intelligente sarà appunto chiedere scusa o sviare il discorso.

Onestamente sono pure abbastanza turbato, perché ultimamente mi sono dato un po' al true crime e vedendo casi tipo Junko furuta o un altro di cui non voglio fare il nome per evitare sciacallaggio, e con questo caso di Giulia, mi viene solo un nodo allo stomaco, pure pensando che era molto giovane e in procinto di iniziare la fase seria della sua crescita personale.

Forse davvero penso troppo a pararmi il culo da accuse che effettivamente non mi toccano, e non penso abbastanza a ragazze che sono con questa paura. Effettivamente io penso di non conoscere nessuna ragazza che non abbia subito violenze o molestie in qualche modo.

Dall'altro canto tutto ciò mi sembra qualcosa a livello di terrorismo psicologico. Come quando c'erano scandali con stranieri e allora tutti gli extracomunitari erano bestie da tenere sotto controllo. 

Non volevo fare questo papiro lol, mi sono lasciato trascinare.",0.003356667933985591,0.9959099292755127,negative,fear
k9zrewy,"A prescindere dal genere, uomo o donna che sia, una persona che ha anche solo il pensiero di uccidere un’altra persona non dovrebbe appartenere a questa terra. La colpa non è di nessuno, se non del soggetto che commette queste atrocità. E per me parlare di “raptus” in questi casi è semplicemente una paraculata, una persona normale non commetterebbe mai e poi mai un omicidio, non le passerebbe neanche per l’anticamera del cervello.",0.007825957611203194,0.991755485534668,negative,anger
k9zv87l,"A me sembrano assurdi gli insulti atroci ai genitori di lui, come se l'avessero allevato con l'obiettivo di diventare il nuovo Ted Bundy. Questi poveri cristi hanno probabilmente un figlio psicopatico narcisista che ha nascosto per anni la sua vera natura.",0.006809641607105732,0.9929400682449341,negative,anger
k9x0g2l,"A me il post che sta girando su Instagram che fa più paura da una parte, e mi infastidisce come uomo dall’altra è quello che dice: “potevamo essere tutte noi” che secondo me generalizza incredibilmente e dipinge TUTTI gli uomini come assassini. O anche quello che dice “incredibile ritenersi fortunata che non sia successo a me”, come se fosse “normale” per un uomo uccidere una donna",0.6697329878807068,0.3274115324020386,positive,fear
k9zp7fh,"1. l'ex ragazzo non è un idiota, è un assassino di m..da.

2. tutta la pubblicità ci fa pensare che l'italia è molto pericolosa e che le cose vanno sempre peggio.

Invece non è vero per niente: 

1. omicidi in italia sono a una rata più bassa oggi, paragonato agli ultimi 30 anni.

2. dalla prospettiva del' omicidio, l'italia è il paese più sicuro in assoluto di *tutti paesi* UE, tranne Lussemburgo (che per me non conta come un paese normale).

https://www.statista.com/statistics/1268504/homicide-rate-europe-country/",0.08374907076358795,0.9151033759117126,negative,anger
k9zlwc7,Io mi chiedo cosa porti un ragazzo ad uccidere la propria ex ragazza. Io non riuscirei neanche a immaginare una cosa così… non c’è modo alcuno di vedere che una persona è disturbata a questo livello?,0.48295557498931885,0.5159002542495728,negative,sadness
k9yd84g,"Sfumature e ragionamenti complessi non sono compatibili con la velocità dei social. 
Non puoi aspettarti di riuscire a intravedere la reale stratificazione delle opinioni umane attraverso reddit/instagram/facebook e aggregatori vari. 
Questi strumenti, per come sono strutturati, fanno emergere solo posizioni più radicali, che per loro natura sono più adatte a generare il  traffico e le interazioni che sono la linfa di ogni piattaforma social.
Più ciò che dici è radicale e infiammatorio, più traffico e interazioni generi. 
Se le tue opinioni sono tiepide e moderate passi in sordina. 

Cosa c'è realmente da dire su questa tragedia? 
Nulla. Non c'è nulla da dire. Un ragazzo malato e  violento ha ucciso una ragazza. 

Vuoi avere più commenti? 
Allora aggiungi che lui è un incel, che tutti gli uomini sono violenti, il femminicidio ecc ecc. 

Oppure aggiungi che lei se l'è cercata, che gli uomini sono oppressi dalla società ecc ecc. 

E allora vedi che la gente comincia a far rumore, a cliccare, a condividere.",0.10866525769233704,0.8897749781608582,negative,sadness
k9zw9fx,"Aggiungiamo che ho letto di femmine che dicevano cose come ""oh, ho un'ansia assurda all'idea di crescere un figlio maschio e educarlo a dovere"". Luride. Immagina angosciarsi perchè la tua progenie potrebbe essere di un sesso che, secondo la tua deviata percezione della realtà, è naturalmente colpevole ed incline al male in quanto maschio. Augurerei loro tanti figli maschi, se non fosse che quei poretti avrebbero un'infanzia orribile con simili donne come madri. Senza contare tutti gli uomini che dovrebbero vergognarsi di essere tali perchè una minoranza di essi ha fatto cose. Io invece continuo a sentirmi fiero di essere uomo e tale orgoglio aumenta quando vedo quanto si umiliano stoltemente quei folli scusarsi per colpe altrui. E prima che le femministe inizino con l'insulto classico che mi definirebbe incel a cui le donne non la danno, sono omo e le donne mi fanno effettivamente ribrezzo.",0.01338245254009962,0.9855502843856812,negative,fear
k9y2frg,"Ma sì ora spolpano l'osso, poi rimarrà solo il dolore e la sofferenza di parenti e familiari.
Nella speranza che quell'escremento arrestato, diventi a breve il tutor anale di un grosso criminale con una lacrima tatuata sotto l'occhio, tipo compagni di cella x l'ergastolo.",0.36909592151641846,0.6261726021766663,negative,sadness
k9zu5pq,"Io dico che la strumentalizzazione a fini politici e moralistici è solo negativa, la sensibilizzazione si fa in altro modo.

È un po' come schiaffare sulle sigarette una immagine di un tumore e sperare che così le cose cambino, non è così che funziona.",0.005107530392706394,0.9946938157081604,negative,anger
ka0h5g0,"Sono assolutamente d’accordo. Aggiungo che secondo me la protesta fatta sui social, che di base parte da un’idea assolutamente legittima, nobile e condivisibile, arriva spesso a sfociare sempre nell’estremo, nell’esagerazione, diventando totalmente sbagliata rispetto a quelle che sono le intenzioni iniziali.
Non sto dicendo che la protesta per mezzo social sia da criticare: nel 2023 è normale che questo sia uno dei vari mezzi attraverso cui, giustamente, farsi sentire. Il punto è che mi danno estremamente fastidio frasi del tipo “dobbiamo sentirci privilegiate ad essere ancora vive”. Come se una relazione sana o almeno un sano rispetto sia la minoranza, un privilegio appunto: posso dire con una certa sicurezza che, per fortuna, non è (ancora?) così.",0.05333720147609711,0.945121169090271,negative,anger
ka0tlzk,"Spero di non essere massacrato di downvote, ma per me non è manco una questione di ""femminicidio"", nel senso, a prescindere dalla vittima, quel tipo era un cazzo di psicopatico. Poteva essere uno psicopatico uomo come una psicopatica donna ecc. Certo, magari le donne sono più bersaglio perché ritenute ""più deboli"" ma comunque per me la vittima non ha gender e non perché io voglia dimostrare che ""non tutti gli uomini sono così"" ma perché applico lo stesso principio di quando un extra comunitario compie un reato. Non ci interessa sia bianco, nero, giallo o rosso, l'importante è che sia consegnato alla giustizia e sconti TUTTA la pena, stessa cosa che mi auguro per questo ennesimo assassino. Quello che fa riflettere è la mole di persone che ha condiviso i post su IG e poi hanno i fidanzati gelosi che non le fanno andare a ballare, non le fanno mettere foto in costume, uscire con le amiche senza di loro e sapere sempre dove sono :)",0.1466117799282074,0.8343769311904907,negative,anger
ka26al4,"Il problema del tentativo di realizzare un mondo utopico non è tanto il fatto che ci stanno provando, quanto il fatto che invece di diffondere parole d'amore diffondono perlopiù parole aggressive.

Questo mi sembra molto antitetico rispetto al desiderato. Invece di dire generalmente agli uomini che la società è dominata da loro e violenta per ciò, forse sarebbe più produttivo un atteggiamento incentrato sulla retorica dell'evolverci insieme uscendo dal passato. 

Non è che qualcuno abbia torto. Semplicemente, ammettiamolo, siamo fragili. Non si può che reagir male a qualcuno che attacca un aspetto identitario che finora è stato così importante. 

In questo modo, il messaggio che passa è ""gli uomini devono correggersi per noi"". Non è così, non è giusto che lo sia. Ogni uomo sulla Terra è uomo solo perché c'era il 50% di possibilità circa alla nascita di esserlo. Non c'è colpa individuale, non c'è peccato, non c'è nulla. Se il sistema sociale è così schifoso per le donne non è colpa ""degli uomini"", è colpa del sistema sociale, che è evidentemente stato costruito così da alcuni individui che nel passato hanno imposto sistemi, idee e modelli.

È tutto ciò si può cambiare, semplicemente ragionando, educando, capendo, empatizzando. Ma non esiste alcun colpevole ancora in vita dell'esistenza del patriarcato. Esistono colpevoli di molestie, esistono colpevoli di orribili omicidi, esistono colpevoli di voler favorire questo sistema di abusi, ma nessun singolo uomo sul pianeta ha colpa di tutto ciò che è stato. Eppure possiamo prenderci il merito di tutto ciò che sarà, quello sì.

Non è sbagliato il messaggio, è il modo in cui è detto a lasciare massi sullo stomaco. Penso che quello che OP intende con il sentirsi appesantito da questi post è che quasi ognuno di essi tende a far sentire su ogni uomo il peso di eoni di storia, invece che trasmettere un'effettiva spinta, un'effettiva scintilla di motivazione nel mettere fine a tutto questo casino sociale nel quale siamo capitati. 

Scusate il poema, semplicemente ho l'orribile sensazione che le persone tendano sempre di più a essere ostili con le altre, invece che sforzarsi a capire le ragioni fondamentalmente umane che ci spingono a fare ogni cosa...",0.004524984862655401,0.9949918389320374,negative,sadness
k9x5p3q,È fondamentalmente un crimine sporadico come tanti altri. In Italia abbiamo la tendenza anche a dare grande eco a questi avvenimenti. La sparizione dei due giovani e poi anche l’omicidio della ragazza non sono affatto questioni di rilevanza nazionale.,0.833991289138794,0.15090307593345642,positive,sadness
k9wwm4w,"Pensi che ci sia differenza fra il Salvini di turno che fa il suo post su Facebook quando uno straniero, rigorosamente con la pelle scura, compie un crimine e qualche influencer femminista che fa la stessa cosa quando un uomo uccide una donna?

Ce l'hai con una categoria e il caso di cronaca ti dà modo di sfogare quello che provi.",0.9848432540893555,0.0119300102815032,positive,anger
k9wvvou,Ancora un altro post su questa vicenda...,0.9973739385604858,0.000630804686807096,positive,sadness
k9x3d5b,"Perché accusare un uomo binaco etero é sicurezza di internet punti!!!!
Chi si fa scappare una occasione del genere.


Pace all'anima di quella ragazza.",0.09256115555763245,0.0009555784636177123,positive,anger
k9xc4iz,Il sintomo che stiamo andando alla deriva sono le persone si preoccupano di più di qualche hashtag che quello che è successo a quella ragazza e di tante altre prima di lei.,0.9036699533462524,0.07750464975833893,positive,sadness
k9x6b8u,"Beh io mi sono sentito dar dello stronzo perchè uomo da vari parenti femmina, e ho rischiato anche oggi perchè non ero d'accordo sul fatto che io debba andare in piazza a farmi sentire. A me dispiace ma sta diventando peggio di una partita di pallone",0.0025652837939560413,0.997234046459198,negative,sadness
k9x2rr2,">Naturalmente non do colpa a lei.

e vorrei anche vedere.

>Poi con l’hashtag #yesallman

grazie a dio mi sono cancellato da twitter, ops.. X (Musk coglione infame)

>il problema raccontandoci che basta dire alla gente “non alla violenza” e tutto si risolve?

esattamente è un mindfuck talmente grande che credere di avere una società totalmente scevra dalla violenza di genere è la stessa in cui il comunismo è applicabile al 100% e il capitalismo è etico.",0.8210355639457703,0.07898154854774475,positive,anger
k9xdg8v,"Non si può generalizzare una categoria e PER FORTUNA gli uomini sono per la maggior per è diversi da così ma dobbiamo cercare di sfruttare ogni occasione per sensibilizzare su questo tema e  se non lo si fa in occasione di un femminicidio quando? Dopo di che sono convinto che spesso non ci sia trova neppure in presenza di un maschilista, violento e prevaricatore come sembrava essere questo ragazzo ma semplicemente di disturbati.
Dobbiamo stare attenti noi alle donne che ci circondano e cercare di mettere in guardia loro stesse. Se vediamo un atteggiamento sbagliato da parte di un uomo facciamolo presente a lui e a lei invece di farci i fatti nostri. Quando un amico ci parla in modo maschilista/possessivo di una donna cerchiamo di fargli cambiare prospettiva. Anche io credo che si esageri ogni volta, anche con cose che non c’entrano nulla, ma far finta di niente proprio no.",0.006180319935083389,0.9935436248779297,negative,anger
k9xw5y8,"un'altra triste vicenda che diventa oro colato per politica e giornalisti

ovviamente tra hashtag e indignazione non si risolve nulla

per non parlare del rischio di emulazione",0.008765324018895626,0.9909272193908691,negative,anger
ka02hsr,"Tanto anche se fosse #yessallmen non cambierebbe niente, ci additano ma vogliono cmq che cambiamo le cose, non succederà.
Non sono un assassino e l'unica cosa che mi accomuna con quel pazzo è l'avere il pisello.
Vogliono che cambino le cose? Le cambino.",0.048025116324424744,0.9511182308197021,negative,anger
ka04bcx,"Ho visto aggredire persino il padre del ragazzo, per aver detto che il ragazzo amava Giulia e che una volta le aveva fatto i biscotti.

Puttana maiala ma vi rendete conto che quello è un padre che ha appena scoperto che suo figlio, la persona a cui vuole più bene in tutta la sua vita, è un assassino? Pensate sia facile elaborare una cosa del genere? È uno shock paragonabile letteralmente a un lutto, il figlio che conosceva lui è morto ed è rinato un assassino, che cazzo vi aspettavate dicesse??",0.04155690595507622,0.9580252766609192,negative,anger
ka0c0kh,"In questi giorni ho visto nella mia timeline una quantità spopositata di post, tra cui quelli di persone famose, che dicevano tipo: ""Da uomo chiedo scusa a tutte le donne, mi sento colpevole anch'io per l'omicidio di Giulia"". A parte l'insopportabile retorica, ma di cosa esattamente dovresti sentirti colpevole? Io non mi sento colpevole perché esiste la responsabilità individuale, perché non sono un assassino e perché sentirsi ""colpevole come uomo"" non vuol dire letteralmente niente.",0.05376334860920906,0.9459399580955505,negative,anger
