comment_id,comment_body,sentiment_pos,sentiment_neg,sentiment_pred,emotion_predict
k9xbmvp,"Però sei proprio in malafede. 40 m 104 f fa 38,4% e 61,6% non puoi fare il calcolo sul totale dopo che hai eliminato con rapidità un intero campione di casi. In ambito familiare le proporzioni non sono 20% e 81%. 

Invece per quanto riguarda i numeri totali 197 m e 127 f fa 64,5% e quindi 35,5%, numeri molto simili al campione analizzato sopra ma velocemente accantonati. 
Il problema del tuo metodo di calcolo dati è che se usassi la tua stessa metodologia per ciò che non è ""ambito familiare"" allora arriviamo a un 14,5% f e 85,5% m rendendolo un fenomeno molto più sbilanciato e, quindi, grave eppure non solo non si prova a risolvere il problema come hai suggerito accade ma non c'è nemmeno questo clamore mediatico. 
Tutto questo senza introdurre le morti bianche per cui continua a non esserci questo clamore. Dovrebbe essere impressione diffusa e comune che si muore sul lavoro e si muore ammazzati da non familiari per gli uomini. Questo però non accade, perché? Perché ovviamente si parla di euristica della disponibilità per una buona ragione. Se non ne parla nessuno non è un problema sentito. 82 morti sono un numero trascurabile e irrisorio, non meritevole di questo clamore mediatico ed energia se il metodo di valutazione è la ""sproporzione"" e il numero assoluto o relativo (ci sono meno lavoratori di esseri umani femmina e maschio)",0.003663968527689576,0.9960060715675354,negative,anger
k9xqz0k,">Se ci fossero casi simili

Morti sul lavoro 2022: Uomini 1095 Donne 126

Molto disonesto da parte tua restringerti arbitrariamente a un particolare tipo di omicidio e poi rigirare i dati prendendo come campione le donne vittime di omicidio per far passare il messaggio che sia probabile venire uccisi dall’ex. 

80 su decine di milioni è un numero statisticamente irrilevante. Il “rischio concreto” di cui parli semplicemente non esiste. Questo non toglie che ognuno di questi casi sia una tragedia sia chiaro.",0.07397238910198212,0.9255815744400024,negative,sadness
k9xsl2b,"Ma no cazzo che non è un concreto rischio. Quanti episodi di questo tipo ci sono paragonati a tutte le relazioni eterosessuali che ci sono nel paese? Quello è il dato che devi osservare. Un omicidio fa notizia, ma le 99,999 % in cui non succede un cazzo no.",0.01771041750907898,0.9811315536499023,negative,fear
k9zmcyn,"Però snocciola fino in fondo i dati.

324 omicidi su 60M di abitanti, questo fa lo 0.005% di persone uccise ogni anno.

Di queste, buona parte sono maschi, quindi sono 127 femmine. Conseguentemente 0.002% di femmine uccise.

Di queste, 69 sono state uccise dagli ex, quindi lo 0.001.

&#x200B;

Non saprei, lo 0.001% mi sembra leggermente poco per essere considerato ''rischio concreto di rischiare la vita''",0.5306365489959717,0.46827343106269836,positive,fear
ka00008,"> L'impressione che si sta diffondendo è che se una donna dovesse decidere di interrompere una relazione, c'è un rischio concreto che questi possa rischiare la vita.

Per dimostrare questo dovresti confrontare il numero di donne uccise da ex nell'anno X col numero di relazioni interrotte nell'anno X.

Un conto a spanne: ci sono circa 90k divorzi all'anno, su 15 milioni di coppie sposate fa lo 0.6% di matrimoni che finiscono ogni anno. Teniamo questa percentuale anche per tutti gli altri tipi di relazioni, visto che non ci sono statistiche altrimenti.

La popolazione adulta ammonta a 51 milioni, i single adulti a qualsiasi titolo sono 8 milioni, quindi ci sono 21.5 milioni di coppie totali (numero di non-single diviso 2). Ogni anno dovremmo quindi avere 0.6% x 21.5 milioni = 129k relazioni finite a qualsiasi titolo. Non fatemi scremare le relazioni che non includono donne pls, non credo cambierebbe l'odg.

In questo caso 61/129k = 0.05%, detto anche 1 su 2mila.",0.8901254534721375,0.10503687709569931,positive,fear
ka0ui7n,"Avete la terza media o la laurea in filosofia e avanzate studi statistici e di analisi dei dati... Come se io da ingegnere mettessi bocca su Nietzsche con la presunzione di capirci qualcosa.

Spoiler: la statistica è più complessa degli esempi di analisi riportati.",0.983635663986206,0.015474383719265461,positive,sadness
k9xpei0,sono in calo anche perché ci sono sempre meno giovani secondo me,0.946605920791626,0.022828178480267525,positive,fear
k9xz6ez,"Se dicono che tutte le donne sono troie te non te la prendi sul personale? Perchè c'era bisogno di generalizzare con yesallmen? Non possiamo identificare comportamenti e persone devianti invece che un'intera categoria? Io da anni parlo dei problemi che crea il patriarcato nel mondo maschile e non capisco perchè dovrei avere una qualche colpa in questa storia e finire nello ""yesallmen"".",0.0493706613779068,0.9503450393676758,negative,anger
k9zyfmo,"Amen. Mi fanno pena quelli che “non tutti gli uomini” e “non è mica responsabilità mia quella di educare le persone?” No, non lo è, però sapete benissimo che storie del genere se ne sentono fin troppe in Italia, e invece di riflettere sul fatto che, forse, significa che i ragazzi (e le ragazze) in Italia vengono educati ad approcciare le relazioni in modo tossico, fate finta di niente",0.8668810725212097,0.12374474853277206,positive,anger
k9xy8g5,Se invece è un immigrato si generalizza senza problemi ovviamente.,0.7443761229515076,0.009459317661821842,positive,anger
k9y2vx4,"Il post è stato fatto rapidamente. Nella bozza in realtà volevo scrivere qualcosa di articolato, ma non sono bravo ad esprimermi. Il senso comunque è che c’è troppo estremismo in giro e mi ha fatto rivoltare lo stomaco la sensazione di doversela prendere per forza con qualcuno, trasformando tutto in un caso politico",0.005592792760580778,0.9940586090087891,negative,sadness
ka06u75,Leggiti i commenti dei pezzi di merda su questo post che scrivono “ma poverino stava soffrendo :((((“,0.059549782425165176,0.9400090575218201,negative,sadness
ka0zidz,Benvenuti nella società dei peccatori,0.23651094734668732,0.7607668042182922,negative,anger
k9y5ct8,"Ma non sono contro alle donne o cosi via.
Sono contro al modo con cui se n’è parlato.",0.7290033102035522,0.2613789737224579,positive,anger
k9y3ydm,"Ma chissene frega dei like.
Quello che voglio dire che è il modo con qui viene trattata la storie e tutta la analisi fatta sull’evento, con proposte non differenti da fascismo dell’ultima ora, hanno reso, almeno per me difficile seguire la vicenda e rifletterci senza provare schifo.

Hanno reso un caso di omicidio (femmicidio) un caso politico e la gente si è buttata capofitto per estremizzare ancora di più la discussione",0.0023262810427695513,0.9972242116928101,negative,anger
k9xwod6,"“Idiota” sicuramente è il termine sbagliato perché altamente riduttivo, ma l’ intero post non è per niente imbecille, rileggilo che forse non lo hai capito",0.002629402559250593,0.9971576929092407,negative,anger
k9y4qd1,È idiota perché è un assassino. Non cambia la mia analisi. Ti soffermi sui termini e non sul contenuto,0.0037765514571219683,0.9960099458694458,negative,anger
k9y4wsn,"Come sei mona.
Il problema non è che si parla di Giulia. Il problema è come se ne parla.",0.10435663908720016,0.8946000337600708,negative,anger
k9xtelc,É stata trovata sana e salva giusto qualche ora fa,0.015709005296230316,0.0011850696755573153,positive,joy
k9xupfp,">Comunque è sparita un’altra ragazza, 16 anni, qualche giorno fa. Non si trova più

e' sicuramente colpa di tutti i 25 milioni di uomini cattivi che vivono in Italia",0.34529659152030945,0.650522768497467,negative,sadness
k9xfq89,Sì ma stai calma,0.029847772791981697,0.0003947016375605017,positive,sadness
k9xyzkz,Cope,0.9976035952568054,0.0005199449951760471,positive,sadness
k9y55kb,La questione è su come viene trattato il tema. Non su quanto se ne parla,0.9931274652481079,0.005818984005600214,positive,anger
ka04jim,"Non abbiamo fatto partire noi trend come ""tutti colpevoli fino a prova contraria"", quindi l'avete buttata ""voi"" o meglio influencer e media su questo piano. Un piano che non serve ad un CAZZO.

Serve capire 1) chi è sto Filippo, cosa ha, cosa lo turba, il movente, la sua storia.

2) da questo capire quindi il caso in questione e trovare delle soluzioni specifiche alla problematica.

Dire è colpa degli uomini è talmente vasto e inutile che vai a mettere sullo stesso piano ragazzi Bi, omosessuali, trans, il fascio della palestra, il ragazzo della tua amica...boh.",0.028639763593673706,0.9709243774414062,negative,anger
ka0vs5x,"Al bobolo serve creare la retorica del noi contro loro, mandare sulla forca l'ennesimo caso inutile in modo che i problemi sistemici e realmente diffusi non vengano risolti 

(morti sul lavoro, suicidio e assistenza psicologica, criminalità, abbandono scolastico, povertà giovanile ) 


Venire qua, ragionare sul problema e portare dati non serve a nulla. 


Ti invito a fare come esperimento quello di chiedere ad amici o parenti quanti pensano siano i casi di femminicidio all'anno ( nel caso non lo sappiano ovviamente ), avrai risposte che vanno ""dai 500 ai 1000-2000 casi, se non di più"" poi quando sentono il vero numero rimangono sorpresi senza elaborare oltre. 


Ad oggi i media riportano poco più di 100 casi senza contare che i femminicidi [appurati al 100%](https://femminicidioitalia.info/lista/2023) sono 39, ma essendo 39 una cifra ridicola gonfiano a 100 e passa, che rimane comunque ridicola al netto dei casi/coppie esistenti. 

Poi i dati di donne che uccidono il partner ( nonostante di notizie di cronaca ci siano ) sono difficilissimi da trovare, ma magari non esistono? /s",0.026004208251833916,0.9737218618392944,negative,anger
k9zpe68,[deleted],0.998242974281311,0.0012967521324753761,positive,sadness
k9y2ffd,Uman*,0.9967989921569824,0.00021749675215687603,positive,joy
k9xedaz,Cioè quindi piangere una ragazza scomparsa in un paese in cui i femminicidi avvengono ogni due giorni è come quando si è instaurato il fascismo? Ma voi non state bene su sto sub.,0.1276153028011322,0.8718947172164917,negative,sadness
k9zrjob,Ma riflettere magari come viene trattata la questione no?,0.9977186918258667,0.0008829031139612198,positive,anger
k9zw26b,"della serie "" non ho capito nulla di quello che c'è scritto""

il no alla violenza è uno slogan che vuol dire tutto e niente. Come dire la pace nel mondo o abolire la povertà",0.9638723731040955,0.03236672654747963,positive,anger
ka10kii,"Analfabetismo funzionale.
Il problema non è che se ne parli ma come se ne parla",0.23756569623947144,0.7613269686698914,negative,anger
k9y019u,"il punto di questo post scritto malino è che la comunicazione fatta dalle ""attiviste"" relative al caso aumenta solo il distacco e l'astio social e culturale trai generi invece che identificare correttamente dei colpevoli. Perchè nasca un pensiero autocritico e di narrativa differente della mascolinità dentro il mondo maschile dobbiamo smettere di alimentare misoginia e misandria.",0.5161036849021912,0.48233023285865784,positive,anger
k9zzd6w,sempre le donne cosa?,0.9866904020309448,0.0005593423265963793,positive,anger
ka06cvp,Un nuovo achievement per gli uomini italiani: giustificare un omicidio. Sempre tossici ciccini continuate cosi. Poi però not all men oh,0.3073422610759735,0.6904910206794739,negative,anger
ka10lie,Frustrata eh?,0.9843477010726929,0.006471178028732538,positive,anger
ka2v5iu,"Ma scusa se un’assassino non è un bruto, dimmi chi lo è?",0.9969614148139954,0.002595272148028016,positive,anger
k9xuvhz,"si ok puoi soffrire quanto ti pare, ma non si giustifica l'uccisione (+20 coltellate) di una persona con la sOfFeReNzAh",0.28841015696525574,0.7084588408470154,negative,sadness
ka06nq0,Not all men però poi oh poverino stava male scusa :(((,0.005725182127207518,0.9939179420471191,negative,sadness
ka2wjxm,"Infatti non sto ascoltando più niente, dopo aver ascoltato della cagata del patriarcato, del ""mi vergogno di essere uomo"", o della mancanza di democrazia in Italia (cit. Jebreal). Sembra che le colpe siano ora della scuola ora dei padri. Ora io dico che se c'è stata una persona che mi ha insegnato il rispetto delle donne quella è stata mia madre così come accettare le sconfitte nella vita e nei rapporti.",0.6739794015884399,0.3193552792072296,positive,anger
ka07376,"È questo il punto. 

Il dogma odierno del giornalismo e dei dibattiti in tv è la spettacolarizzazione del dolore e non fare corretta informazione.

La direzione intrapresa è: cosa crea engagement? Cosa fa fare più click? Cosa provoca indignazione e il tifo da stadio?

Io sono DISGUSTATO dal mondo odierno.

Un mondo dove i furbi e gli amorali non si fanno scrupoli a sfruttare gli altri per ottenere vantaggi personali o di categoria, ma anche politici, economici ecc.

Questo è lo specchio della società che si traduce anche nella politica.",0.6974487900733948,0.24544192850589752,positive,anger
ka0byra,"su instagram non c'è karma , c'è il fare follower e sfornare post/storie regolarmente per mostrare al mondo che esisti",0.9921419620513916,0.0009070415399037302,positive,anger
ka0bo55,Direi che OP è vittima lui stesso di una società patriarcale e non riesce a dare il giusto peso a ciò che è successo. Che si faccia due domande,0.7604283690452576,0.23872925341129303,positive,sadness
k9yj5dm,"Il problema è che se viene considerato come un “folle”, si rischia di ridurre le sue responsabilità, giustificandone addirittura l’operato. Il ragazzo non è un pazzo ma piuttosto un CRIMINALE. Dietro all’assassinio della ragazza vi era un piano studiato da tempo e di cui lui era ben consapevole.",0.6987187266349792,0.2853909730911255,positive,anger
k9zpcnj,[deleted],0.998242974281311,0.0012967521324753761,positive,sadness
k9zocns,"allora posso capire nel caso uno si trova davanti dei momenti spiacevoli ma in generale (orami lo sto sentendo troppo in giro) io non ho NESSUNA responsabilità dell'educazione di nessuno. non è mio interesse e non è mia competenza educare, anche perchè non ho figli",0.00625602388754487,0.9932922124862671,negative,sadness
ka05kct,Stampo e incornicio questo commento,0.9941757917404175,0.00347898225300014,positive,joy
ka0cwgj,"Se fossero figli sani del sistema, la giornata tipo in Italia sarebbe uno sgozzamento rituale collettivo di donne nelle piazze in piena luce del giorno.",0.987594723701477,0.011410295963287354,positive,anger
ka0f50f,"perchè si parla di donne uccise? e non di persone uccise? forse spostando il discorso su un piano più oggettivo, quindi introdurre il concetto magari di forza fisica rispetto al sesso  per dire, non sarebbe male. ci sono tanti uomini che sono molto esili e deboli e che se togli il sesso M o D, subiscono lo stesso trattamento.  
Ma come sempre in Italia ci si lascia trasportare dalla moda del momento",0.9800040125846863,0.01536878477782011,positive,anger
ka11tdm,"Quando non puoi attaccare l’argomentazione, attacchi la persona. “Piagnistei ridicoli”, “state zitti”, mi sembrano molto quelle frasi da mansplanning che il femminismo condanna se a pronunciarle sono gli uomini. Qui nessuno piange. Ci rendiamo semplicemente conto che siamo di fronte ad uno squilibrio enorme nella narrazione dei media, che punta tutto sul creare empatia nella donna vista sempre come vittima innocente e l’uomo come il nemico della società contemporanea del quale si ha zero empatia. Odio le tifoserie, odio le bandiere. Voglio un mondo anti-sessista e non violento. Mi permetto di criticare la lente del femminismo e la comunicazione dei giornalisti.",0.004708082880824804,0.9950591325759888,negative,anger
k9y8qcp,"Secondo me la laurea è giusta, alla fine aveva gia completato la tesi e avrebbe solo dovuto esporla giovedi scorso, tanto vale dargliela. Poi certo è solo un gesto simbolico, ma ci sta",0.39819249510765076,0.0010096641490235925,positive,joy
k9y3yr8,Correggo che la laurea ad honorem la puoi richiedere per qualunque persona muoia durante gli studi,0.9932070374488831,0.0017669721273705363,positive,sadness
k9y6q74,"Invece è un buon esempio, proprio per dimostrare che anche dietro il tipo con la faccia da bravo ragazzo si può  nascondere un mostro. È pieno di persone che ""non farebbe mai nulla del genere"" e poi invece lo fanno.",0.03988732397556305,0.3199945092201233,negative,sadness
k9zohha,"purtroppo conosco un ragazzo che, detto molto approssimativamente, mi da le stesse vibes",0.04889770224690437,0.9506103992462158,negative,joy
k9yc6kx,"In certi casi si, ma più che ""incel"" sono ""volcel"" (volontariamente celibi): donne che per qualche motivo non vogliono mettersi insieme a qualcuno (e fin qui, legittimo) MA allo stesso tempo ne soffrono molto e sputano bile.

Ne conosco una che si, non sarà Miss Italia ma sa essere empatica e simpatica e invece decide di mostrarsi come acida e scostante a mezzo social.",0.06278424710035324,0.9324448704719543,negative,anger
k9yf65m,"Se sei incel e sei femmina, bro fatti 2 domande. 

(""Sei"" utilizzato come termine generico obvs)",0.998091995716095,0.0014612291706725955,positive,joy
k9xrvkw,Il problema è che pochi idioti fanno tanto casino. Come del resto gli uomini che alzano le mani o uccidono la propria compagna. Tra tutte le relaIoni eterosessuali sono certo che quelle connotate da violenza dell’uomo verso la donna siano una assoluta minoranza. Ma sono quelle che fanno notizia.,0.008498270995914936,0.9908967614173889,negative,anger
k9y2jgn,"Benvenuto nella realtà, l'80% delle persone è stupido.",0.004017484840005636,0.9956988096237183,negative,anger
k9y2rv1,Per quale ragione ascoltare le opinioni di chi non ha un'opinione se non quella ascoltata da qualcun altro.,0.9952942728996277,0.002905838191509247,positive,anger
k9zmtjb,"###Incitamento all'odio

Non sono permessi contenuti che costituiscono o incitano all'odio basato su identità o vulnerabilità.

https://www.reddit.com/r/Italia/wiki/rules",0.11209743469953537,0.8875867128372192,negative,anger
ka0b577,"Perchè scusami, la gelosia e la possessione della donna verso l'uomo è invece tollerata?

Il problema non è la gelosia, il problema è il passo successivo che porta ad uccidere.",0.10940106958150864,0.8901976943016052,negative,anger
ka0mskd,"Ho letto tutto il thread, ti volevo ringraziare per la tua analisi estremamente lucida e pacata. Hai scritto quello che avevo in testa e che non sarei riuscita ad esprimere così bene.

In questo momento - come in tutti i momenti come questo, mi sento molto confusa, triste e arrabbiata perchè sembra che gli eventi si ripetano ogni volta allo stesso modo. 

Sono questi interventi  che mi fanno credere che tutto sommato, anche se nei social c'è tanto rumore, stiamo effettivamente riflettendo come società. 

Grazie a te e tutte le persone che si prendono del tempo per discutere al fine di costruire e non cercare nemici da combattere.",0.0035898254718631506,0.9774392247200012,negative,sadness
ka0ckqy,"Sono d’accordo con la prima parte, ma non capisco il collegamento logico per il quale sia responsabilità mia o di ogni altro uomo. 

È il solito discorso di chi non sa come argomentare che “ti fa stare zitto”. E allora perché te non fermi la gente col cellulare in macchina? Fanno più morti dei femminicidi. E perché non denunciamo chi non paga le tasse? È colpa tua che hai accettato il nero.
Capisci che non se ne esce più?

Se vuoi instaurare un vero discorso ti pregherei di evitare generalizzazioni da basso social network o da bar.",0.2942191958427429,0.7053050398826599,negative,anger
k9xgmxb,No ma secondo il genio del commento sopra sono io che faccio schifo perché postando questa foto sminuisco l'accaduto (senza aver espresso alcun effettivo commento in merito),0.005169636104255915,0.9946591258049011,negative,anger
ka03bpm,Noooo così sei uno schifoso maschilista/razzista/ecc che generalizza,0.003313165856525302,0.9964469075202942,negative,anger
k9xwp8e,Ma infatti è quello che intendevo e che i furboni dei commenti sopra non hanno capito,0.7103382349014282,0.2846229076385498,positive,anger
ka68y2j,"Chi ha mai detto che noi femministe odiamo gli uomini? Odiamo i maschilisti e le misogine interiorizzate. E' abbastanza diverso.

Non odio l'uomo perché è nato uomo, ma perché ha ereditato dei comportamenti sessisti verso la donna e verso il suo stesso genere maschile. 

Il mio ragazzo è uno di quegli uomini che odia i maschilisti tanto quanto me. Non odia se stesso (e non deve mai farlo).",0.006328175310045481,0.9932572841644287,negative,anger
ka06u9w,Quell'uomo ha troppa poca esposizione mediatica. Ogni volta che si esprime su temi sociali complessi non sbaglia un colpo.,0.5733411312103271,0.3885945677757263,positive,anger
ka03cgy,Che ha detto?,0.9976638555526733,0.0003417269035708159,positive,sadness
k9xf88w,Io o la tizia?,0.9974809288978577,0.0017608455382287502,positive,anger
k9y255j,[removed],0.9984952211380005,0.0009072364191524684,positive,sadness
k9zmubt,"###Rispetto reciproco

Non sono permessi insulti gratuiti e simili mancanze di rispetto.

https://www.reddit.com/r/Italia/wiki/rules",0.9301126599311829,0.06781463325023651,positive,anger
k9zpe6v,"d'accordo in parte. c'è molto da dire sul profilo psicologico, e questo lo stabiliranno i periti, ma che questo non si frapponga tra lui e il fatto che ha accoltellato una che centrava meno che nulla con i suoi problemi.
è chiaro che questo ragazzo avesse qualcosa fuori posto, ha fatto ricerche su kit di sopravvivenza, come se davvero si aspettasse di poter vivere nei boschi per fuggire alla legge. 
il suo piano sembrava il piano geniale di una mente instabile, perfetto in ogni dettaglio, se non fosse che si trattava di un piano pensato per essere attuato in un mondo ed in una realtà completamente diverse da quella in cui questo ragazzo ha cercato di attuarlo",0.016634372994303703,0.0005630382220260799,positive,sadness
k9xoodg,[deleted],0.998242974281311,0.0012967521324753761,positive,sadness
k9x60h1,[deleted],0.998242974281311,0.0012967521324753761,positive,sadness
k9x5539,"Così però si finisce per evitare legami sentimentali because killing patriarcato. In generale, estremizzare non è mai bene, ma sui social hai letteralmente solo tifo da stadio che poi non risolve nulla e anzi costringe molt* a non avere proprio nulla a che fare con l'altro sesso.",0.0040599275380373,0.9957610964775085,negative,anger
ka03tij,"Che è come vive una donna normalmente, in genere. Sì, è atroce.",0.039322491735219955,0.9591886401176453,negative,sadness
k9xcni0,"Citazione di Margaret Atwood.
Niente di più vero.",0.6549739241600037,0.3013159930706024,positive,joy
k9zzeam,"Dipende in quale paese, un conto in Brasile nelle favelas, un conto in Italia, in Italia essere derisi è un problema molto più probabile e concreto visto che il tasso di omicidi è bassissimo.",0.9792066812515259,0.00955227017402649,positive,fear
k9xg96n,A me non interessa essere deriso. A me interessa che se ho dei meriti che mi vengano dati. Gli uomini non hanno solo demeriti,0.5471084117889404,0.06445436924695969,positive,anger
k9xqbb4,Ci sono più omicidi di uomini che di donne. Sono comunque molto pochi in entrambi i casi.,0.9673987030982971,0.030536703765392303,positive,anger
k9xfl7z,"Pure io ho paura di essere ammazzato, eppure sono un uomo. Il fatto che sia una donna a morire è irrilevante in molti casi perché non sei morta perché sei donna sei morta perché accanto avevi una persona violenta e una persona violenta la riconosci subito. È rilevante essere donna se la persona in questione uccide solo donne. Come i delitti razziali, di base ti uccidono perché sei nero. Probabilmente se il tipo fosse stato omosessuale il compagno sarebbe morto comunque, è un ipotesi. Però non diamo troppa attenzione a queste cose per favore, usiamo un po la testa e cerchiamo di capire che l aggravante non è essere donna o meno ma frequentare, anche in senso amichevole una persona che ha sempre esercito violenza, da quella verbale a quella fisica. Insomma un tipo che fa risse in giro per il meme non bisogna essere dei fenomeni per capirne la pericolosità, in caso soprattutto di un legame affettivo dove entrano in gioco fattori anche psicologici.",0.28744572401046753,0.7105302810668945,negative,fear
k9x8nx5,[deleted],0.998242974281311,0.0012967521324753761,positive,sadness
k9xerm9,"Me ne rendo conto. Esistono donne possessive e narcisiste. Esistono donne che uccidono il proprio compagno. I casi sono minori, è vero, ma ci sono e si ripetono ogni anno. Quindi che facciamo?

Il problema non è l'uomo o la donna, a patto che si possa ancora fare questa distinzione, ma l'incapacità di costruire una relazione, manca il ""saper voler bene"".

Personalmente trovo giusto e doveroso parlare di violenza sulle donne ma creare fobie e stereotipi non aiuta.

Ti auguro il meglio, spero che tu trova un brav'uomo.

EDIT: Sarebbe interessante scavare nel passato di questo ragazzo, magari da adolescente. Non si nasce narcisisti o assassini. Oltre a fare propaganda su questi temi sarebbe da chiedersi cosa diavolo spinga una persona ad essere così. Si devono risolvere i problemi alla radice.",0.008218521252274513,0.9911931157112122,negative,sadness
k9xtpkx,"Guarda, da come scrivi tu mi pari una di quelle che non farà violenza fisica, ma la fa mentale. É vero, ci sono molti più uomini violenti che donne, ma vorrei contare quanti uomini si sono ammazzati perché la loro donna li ha tirati matti",0.1578405797481537,0.8412594199180603,negative,anger
