comment_id,comment_body,sentiment_pos,sentiment_neg,sentiment_pred,emotion_predict
ka1liw5,"Ti direi ""le relazioni arricchiscono l'animo"", ma se vuoi qualcosa di scientifico posso al massimo citare l'apertura verso l'ambiente esterno ed evitare il regressismo.",0.9929532408714294,0.0032722267787903547,positive,joy
ka00pwk,">Perché devi metterti al centro tu? Fare tu dei distinguo?

Probabilmente perchè essere lombrosianamente etichettati in continuazione come potenziali assassini/stupratori ogni volta che succede un fatto simile metterebbe chiunque sulla difensiva, la butto lì eh.",0.844487190246582,0.15487056970596313,positive,anger
ka02ipa,I maschi sono stati nel discorso fino ad ora,0.9774951338768005,0.0021659776102751493,positive,joy
k9xhdxy,"Ho paura di essere ammazzato in generale, anche solo se giro per strada perché i matti purtroppo esistono. Faccio un ragionamento più amplio. Non tutti ammazzano il partner quando si lasciano anzi sono casi veramente isolati solo che vengo pompati dai media.

Edit: uno è stato sparato perché ha allungato una sigaretta che l altro tipo non gradiva, per farti un esempio.

Se hai paura di essere ammazzata allora non frequentare nessuno che ragionamento è? Se sono tutti una possibile minaccia.",0.009270583279430866,0.9905503988265991,negative,fear
k9xrzcp,"Se hai paura di cio' indipendentemente da chi sia il tuo partner, allora hai una percezione estremamente spropositata del rischio",0.045739490538835526,0.9517552256584167,negative,fear
k9xm9u1,"Se parti dal presupposto che qualsiasi uomo sia un potenziale femminicida, essere selettive non serve proprio a nulla.

Sono un uomo e sono gay. Non approvo gesti di violenza indipendentemente dal tipo e dalla gravità. Ma la narrazione che scaturisce da questa e da altre vicende a me non piace e francamente mi intimorisce. Il problema non è il genere, il problema sta ancora più a monte.",0.0019698147661983967,0.9977820515632629,negative,sadness
k9xhsmb,"Lo sarà. Non farti paranoie.

Le domande sono lecite se hai qualche ""campanello"", altrimenti sono solo paranoie. 

Se scoprissi che il tuo compagno non si fida di te, o che addirittura, ha paura che tu possa ucciderlo come la prenderesti? Non fanno bene queste cose.",0.0020645034965127707,0.9977400302886963,negative,anger
k9y1jpt,E io non ti permetto di dire che anche tutti noi in quanto uomini siamo assassini,0.07435963302850723,0.924838125705719,negative,anger
ka0hx0m,"La differenza è che lo ammetto e sono perfettamente consapevole di quanto sia sbagliato e continuo a farlo per farmi il sangue amaro. E per far notare l'ipocrisia di fondo del ragionamento. Loro agitano il dito dicendo che le loro generalizzazioni non ci feriscono? Perchè non generalizzare il mio disgusto estetico nei loro confronti, tanto...",0.10317549109458923,0.8954876065254211,negative,anger
ka0h8lt,E..?,0.9875178933143616,0.0003244749968871474,positive,sadness
ka0wn1n,Ah quindi non è possibile abolire gli omicidi e i femminicidi per decreto? /s,0.9946644306182861,0.004540425259619951,positive,anger
k9xvlra,"non ho scritto solo ""classico uomo"" ma ""*classico uomo che non sa accettare una rottura, non capisce che no è no, vuole controllare e possedere la donna come se fosse sua* "". sai leggere?",0.9073953628540039,0.001020454685203731,positive,anger
k9xym9g,troppo facile così ![gif](emote|free_emotes_pack|shrug),0.025233598425984383,0.00030160098685882986,positive,joy
k9xzp4o,"Appunto, mi sembra che fosse una bomba pronta ad esplodere",0.8622733354568481,0.010563075542449951,positive,joy
k9y428m,"Invece non sono affatto puttanate.
É la merda woke from usa che ti dire che sono inutili.

L'identità crea tessuto sociale che non esiste in una società multi etnica.

Dove l'immigrazione arriva massiccia disintegra questo strato e crea disastri. Distruzione di edifici, illegalità.  Sveglia.",0.002424681093543768,0.9973479509353638,negative,anger
k9zrvcs,"Il 25 Novembre è la giornata internazionale contro la violenza sulle donne, certo che ci sono manifestazioni. Come per l'8 marzo. Ma a parlare con il maschio medio su Internet sembra che ci sono rivolte femministe su strada un giorno sì e l'altro pure. Ma magari.",0.9188677072525024,0.003938140347599983,positive,anger
ka0949i,"Ma quindi numeri e statistiche vanno guardate solo quando fanno comodo a una tesi piuttosto che a un’altra? È ovvio che il femminicidio sia la manifestazione estrema di quello che sto dicendo, ma bisogna veramente tapparsi gli occhi per non sapere, nel 2023, che per esempio una donna su tre dice di aver subito violenza fisica o sessuale nella sua vita.

E poi di morti bianche maschili che sono stati anche casi mediatici me ne vengono in mente varie, lì semmai a fare più notizia per l’effetto shock sono le morti dei più giovani (così come nei femminicidi).

È veramente scoraggiante cercare di gettare luce su un problema culturale e sentirsi rispondere “eh però gli uomini”. Se ti preoccupano problemi in cui le vittime sono prevalentemente uomini (tipo le morti bianche) crea spazi appositi per discuterne, sarò la prima a venire a darti il mio supporto, a votare chi promuove leggi sulla sicurezza sul lavoro più ferree e a stringermi al cordoglio delle vittime innocenti di questo problema. Perché non estendi la stessa gentilezza alle donne che dicono per favore, cambiamo la cultura così ci saranno sempre meno di noi abusate, picchiate o ammazzate dai loro compagni?",0.34880727529525757,0.6482412219047546,negative,sadness
ka05m4j,"Le donne sono 107. Una donna è stata uccisa. Riusciamo a fare, come uomini, un mea culpancollettivo e capire cosa si sta sbagliando? No, certo..",0.9748582243919373,0.024656349793076515,positive,anger
ka0m35f,"Allora mi ripeto.

Appunto, “not all men ma tutti i men potrebbero usare situazioni del genere per capire cosa c’è che non va”

E mi trovi più che d’accordo, però per fare questo serve coalizzarsi tra uomini e donne.

Insegnare come funzionano le relazioni, insegnare a gestire e elaborare le emozioni, insegnare il rispetto per gli altri, insegnare a individuare comportamenti pericolosi/ red flags, come chiedere aiuto e come allontanarsi. 

Invece di fare tutto questo si cade nelle solite e inutili discussioni ( come quella che stiamo facendo).

Ovviamente (e fortunatamente) questo omicidio è considerato deplorevole da tutti, sia uomini che donne.

Siamo tutti d’accordo non doveva succedere e siamo tutti d’accordo non ne dovrebbero succedere altri.

Siamo tutti dalla stessa parte.

Però poi arrivano i post con generalizzazioni ed ecco creati due schieramenti che litigano per puttanate quando il problema alla base persiste.

Qui finisce il mio piccolo rant, semplicemente non sopporto vedere sempre le solite discussioni e litigate partire da questo genere di tragedie invece che “utilizzarle” per discussioni sensate e utili",0.013516571372747421,0.9856382012367249,negative,anger
k9ztkxv,"Perché il politico turno deve appropriarsi della storia e iniziare ad parlare alla pancia del popolo .

C'è anche che devono far spostare i problemi reali del paesa quindi parlano di questa storia",0.22905485332012177,0.002928640227764845,positive,anger
ka08fw4,"Il “fastidio” che provi nella narrazione della vicenda e della risposta delle donne invece che farti andare sulla difensiva dovresti vederla come una opportunità per crescere e migliorarti. Ti dovrebbe spingere ad approfondire. 

Invece hai aperto l’ennesimo thread dove lo scopo é parlare di noi poveri maschi che siamo discriminati. 

Può darsi che tu sia sessista (lo siamo stati tutti, inconsapevolmente) ma se ti chiudi a riccio non accettando commenti che non ti danno conferme non so cosa potrai cavarne",0.009832729585468769,0.9894405007362366,negative,anger
k9y6dio,Ma che cazzo ti leggi. Non ho mai letto niente di simile da nessuna parte.,0.0080658458173275,0.9887062311172485,negative,anger
k9y68is,Ma chi cazzo se ne frega scusa non so nemmeno di cosa parli,0.016954205930233,0.9823878407478333,negative,anger
ka4x9mx,"Terrorismo mai visto fatto dai bianchi, si sa.",0.9693050384521484,0.026855148375034332,positive,anger
k9y1bxo,"No, a giudicare da ciò che hai scritto direi che non hai capito un cazzo",0.3702041208744049,0.6225627660751343,negative,anger
ka0itnl,"Non ce la fai a comprendere eh, è normale dire ""no alla violenza"", specialmente dopo una cosa del genere. come la gente che scende in piazza (io compreso) a sostegno della gente Palestinese o Ucraina con slogan come ""cessate il fuoco"". Lo so anch'io che Netanyahu o Putin non smettono di lanciare dei missili perché legge ""cessate il fuoco"" in un corteo, come non smettono di esserci omicidi di genere perché una tizia pubblica su instagram una foto di sensibilizzazione con il tag ""stop alla violenza"". Però se nessuno ne parla, il problema non si pone e non possono nascere programmi di sensibilizzazione piuttosto che di prevenzione. Se poi a te da fastidio leggere ""No alla guerra"" o ""no alla violenza"", ripeto, per la terza volta, hai un problema.",0.07279984652996063,0.926681399345398,negative,anger
ka063h3,I dati di ragazze che uccidono i propri partner? Su su dai dai,0.998387336730957,0.0006520794122479856,positive,anger
ka1dzmz,"Ok vabbè, ovvio troll/bait oppure ci sono chiari problemi di comprensione del testo. Sei consapevole che i tutti, i buoni, i bravi ragazzi, il papa, possono cambiare o esibire comportamenti incomprensibili di fronte a enormi stress o situazioni che percepiscono come inevitabili che non sono in grado di accettare? Non sto giustificando il suo aver ucciso la ex, sto dicendo che questo molto probabilmente è stato una persona normalissima e innocua fino a poco tempo fa. Non simpatizzo, ma empatizzo. Capisco cosa probabilmente ha provato FINO A UN CERTO PUNTO, perchè io, come moltissimi altri/e e in misura molto minore, sono stato per qualche mese in quella spirale.",0.01856405846774578,0.9805137515068054,negative,sadness
k9zxkvi,"d'accordissimo, parlavo di ""folle"", che da jna parte può essere inteso come ""incapace di intendere e di volere"" e dall'altra può essere usato come insulto . nel senso che il definirlo un folle non è inteso per ridurne la colpa, ma solo come sfogo personale",0.04590146243572235,0.9538941383361816,negative,anger
ka0avco,"Esattamente, bravo. Mentre le amiche di Giulia Cecchettin già sapevano benissimo di come erano guaste le dinamiche tra i due, il padre ricacciava la questione dei biscotti.",0.028133032843470573,0.0003507682413328439,positive,sadness
k9zq2ko,"Non intendo infatti andare a fare il pippone con la morale, semplicemente se nessuno fa qualcosa di necessario, lo fai tu, a volte spinge gli altri a fare la scelta più corretta possibile, anche gli adulti.",0.9440262913703918,0.009635690599679947,positive,anger
ka07qkj,"Io sto già facendo rispondendoti. Cerco di educare chi mi é vicino e decostrusico in prima persona i MIEI comportamenti tossici. 

Ma non bisogna agire solo online, dobbiamo essere attenti con i nostri amici, fratelli, colleghi. Non dobbiamo voltarci e infischiarcene quando siamo testimoni di comportamenti tossici (l’amico geloso ecc.) 

Non dobbiamo essere i padri che dicono “sono cose normali da ventenni”, come ha fatto il padre dell’assassino in questione.",0.16264303028583527,0.8291352987289429,negative,anger
ka0l09d,"Mi sembra di dover spiegare le cose con i disegnini, quanti uomini in Italia sono stati uccisi dalle loro compagne? Quanti uomini temono, dopo la fine di una relazione, di finire ammazzati? 

Evidentemente questi conti devi averli fatti con i piedi, dato che questo articolo parla di dati ben diversi. 

https://www.gazzetta.it/attualita/20-11-2023/vittime-femminicidio-2023-in-italia-quante-sono-i-numeri-del-viminale_amp.shtml",0.9963510036468506,0.003184522734954953,positive,anger
ka3clzp,"Lo fanno per il povero papà... Ho sentito che ha perso anche la moglie (e mamma di lei) l'anno scorso.

Una persona così buona e degna.

Mi dispiace veramente molto per lui.",0.004165657330304384,0.009922415018081665,negative,sadness
k9zrz08,"Ma per me quelle sono solo frasi di circostanza, un genitore non direbbe mai “mio figlio è un pazzo omicida”. Probabilmente le red flag ci sono sempre, magari sono difficili da cogliere o magari si pensa che sia un caso isolato. Non voglio sparare cazzate, ma sono stati fatti degli studi sulle menti dei killer/serial killer e molti seguono gli stessi pattern, hanno le stesse manie, gli stessi comportamenti ecc…",0.42702797055244446,0.5717449188232422,negative,anger
k9zn23c,"Ma secondo te, che cazzo dovrebbero dire?
""Eh sì eh, lo vedevo io che era un assassino, la mattina mi parlava di quanta gente ha ucciso l'altro ieri""

Anche in questo caso qua, è palese che questo fosse geloso e/o depresso ma chi mai avrebbe pensato commettesse una roba del genere? 
Risposta: nessuno, perché nessuno aveva fatto nulla in precedenza.

Poi, se vogliamo dire che, in tutti sti casi, la gente ""sa"" e non fa nulla come se un ebete di 22 anni sia più pericoloso della mafia siciliana, boh.",0.016477830708026886,0.9833269715309143,negative,anger
k9zrk7w,">Se guardi bene tra le righe molto spesso ha un sacco a che fare col patriarcato

d'accordo in parte, mi sembra più incapace di intrattenere rapporti umani col genere femminile, e come conseguenza segue quei guru e quant'altro.

>Btw adoro il tuo nick, sotto il sole ti spacchi le nocche presumo

e da giovane il mio mito era l'attore Dennis Hopper",0.5807085633277893,0.0206503476947546,positive,anger
ka6dsv7,"Se questo ragazzo fosse stato educato sin da piccolo ad accettare il rifiuto in maniera sana, esprimere le proprie emozioni nel modo giusto e rifiutando la cultura del possesso che permea la nostra società sì, forse Giulia sarebbe ancora fra noi.

Comunque il tuo commento dimostra di quanto tu non sappia minimamente di cosa sia l'educazione affettiva e sessuale. Documentati meglio perchè ci fai solo la figura del Pillon di turno che grida al gggiender istericamente.",0.9389835000038147,0.04753432795405388,positive,anger
ka0gh6i,"Si parla di responsabilità, non colpa. Quindi nessuno ci sta “colpevolizzando” in quanto maschi, ma si dice che é nostra responsabilità superare il maschilismo tossico che danneggia noi e uccide loro.

Questo senso di urgenza e questi toni accesi derivano dal fatto che molte donne pensano che noi non stiamo facendo abbastanza in tal senso (ed é vero, leggendo i commenti)",0.7597388625144958,0.22740347683429718,positive,sadness
ka6acyq,"Sciò, vai a odiare da un'altra parte.",0.05068829655647278,0.9468994736671448,negative,anger
k9xi90d,[deleted],0.998242974281311,0.0012967521324753761,positive,sadness
k9xi6q7,"Ne io ne il post abbiamo detto di ignorare i diritti umani per gli uomini, e ne per questo ragazzo visto che ci sarà un processo. Veggente pure tu?

Vi prego BASTA fare le vittime, nel caso non si fosse capito non siete voi la vittima.",0.6103691458702087,0.3875361680984497,positive,anger
k9xx72u,"Anche se non si faranno mai e hanno pure tagliato i fondi alla scuola ahah.

Ancora più in generale sarebbe bello se un'ora a settimana si parlasse di attualità a scuola. Sarebbe utile ai ragazzi per creare un opinione, per riflettere e dar vita a dibattiti. Potersi confrontare e scambiare punti di vista é fondamentale.",0.03886653482913971,0.0005063618300482631,positive,sadness
k9xwtpm,Premio al pignolazzo. Hai ragione correggo. Ad ogni modo non ho proprio intenzione di mettere in mezzo la politica. Tanto per loro é solo un modo per fare campagna elettorale purtroppo.,0.00286195264197886,0.9969643950462341,negative,anger
k9z8myd,"Quindi la soluzione quale sarebbe? Tenervi legati in cortile come pitbull, dato che avete tutti questi grandi istinti animaleschi? Dopo tutto l'hai detto pure tu, che il problema dei femminicidi non si risolverà mai perché gli uomini non solo non hanno intenzione di risolverlo, ma l'istinto violento è parte della loro natura.

E comunque mi fa ridere che gli uomini siano capaci di strillare ""NON SIAMO TUTTI CAPACI DI OMICIDIO, NAZIFEMMINISTE DIMMERDA"" e poi ve ne usciate con ""ma è perché abbiamo più testosterone, che ammazziamo la gente. è normale.""

O è uno o è l'altro, Giovanni.",0.7891315221786499,0.1263999491930008,positive,anger
ka27hy0,"Io non mi sento assolutamente rappresentato da queste cazzate di fantabiologia. Siamo umani, e auspicabilmente, in grado di esercitare del sano autocontrollo.",0.015198527835309505,0.9822631478309631,negative,anger
ka00gox,"Il fatto che sia un tasso più basso di altri paesi non vuol dire che sia accettabile. Sono d'accordo sul fatto che ovviamente anche gli uomini possono subire violenza, ma questo non vuol dire che non esista un problema culturale importante da affrontare. Va smantellata la cultura tossica del possesso, in cui quelle che sono violenze psicologiche o fisiche vengono goistificate con ""lo fa perchè è innamorato/a!"" e poi però piangiamo quando la vittima in questione viene ammazzata o sfregiata con l'acido.",0.013185127638280392,0.9865537285804749,negative,sadness
k9zvhf4,"""Le donne rappresentano il 3,5% degli autori dei cosidetti crimini passionali"" (fonte ISTAT) Ah, dici questi dati?",0.9988497495651245,0.000498446577694267,positive,anger
ka1ne52,"Che, per te, sono abbastanza da bilanciare l'enorme quantità di contro?",0.8619034290313721,0.00834439042955637,positive,sadness
ka012ne,Non vedi proprio il problema :) continui a mettere te stesso prima dell’esigenza e richiesta di aiuto di un grosso gruppo di persone. Devi ASCOLTARE,0.15330207347869873,0.019181672483682632,positive,sadness
ka033s9,?,0.9404559135437012,0.0004156143113505095,positive,fear
k9xx086,"anche io ho paura di essere ammazzata in generale, ma aggiungi anche la paura di essere molestata, stuprata, picchiata, di essre vittima di femminicidio. per l'ennesima volta non stiamo dicendo che tutti gli uomini sono una minaccia, ma che c'è un problema culturale alla base.",0.02253381349146366,0.9771603345870972,negative,fear
k9xswbd,"il problema e' il fatto che polarizzare ed estremizzare porta tanti click/visualizzazioni, quindi i media se possibile lo fanno.",0.43528294563293457,0.5599415898323059,negative,anger
ka0iocq,"Penso che alle donne che generalizzano importi ben poco se noi ci sentiamo feriti, e io penso che queste persone non andrebbero nemmeno calcolate. Se si fa un discorso contro la generalizzazione, diciamo che generalizzare di solito non aiuta, poi magari tu volevi evidenziare quanto sia sbagliato e io ho capito male",0.0025228008162230253,0.9973495006561279,negative,anger
ka0hk1i,"Ah no niente, aiutavo le AI del futuro a labelizzare meglio il tuo intervento.",0.7431403994560242,0.192076176404953,positive,sadness
ka0x8t7,No,0.9968990087509155,0.0014743921346962452,positive,fear
k9xx0jb,Meglio di quanto tu sappia costruire una frase in italiano.,0.01062722411006689,0.0016831201501190662,positive,joy
k9xyvbm,"Uno che picchia la vittima, la carica in macchina e poi la massacra di coltellate...insomma.",0.46325692534446716,0.5350833535194397,negative,anger
k9y5cn7,"Secondo me te confondi multiculturalismo con multietnicità. Si può essere di etnie diverse ma di cultura uguale, il Brasile è multietnico non multiculturale. 

L'immigrazione massiccia non disintegra niente, la mancata integrazione disintrega. L'immigrazione di massa che l'Europa sta vivendo ora a livello di numeri non è niente in confronto all immigrazione che l'America o l'Argentina o il Brasile hanno vissuto nel secolo scorso, quell immigrazione cosa ha disintegrato scusa? 

Vai a leggere i poster di propaganda anti-immigrazione americana di 100 anni fa, dicevano e parlavano delle stesse identiche paure che gli europei ripetono ora. Alla fine non è successo niente, tra 100 anni di questo periodo di immigrazione c'è ne saremmo scordati.",0.03118503838777542,0.9669108390808105,negative,anger
ka0a9po,"Ma perché non è un problema culturale, in Europa siamo al terzo posto in quanto a sicurezza, semplicemente ci sono delle persone deviate mentalmente e sono casi isolati. Parlane quanto vuoi ma ce ne saranno sempre, come ci saranno pur sempre omicidi, non viviamo in un'utopia, e pensare di raggiungere la perfezione è al quanto inimmaginabile. Bisogna lavorarci sopra il più possibile ma tanto ci saranno sempre.",0.08974487334489822,0.004712244030088186,positive,anger
ka07xaz,"Di quel 105* la metà sono femminicidi, il resto sono omicidi, sono due cose diverse, non ti soffermare ad un post di Instagram dove postano un numero, abbi un po' di spirito critico e vai fino in fondo alle cose per favore. Io non faccio alcun mea culpa, non ho nessuna colpa e non ho la coda di paglia, se te ti senti colpevole di qualcosa caro mio è perché hai fatto qualcosa del genere. Io sono a posto con la mia coscienza e non mi devo scusare con nessuno per quello che un ragazzo psicopatico ha fatto. Smettila di fare il simp per prenderti i likes dalle ragazze per favore.",0.025758041068911552,0.9731107950210571,negative,anger
k9y773q,"https://preview.redd.it/7xahnt2uzd1c1.jpeg?width=1080&format=pjpg&auto=webp&s=bb5cc462f7b9cafcafd3f0d03c1191834f4f2bde

Eddai",0.9984133243560791,0.0007817746372893453,positive,joy
k9y6ind,spiaze,0.9981874823570251,0.0006797286914661527,positive,joy
ka51cey,[deleted],0.998242974281311,0.0012967521324753761,positive,sadness
ka103ss,"Non c’è la fai proprio a comprendere che la retorica priva di sostanza è quanto più inutile e offensivo verso temi reali e complessi come questo?
No alla violenza, la risposta media è grazia al cazzo. No alla guerra, la risposta media è grazia al cazzo. Nessuno vuole cose orribili, nessuno. Ma dato che stai dicendo un ovvietà, è come se ogni giorno ti scrivessi: il sole sorge.
E invece rimani nelle tue posizioni, ripetendo a pappagallo uno slogan per sentirti bene e dire “io c’ero “",0.002835208782926202,0.9969504475593567,negative,anger
ka0vytr,Femcel che segue xxitaly che duo iconico,0.7710819840431213,0.0015257458435371518,positive,joy
ka2f3ar,Se vabbè è Hitler diceva sempre buongiorno e amava i cani. Vabbè è proprio vero che la mente degli italiani arriva fino ad un certo punto perché non vi hanno mai detto di stare zitti e non rompere il cazzo. Ci sentiamo quando ne muore un’altra e stare tutti li con la shocked pikatchu face.,0.3564191162586212,0.02527448907494545,positive,anger
k9zxnxh,"Concordo, è solo per non sminuirne il gesto",0.9817504286766052,0.009522930718958378,positive,anger
ka0d1mg,"Ma vez, parliamo di ventiduenni, che tipo di coinvolgimento ti aspetti da parte di un padre nelle vicende intime e relazionali del figlio? Ma poi tu non sai un cazzo, di che stiamo parlando? Ma fatti i cazzi tuoi, no? Conosci forse nel dettaglio le dinamiche interne della famiglia? Perché volete immischiarvi in vicende che non potete comprendere, ipotizzando motivi sociali e culturali sulla base del nulla?",0.9939824938774109,0.0054840100929141045,positive,anger
ka09n9x,"1) se pensi che io sia toccato dai tuoi messaggi ti sbagli, quindi non mi stai educando per niente

2) non usare la prima persona plurale perchè non ti conosco e non usare l'imperativo perchè non mi puoi dare ordini

3) se tu vuoi attaccare i pippotti alla gente in modo paternalista odioso fallo pure ma non ti lamentare se la gente ti evita",0.004158826544880867,0.9956964254379272,negative,anger
ka0l14s,"It looks like you shared an AMP link. These should load faster, but AMP is controversial because of [concerns over privacy and the Open Web](https://www.reddit.com/r/AmputatorBot/comments/ehrq3z/why_did_i_build_amputatorbot).

Maybe check out **the canonical page** instead: **[https://www.gazzetta.it/attualita/20-11-2023/vittime-femminicidio-2023-in-italia-quante-sono-i-numeri-del-viminale.shtml](https://www.gazzetta.it/attualita/20-11-2023/vittime-femminicidio-2023-in-italia-quante-sono-i-numeri-del-viminale.shtml)**

*****

 ^(I'm a bot | )[^(Why & About)](https://www.reddit.com/r/AmputatorBot/comments/ehrq3z/why_did_i_build_amputatorbot)^( | )[^(Summon: u/AmputatorBot)](https://www.reddit.com/r/AmputatorBot/comments/cchly3/you_can_now_summon_amputatorbot/)",0.9807944893836975,0.0019671584013849497,positive,fear
ka3d1m2,Ma infatti :( che ingiustizia. Anche per la sorella di lei (non so se Giulia avesse anche un fratello più giovane). Davvero non ci voleva,0.02524614706635475,0.974125325679779,negative,anger
k9zu43c,"Certo, un genitore non lo direbbe mai e non mi aspetto che al primo comportamento strano uno si aspetti che ammazzi qualcuno, però tutti si erano accorti che questo ragazzo non stava bene, ma il padre insisteva nel dire che andava tutto bene e che aveva una gelosia normale, quando in realtà era praticamente ossessionato. Ovviamente, non dico che doveva aspettarsi che il figlio diventasse un criminale, ma se noto che mio figlio sta male da mesi, forse un minimo mi preoccuperei e mi farei delle domande sulla sua salute e proverei a farlo stare meglio. Poi magari mio figlio non ammazza qualcuno, ma almeno starà meglio con se stesso e avrà  relazioni amorose più  sane.",0.07937752455472946,0.6943134665489197,negative,fear
k9ztpus,"Ovviamente non pensi che tuo figlio ammazzi qualcuno, ma se noti che dopo mesi è ancora ossessionato da una ex, qualche domanda non te la fai? Non puoi pensare che vada tutto bene e che sia una ""gelosia normale"". Al di là di tutto, c'è anche un grosso problema sull'ammettere il fatto che qualcuno abbia un problema di salute mentale e sull'impegnarsi nell'aiutarlo. È  sempre più  facile illudersi che vada tutto bene",0.014013366773724556,0.9824672341346741,negative,sadness
