comment_id,comment_body,sentiment_pos,sentiment_neg,sentiment_pred,emotion_predict
k9ynnbh,"La vicenda riguarda sì degli individui, ma ogni individuo fa parte di una società che in parte lo plasma, che lo vogliamo o no. E trattandosi di un fenomeno più ampio di omicidi/femminicidi, viene spontaneo inquadrare il caso specifico in un'ottica più ampia appunto della singola vicenda. Questo caso risulta particolarmente drammatico perché all'inizio si sperava che lei fosse ancora viva. Quindi non è stato l'ennesima notizia di cronaca, in un certo senso si è vissuta questa vicenda ""in diretta"" mentre si svolgeva, una cosa ancora più drammatica. È quindi in parte comprensibile tutta questa reazione ""social"". Ma alla fine può essere anche un modo personale per esorcizzare ed elaborare la cosa. Un post di riflessione su un social non avrà chissà che impatto. Non stare troppo a guardare il contenuto, è una reazione emotiva ad una cosa orribile. Come hai detto sono reazioni di pancia, e in questi momenti è più difficile essere razionali. Per cui dare un connotato obiettivo ai contenuti di  post del genere è inutile: sono un'espressione di una reazione emotiva. La maggior parte della gente non è che si mette a fare chissà che riflessioni prima di postare qualcosa. Ognuno elabora la cosa come crede, i social come al solito amplificano all'inverosimile.",0.018327966332435608,0.9799835085868835,negative,sadness
k9zi8x1,Upvote,0.9988069534301758,0.0005062819691374898,positive,joy
k9zzc4g,Somehow Italian men manage to make it all about themselves yet again,0.9611098170280457,0.01909242570400238,positive,joy
ka07klp,"Fintanto che la cultura del vittimismo e del ""povero me"" continuerà a essere la via più facile per fare eco sui social e ricevere attenzioni, reazioni di questo genere saranno la norma.

Sarà come la favola di Pierino e il lupo: diventeremo così tanto assuefatti, che le voci di chi vittima lo é per davvero verranno affogate in un mare di piagnistei e virtue signaling.",0.6118211150169373,0.14400415122509003,positive,anger
ka0b5ch,"A me la cosa che ha dato veramente ma veramente fastidio, è la solita cosa di scimiottare numeri e dati senza nemmeno capire che cosa siano o il loro significato, che spesso fanno un grandissimo danno di percezione dei fenomeni.
Per intenderci dalla morte della povera ragazza ho sentito per mari e monti dire che in Italia dall’inizio dell’anno ci sono stati più di 100 femminicidi.
Qual è la problematica? È che il femminicidio si intende l’omicidio di una donna avvenuto perché è donna, per mano di ex/fidanzati o stalker.
Quel 100 non rappresenta i femminicidi, ma il numero di morti di donne, indipendentemente se sono morte in un incidente stradale o se sono morte sul lavoro, il dato dei femminicidi quest’anno dovrebbe essere sulle 40 vittime.
Insomma tantissime persone tra social e giornali, stanno ingigantendo un problema (che rimane tale perché grave) di 2,5 volte, non proprio un errore di calcolo semplice.
Bisogna riportare seriamente questi dati per rispetto delle stesse vittime, che non sono solo numeri per far notizia.",0.0787574052810669,0.9201452136039734,negative,anger
ka4y4ad,"Sono con te amico mio. Io questi giorni me li sto vivendo davvero male, vedo persone che ho sempre considerato intelligenti ed emotivamente mature pubblicare post e reel di una superficialità e demagogia disarmante. Vedo uomini scusarsi per colpe che non hanno mai avuto. Da uomini, scusarsi a seguito di questo orribile fatto di cronaca è un precedente pericolosissimo perchè giustifica chi afferma che TUTTI gli uomini sono delle merde, significa dar ragione a chi pensa che noi uomini alimentiamo la cosiddetta ""cultura dello stupro"" (termine AGGHIACCIANTE).

Tutto grazie a questo movimento woke che ci distruggerà tutti prima o poi.",0.006574299186468124,0.9900698065757751,negative,sadness
k9x6q6u,"Perdonami eh, ma sticazzi dei tuoi sentimenti.",0.6581071615219116,0.27282190322875977,positive,sadness
k9xt66g,"Ho fatto un po' di calcoli che ho dovuto arrotondare, ma la percentuale di donne uccise da inizio anno e un po' meno dello 0,0035% 105 donne su più di 30 milioni, e se un centesimo di percentuale cambiasse per il mio arrotondamento non cambierebbe le cose, il femminicidio non è una cosa così diffusa, solo 52 o 53 donne mi pare su queste 105 è stata uccisa da un ex, più o meno lo 0,0017% della popolazione femminile italiana, ma sento lo stesso parlare di ""cultura del femminicidio"", a parte che non sopporto gli slogan tipo:""fermiamo il femminicidio"" come se la gravità del femminicidio fosse che la vittima aveva una vagina e non che quella persona è stata uccisa, ma poi qui non si parla di cultura o cose del genere, qui si parla di criminalità, che ci sarà sempre, ovviamente non ci sono dati, ma si può immaginare quanti ragazzi ogni anno vengano lasciati dalle partner, la stragrande maggioranza di loro, essendo persone normali non le uccidono, non ha senso venire a sensibilizzarmi a riguardo, penso che tutti abbiano abbastanza chiaro in mente che non devono uccidere nessuno, e quel nessuno comprende anche un'ex ragazza, è come venirci a sensibilizzare dicendoci che non si sciolgono i bambini nell'acido, nessuno di noi l'avrebbe fatto comunque, ma i mafiosi che lo fanno ci sono, eppure non sento mai parlare di una ""cultura mafiosa"" il fatto che alcuni (pochissimi) uomini hanno ucciso delle donne, non rende tutti gli uomini scimmie possessive assassine, come il fatto che i mafiosi esistono non rende tutti gli italiani mafiosi.

Sinceramente trovo tutto questo scandalo una stupidaggine che ora i media amplificano perchè hanno visto che funziona e che porta guadagno, che trovo se me lo permettete veramente irrispettoso proprio nei confronti di Giulia.

Downvotate pure se non siete d'accordo, ma per quanto mi riguarda quello che ho detto è abbastanza oggettivo e vero

P.S. se ottenete percentuali più accurate scrivetemelo che seppur come ho detto non cambierebbero il succo del discorso, preferirei avere dati il più accurati possibile",0.02175743132829666,0.9773897528648376,negative,anger
k9xz6r5,"Not all men, but somehow always a man.",0.314615935087204,0.0053429086692631245,positive,joy
k9x0qf1,Ti ricordo che abbiamo cavalcato girolimoni per instaurare il fascismo. Non è una novità che l'italiano è coglione,0.06139841303229332,0.9379087686538696,negative,anger
k9xqdpe,"Ma poi quanto è ridicolo vedere su ig ad esempio, ma anche su altri social vedere ragazze e anche ragazzi perché no? che repostano le vecchie storie della vittima, come se ciò aiutasse a risolvere il problema. Ma poi diamine tutte fatte con lo stampino sono? Sembra che vada di moda, o sbaglio? I media così facendo stanno soltanto innescando terrorismo psicologico e non ve ne rendete conto perché avete i paraocchi e volete vedere solo le cose che volete voi. Riguardo l’ex più che metterlo in carcere e farlo marcire (e tutte le altre cazzate violente ed estremiste ai limiti dell’essere umano che avete detto, e voi sareste i migliori?) cosa che a mio parere è sbagliatissima in questo caso perché il responsabile non è mica un mafioso che ha scelto di fare quella vita, ma è stato  un poveraccio debole di mente maledettamente soggiogato da quella malsana mentalità di assoluta dipendenza nei confronti della sua ex fidanzata (che era pure una ragazza mid tra l’altro) meriterebbe pienissimo supporto psicologico dai migliori esperti del settore perché è lapalissiano che abbia sbagliato nessuno lo mette in dubbio ahimè è chiaro come la luce del sole, ma non per questo bisognerebbe buttare un’ulteriore vita, tralasciando poi che comunque per quell’azione sarebbe segnato a vita e sempre visto ai margini della società, ma questo è un problema di quest’ultima che non crede al cambiamento di chi commette misfatti. Ricordiamoci inoltre che il carcere dovrebbe servire prima di tutto (tralasciando i pezzi di merda come mafiosi, camorristi eccetera) per rieducare il reo e poi forse solo dopo per infliggere una pena, ma questo sarebbe possibile in un mondo utopico di rosa e fiorellini e pertanto le mie sono solo parole che non avranno mai riscontro in questo mondo lercio e sporco come una discarica.",0.006394664756953716,0.9932324886322021,negative,anger
k9xprc8,Condivido in pieno.,0.7676078081130981,0.000856171129271388,positive,sadness
k9xuz8b,In effetti  hanno un po' rotto le balle,0.003365396521985531,0.9962905645370483,negative,anger
k9zg0cn,"Io con un hashtag del genere sinceramente, auguro loro ogni male. E se prima non me ne fotteva niente, da oggi ho accettato il fatto che le donne mi stanno sulle balle e di aver perso ogni tipo di empatia nei loro confronti.

Mi piacerebbe almeno ridere ma c'è solo una cosa: il vuoto.",0.005982233211398125,0.9929577112197876,negative,sadness
k9zpjkf,"Io ho visto troppi post come questo e commenti di uomini che si lamentano. Non frequentando facebook né gruppi femminili qui su reddit (perché grazie a Dio ho interessi che esulano dal mio genere/sesso), letteralmente ho visto solo questi post oltre alla cronaca morbosa. Che dopo questi post non sembra più tanto morbosa, anzi.",0.01286928728222847,0.9855234622955322,negative,fear
k9ztl0f,"Se ti da fastidio leggere ""no alla violenza"", il problema ce l'hai te",0.007997492328286171,0.9918034076690674,negative,anger
ka1thaf,https://preview.redd.it/0749d4c2uj1c1.jpeg?width=895&format=pjpg&auto=webp&s=3f3260e4428120543b240527a39092448f7e0a9d,0.99808669090271,0.0007933037704788148,positive,joy
k9ydmik,"La condanna dell'assassino va fatta senza ombra di dubbio. Nella mia condizione nello specifico , io ho 23 anni e non ho mai avuto una ragazza, mai nemmeno baciata. Mi fa provare un forte dolore interiore vedere che i ragazzi violenti e che compiono questi atti hanno sempre una vita sentimentale quando io invece vengono solo rifiutato in ogni modo.  Dai violenti e gli assassini io prendo ogni distanza possibile. Non è nel mio modo di essere fare del male o avere un comportamento possessivo. Però molte donne questo comportamento dominante lo apprezzano. Molte cose sarebbero diverse se si desse meno importanza a queste qualità. Dire che sia data troppa importanza alle qualità sbagliata non vuole in alcun modo togliere agli assassini le loro colpe. Però se c'è una cosa su cui le donne dovrebbero riflettere è questa. Di uomini ""beta"" rifiutati e non voluti da nessuna ce n'è davvero un esercito.  E se le donne sbagliano nell'apprezzamento di cose frivole, anche gli uomini sbagliano pensando sostanzialmente solo a scopare che di per sé non è una cosa di chissà quale valore se svuotata di tutto il resto... 

Ma forse qui qualcuno voleva sapere più esattamente cos'è che induce a compiere atti di questo tipo. Se escludiamo la predisposizione, io ritengo che lo stato attuale delle relazioni umane è una ricetta per il disastro. Di base qual è l'essenza delle relazioni oggi? Si punta al matrimonio? Si punta a trovare l'amore eterno? Da quello che vedo l'unico fine è l'edonismo. A volte si finge che ci sia dell'altro ma nei fatti ormai c'è solo questo. In questo gioco perverso, anche se tutto va bene subentra la noia, diventa una gara a chi ottiene di più e va a finire spesso che alcuni uomini per questa rabbia di restare a bocca asciutta arrivino alla violenza. Ma ancora una volta io da costoro prendo ogni distanza possibile perchè la mia disperazione è data dal fatto che l'amore è impossibile. Le vicende della mia vita, il modo in cui le ragazze hanno rifiutato me per mettersi insieme a chi le ha picchiate e uccise lo dimostra in modo inequivocabile. Io piango perchè l'amore dei poeti e della letteratura è una grossa bugia. Dell'edonismo nichilista che oggi si finge amore non so che farmene esso non ha alcun valore. Quindi concretamente, quale può essere la soluzione? La logica è sicuramente una soluzione, perchè abbandonarsi alle proprie emozioni porta poi ad atti violenti e orribili...",0.006498212460428476,0.9927124977111816,negative,sadness
k9zyqsv,"e quindi, ne fai un altro .. tutto regolare",0.984818160533905,0.0013438502792268991,positive,anger
ka0x6d4,"""ho visto troppi post su avvenimento X""

Procede a fare un post su avvenimento X.
Certe volte non capisco se è egocentrismo, farming di karma o voglia di fare i bastian contrari.",0.9619540572166443,0.03756575286388397,positive,anger
ka1c4zf,Io ho intenzione di denunciare la sorellina per discriminazione dato che l'ho vista in TV dire che é colpa degli uomini.,0.6505411863327026,0.34848764538764954,positive,anger
k9yhn61,"Ok. Continuate a farci paura.
No, serio, senza snob e protagonismo.",0.42560601234436035,0.43723413348197937,negative,fear
k9xdxdm,"Si guarda, hai pienamente ragione, sembra che non sia mai avvenuto un femminicidio, eddai, sono sempre successi, e sempre succederanno, non in quanto maschio vs femmine, ma in quanto anima contro anima....anche le coppie gay si ammazzano eh ma non fanno 15 giorni di lutto nazionale e non fanno campagne di educazione ""per rispettare l'uomo""....un politico di cui non ricordo il nome oggi ha dichiarato al TG2 ""importante insegnare a scuola il rispetto della donna""....non sarebbe meglio dire ""il rispetto verso il prossimo""?",0.8260229229927063,0.1719660758972168,positive,anger
k9xugmn,"Invece lo #YesAllMan ha senso, perché i cimiteri sono pieni di ragazze che sono andate ""all'ultimo appuntamento""

Ma quello non sarebbe stato l'ultimo (almeno non con l'accezione di fatale) se la fogna antropomorfa che hanno deciso di incontrare non le avesse uccise. Invece diventano cronaca nera e non è che non l'avessero letta la cronaca nera, non è che ignorassero tutte le altre notizie di ragazze ammazzate, ma andando all'incontro avranno pensato ""ma no, lui non è così... #NotAllMan"".

La cronaca nera è una situazione statisticamente improbabile, con numeri bassissimi rispetto alla quotidianità di rapporti che si logorano e si rompono senza sangue, ma di fatto il finirci dentro, in quella piccola percentuale di vittime all'anno rispetto alla popolazione complessiva, è un fatto che solo a posteriori puoi definire e dire con certezza ""lui non era come quello dei giornali""

Capisci che i tuoi sentimenti offesi da un hashtag contano un po' meno della sicurezza delle persone? Pure in questo caso dove non pare sia stato un incontro pianificato ci sono le dichiarazioni dei genitori di lui di qualche giorno fa che cercavano di smorzare i toni dicendo che ""sì era geloso, ma non in modo preoccupante"".

Allora va bene estremizzare; se si continua a sminuire i segnali di pericolo si alimenta la bolla di ""ma no, mica m'ammazza""",0.3638554513454437,0.6349055171012878,negative,anger
k9zyjnc,"Tutti bravi ragazzi oh. Chissà come, però, quelle che ci rimettono la pelle sono sempre le donne. Mhhhhh",0.07772891223430634,0.00039622862823307514,positive,joy
ka05k60,"Pff, vuoi vedere come ci si prende veramente i downvote? Ecco qua: Turetta è un tipo normale, fino a poco tempo fa davvero un bravo ragazzo, che, molto semplicemente, ha preso male la fine di una relazione ed è caduto in una spirale di odio nei confronti della ex. Quasi sicuramente non è un mostro e non è sempre stato così, ""marcio"". Il motivo? Siate sinceri con voi stessi, lo sapete; per quasi tutti c'è stata/o l'ex che proprio non siete riusciti ad andare oltre per X mesi, magari facendo pensieri orribili nel mentre, alcuni, spero pochi, arrivando a pensare al suicidio o perfino peggio; alcuni magari sono passati in macchina sotto casa sua più del dovuto; alcuni hanno bucato le gomme della macchina; alcuni hanno fatto stalking, alcuni chissà che altre cose MOLTO creepy che neanche mi vengono in mente. Ecco, il 99.99% di questi, dopo quegli orribili X mesi di odio e/o sofferenza, finalmente vanno oltre. Lo 00.01% no. Lo 00.01% si suicida o uccide. Turetta è quello 00.01%.",0.0038935013581067324,0.995811939239502,negative,sadness
k9ykanu,[L'altra faccia della medaglia](https://www.guidapsicologi.it/articoli/pi-suicidi-tra-gli-uomini-dopo-una-rottura-amorosa-perche),0.9985697269439697,0.00032671811641193926,positive,anger
k9zu630,Quello che ho imparato in casi del genere è che in acqua o sottoterra non funziona...,0.02320767194032669,0.9765326976776123,negative,anger
k9zx348,"Sono dell'idea che la notizia sia stata data in modo errato: il modo corretto, secondo me ovviamente, sarebbe ""coglione imbecille ammazza la sua ex fidanzata perché è uno sfigato che si sente troppo coglione per accettare un cambiamento"".
Messa così, questa notizia, occuperebbe il posto che merita. È vero che lei, per chi le era vicino, era tutto, ma per noi che siamo la società, deve occupare il posto giusto: un allarme per capire che c'è gente che ha problemi seri ed intervenire per fare sì che le generazioni future (quindi sì, tra venti e passa anni) non abbiano ancora in circolazione dei ""coglioni imbecilli sfigati che sono troppo coglioni per accettare un cambiamento"".
Quello che viene chiamato ""femminicidio"" (Dio mi punisca per aver usato questo neologismo idiota) è una boiata per fare parlare chi non ha idea di cosa sia il codice penale e farlo lagnare con i giudici. O peggio ancora, fargli credere che introdurre un nuovo reato sia la soluzione a qualsiasi tipo di problema. Roba da chiodi.",0.0055137742310762405,0.9942699670791626,negative,anger
ka03z8r,Un altro chiodo nella bara che contiene le speranze degli ingegneri di trovarsi una donna.,0.9898990988731384,0.005100383888930082,positive,sadness
k9y7s2b,L'ex ragazzo è un figlio sano del patriarcato.,0.9779027104377747,0.0012992837000638247,positive,anger
ka0xilj,Tipico post e commenti da tipo simil incel,0.94666588306427,0.046077217906713486,positive,anger
k9xatbx,"L'Italia in quanto a affettività sta diventando uno scandalo, ma d'altronde chi sa sa (anche in Italia) perché la psiche delle persone non è così variabile.

Giusto parlare di maltrattamenti, sbagliato generalizzare su un ragazzo che potrebbe essere sessualmente insoddisfatto parlando di come fosse un bruto con le donne da una vita.",0.5750532746315002,0.42289212346076965,positive,anger
k9y5fwi,"Perdi troppo tempo a leggere cronaca che non serve a nulla. 

I temi che mi interessano e credo siano rilevanti siano i dettagli processuali per fare in modo che le norme migliorino e che PM e giudici non siano corruttibili.",0.17043107748031616,0.015721768140792847,positive,anger
k9zu3am,"Troppa cronaca nei giornali in Italia, niente di nuovo.",0.7454934120178223,0.2525809407234192,positive,anger
k9zw9ra,"Un classico, poi succede al contrario e si fanno le battutine e la storia finisce lì. Ricordo ancora le notizie di quando avevo quei tumori di social di uomini maltrattati o uccisi dalle compagne per gelosia, la maggior parte delle reaction erano risate e la sezione commenti piena di battute.",0.027294130995869637,0.005260056350380182,positive,joy
k9zwjd6,"Per citare Ravidememe:

Tra quanti giorni torniamo a romanticizzare la figura del “malessere”?",0.9974297881126404,0.000491308281198144,positive,sadness
k9zwlxw,Piccolo OT: ma da dove deriva il fastidioso uso dell'articolo con i nomi.,0.7002324461936951,0.2982245087623596,positive,anger
ka4kn7d,"Tutti eroi, tutti pronti a tutto. Loro si che hanno la soluzione e devono dire la loro importantissima opinione e partecipare con ""sincero"" dolore alle tragedie altrui...  poi tra una settimana passa la moda e non gliene frega più un cazzo a nessuno. L'importante è trovare subito un altro carrozzone di tragedie/avvenimenti per potersi mettere in mostra nei media e sui social. Che vomito.",0.008707505650818348,0.9906398057937622,negative,anger
ka67lj4,"Il fatto che il femminicidio sia strettamente correlato alla misoginia è un dato di fatto. E vorrei anche ricordare agli uomini che io non ce l'ho con loro, ma con i ""maschilisti"". E se questo termine vi fa venire i brividi ogni volta che lo pronuncio, vuol dire che vi sentite, anche se poco, chiamati in causa. 

Dovremmo essere tutti femministi e lottare contro la violenza di genere. Questo non significa non lottare per la giustizia di quella piccola parte di uomini che sono vittime di violenza domestica, assolutamente. La violenza di genere avviene da entrambe le parti, MA statisticamente parlando, sono le donne ad essere le maggiori vittime. Questo spiega perché si sente parlare di ""donna uccisa dal fidanzato per gelosia"" (e su questo avrei MOLTISSIMO da ridire e non il contrario. Come si spiega il perché le donne siano le maggiori vittime di catcalling, battute sessiste (dette anche da donne), stalking, stupri.

Detto questo, invito chi è in disaccordo a riflettere su quanto il sistema patriarcale manipoli psicologicamente la società e ci spinga a normalizzare e sminuire tutto questo. Posso capire che per l'uomo, che fino a adesso ha goduto di molti privilegi sociali si senta surclassato e spodestato dalla donna: beh, non p esattamente così. Per quanto esistano delle donne che si vogliono vendicare dei millenni di oppressione da parte del patriarcato, le VERE femministe lottano per l'abbattimento di questi lussi e per porre finalmente fine alla misoginia tanto giustificata dai reazionari, al fine di ricostruire da zera una società dove una donna non ha più paura di:

\-uscire da sola senza venir molestata

\-lasciare il proprio ragazzo per paura di venir uccisa

\-attirare l'attenzione degli stupratori soltanto perché è vestita in un modo che ai loro occhi giustifica lo stupro

\-dire la sua senza venir tempestata di commenti sessisti in cui vengono messi in mezzo la propria vita personale e il proprio aspetto fisico 

Si, lo so, ANCHE gli uomini sono vittime di violenza, ma vi prego, guardatevi intorno: quanti uomini vengono stalkerati per anni, stuprati in gruppo, sfregiati con l'acido, uccisi a coltellate, fucilate, fatti a pezzi o, come in questo caso, gettati in un lago? Quanti, per mano di una donna? Ah, ecco, pochissimi. E mi pare pure che quando se ne parla, la donna viene messa alla gogna e demonizzata. Non mi pare che all'inverso la situazione sia la stessa. Mi pare, anzi, che ci sia molta gente pronta a sminuire l'atto, a colpevolizzare la vittima, dicendo ""se avesse fatto x, non sarebbe successo y"", ""lui l'amava troppo"", ""lui adesso sta soffrendo come un cane in prigione"", ""lei se l'è cercata"". 

Traete le vostre conclusioni.",0.852025032043457,0.13122034072875977,positive,sadness
k9x8tvb,"Non so niente della vita personale delle due persone ma non mi piace la mancanza di sfumature nel modo in cui è stato presentato la vicenda.

Sicuramente questo uomo deve aver sofferto moltissimo in qualche modo, e non è stato aiutato. Molti uomini quando cercano aiutato vengono trattati male perché ci si aspetta che non provino sofferenza e quindi smettono di cercare aiuto. Se si dipinge lui come un mostro insensibile e non si cerca di capire quali problemi aveva che lo hanno spinto a comportarsi così allora non si fa altro che peggiorare questa dinamica.",0.0016100268112495542,0.9982303977012634,negative,sadness
k9zxtjh,"Manca solo un particolare, le troppe donne che denunziano per reati detti spia per due messaggi ricevuti, magari di servizio, del tipo ""volevo solo dirti che l'amico comune Caio ha contratto un tumore"" distogliendo le forze dell'ordine dal cogliere segnali concreti che erano ben visibili anche in questo caso...",0.872814416885376,0.12537503242492676,positive,anger
ka1knmq,"Io è da tempo che noto una sempre crescente schiettezza nel raccontare come sono accaduti i fatti (tizio accoltellato, tizia stuprata e fatta a pezzi), una morbosità che a mio parere sta desensibilizzando gli italiani di fronte a queste atrocità.",0.09479326754808426,0.9031324982643127,negative,anger
ka5qfy8,"L'italiano di solito risolve tutto ""simbolicamente"". Massimalismo, qualche hashtag dal sapore un po' nazi (YesAllMan = YesAllJews= yesallblack = yesallshoersighted =... ) Che però, tutto sommato, ""vabbene"" e tutti felici e contenti.
Qualche ometto si sente bene: scrive che i maskih fannoskifoh e via e magari spera qualche ragazza si accorga di lui, perché lui, lui che odia gli uomini, lui sì che è un bravo ragazzo.
Qualche donna si sfoga e magari ci sta... E magari quella che ha preso senza poter dire nulla qualche manata nel sedere dal capo ufficio, fa pure bene a dire ""yes all men"". È quantomeno catartico, basta che a sangue freddo non diventi un moto sociale, se no torniamo al sapore nazi.

E in mezzo a questo i giornalisti prosperano, ché anche a loro è richiesto di fare ""clickclickclick"", se no oggi più che mai li buttano via e ci mettono magari un abbonamento a chatGPT che, per il 90% degli articolisti, nemmeno si noterebbe la differenza.

Poi ci sono influencer arrivisti e arriviste che cercano di cavalcare l'onda

E infine, ultimo anello della catena alimentare TU! Tu che leggi, che vivi una crisi di identità, che ti dispiace, che vorresti quasi sentirti in colpa per essere un po' come Renga («scusa Giulia» fossi parente di Giulia ce lo avrei mandato senza passare dal via), per essere anche tu, un giusto.
Ma se una persona pensante e no, non ti senti in colpa e allora... Ci stai pure male.

Ricorda che siamo solo un tipo di primate astuto e aggressivo.
Abbassa le aspettative e vivi meglio.
Siamo la stessa specie che un secolo fa organizzava la Shoah. Che pretendi?",0.027065951377153397,0.015788903459906578,positive,anger
