comment_id,comment_body,myscore,preprocessed_comment,myscore_preprocessed
k9yfohd,"Il vero problema è l'immensa orda di giornalisti e altra gente che non vede l'ora che accada una tragedia per parlanne per settimane, strumentalizzando la notizia, manipolando l'opinione pubblica cercando di dividere le persone in più correnti di opinioni per poter avere dibattiti continui sull'argomento.

Questo finche la notizia non interessa più a nessuno, e magicamente tutti si dimenticano dei dibattiti montati sopra un morto, e allora si può tornare all'unica possibile conclusione che chi ha ucciso è giustamente in prigione, e chi è morto lo è ingiustamente.

Quello che resta impunito è chi ha guadagnato soldi e share televisivo da queste tragedie.","['neutral', 'surprise']",il vero problema il immensa ordare giornalista altro gente non vedere il ora accada tragedio parlanere settimana strumentalizzare notizia manipolare il opinione pubblico cercare dividere persona più corrente opinione potere avere dibattito continuo su il argomento questo finco notizia non interessare più nessuno magicamente dimenticano dibattito montare sopra morire allora potere tornare a il unico possibile conclusione uccidere giustamente prigionere morire ingiustamente Quello restare impunito guadagnare soldo share televisivo tragedia,"['positive', 'fear']"
k9xjbzd,"Non è un idiota l'ex ragazzo, è un assassino, punto.","['negative', 'anger']",non idiotare il ex ragazzo assassino punto,"['negative', 'anger']"
k9zies2,Sono sti ragazzetti sui social che ormai han perso la testa e ogni tipo di personalità e o fanno i cinici finti redpillati o le suffragette a tempo perso ormai ogni cosa nel mondo è A o B e sui social i ragazzetti ci vanno dietro senza pensare.,"['negative', 'sadness']",essere sto ragazzetto social ormai han perso testa ogni tipo personalità cinico finto redpillare suffragette tempo perdere ormai ogni cosa more A B social ragazzetto andare dietro senza pensare,"['negative', 'sadness']"
k9xb0xr,"Non fatevi influenzare dai post, continuate ad essere uomini civili e dimostratelo. Le mele marce ci saranno SEMPRE","['neutral', 'none']",non fatevie influenzare post continuato essere uomo civile dimostratelo il mela marce SEMPRE,"['positive', 'joy']"
k9xmjhd,"ti da fastidio perchè percepisci giustamente che qualcosa nel circo mediatico stona. tutta questa voglia di esprimere giudizi, articolate quanto strampalate ipotesi sociologiche sui perchè e i percome, le strumentalizzazioni, la tv del dolore e della caccia alle responsabilità nascondono il bisogno disperato di avere  il controllo, o meglio l'illusione del controllo. perchè se vogliamo essere lucidi, questo è il tipo di eventi impossibile da prevedere e la gente spaventata celebra i suoi rituali di esorcizzazione grotteschi proprjo per questo motivo (oltre naturalmente ai media che ci mangiano sopra)","['negative', 'anticipation']",fastidio perché percepiscare giustamente qualcosa circo mediatico stonare tutto voglia esprimere giudizio articolato strampalare ipotese sociologico perché percome strumentalizzazione tv dolore cacciare responsabilità nascondere bisogno disperato avere controllo meglio il illusione controllo perché volere essere lucido tipo evento impossibile prevedere gente spaventato celebra rituale esorcizzazionere grottesco proprjo motivo oltre naturalmente medio mangiare sopra,"['negative', 'surprise']"
k9xj3td,[deleted],"['neutral', 'none']",deleted,"['neutral', 'none']"
k9zeqj7,"Io sono basita, nei commenti ho letto moltissimi dire che è colpa dei genitori e ancora di più della madre. Capisco che l'educazione e l'esempio siano una parte importante della personalità, ma deresponsabilizzare così un ASSASSINO è una vera follia: non c'è educazione al mondo che ti fa oltrepassare certi limiti.","['positive', 'disgust']",io basita commento leggere molto dire colpa genitore ancora più madre Capisco il educazione il esempio parte importante personalità deresponsabilizzare così ASSASSINO vero follia non ci essere educazione more fare oltrepassare certo limite,"['positive', 'fear']"
k9xdoak,[deleted],"['neutral', 'none']",deleted,"['neutral', 'none']"
k9zsz6f,"Senza niente togliere al grave fatto che è successo, ma non vi scassate il cazzo a fare i finti paladini della giustizia sulla scia dei media vari che portano all'esasperazione ogni dramma solo per fare un po' di audience e click in più? Io non ci credo che ci sia gente che pensa davvero che con un hashtag possa cambiare la natura dell'essere umano, sono 2000 e passa anni che la gente si ammazza per le cose più stupide e non sarete voi a cambiare questa cosa. È successa una cosa terribile, le forze dell'ordine e compagnia bella han fatto il loro lavoro. Basta. Smettetela di fare le cazzo di pettegole di paese. Non è una storia che vi riguarda, non è una storia che riguarda nessuno di noi se non le famiglie coinvolte.
E non venitemi a dire che lo fate per ""fare vedere il problema a tutti"", perché tra una settimana non vi ricorderete nemmeno che sia successo. Un po' come per le migliaia di persone morte in Ucraina, ma ormai quello non fa più notizia, giusto?","['negative', 'fear']",senza niente togliere grave fatto successo non scassare cazzo fare finto paladino giustizia scia medio vario portare a il esasperazione ogni dramma solo fare po audience clie ck più Io non credere gente pensare davvero Hashtag potere cambiare natura di il essere umano 2000 passare anno gente ammazzare cosa più stupido non cambiare cosa essere successo cosa terribile forza di il ordine compagnia bello han fare lavoro Basta Smettetela fare cazzo pettegole paese non storia riguardare non storia riguardare nessuno non famiglia coinvolgere E non venitema dire fare fare vedere problema settimana non ricorderere nemmeno successo uno po migliaio persona morto Ucraina ormai non fare più notizia giusto,"['positive', 'anger']"
k9x4zrt,"Sono un ragazzo di 25 anni e ho seguito molto intensamente la vicenda in quanto veneto e in quanto ero nel ristorante di fianco a dove hanno mangiato loro quel maledetto Sabato.
Non c'è nulla da dire, straziante e dir poco aberrante.
Detto ciò ne ho piene le scatole di quest'odio generico nei confronti di qualsiasi elemento maschile.
Si ci sono delle merde, uomini volgari e ignoranti, soprattutto sul posto di lavoro e molti altri luoghi ma oltre a questi ci sono uomini di uno spessore infinito, uomini che si comportano con grande rispetto, così come ci sono donne volgari e ignoranti e donne di uno spessore altissimo.
L'odio non porta mai da nessuna parte, è solo un catalizzatore di un altro inevitabile disastro, che senso ha screditare milioni di persone per l'atto di un pazzo che ha perso il controllo? Nessuno","['negative', 'fear']",essere ragazzo 25 anno seguire molto intensamente vicenda Veneto ristorante fianco mangiato quello maledetto Sabato Non ci essere nulla dire straziante dire poco aberrante dire ciò pieno scatola questo odio generico confronto qualsiasi elemento maschile si merdere uomo volgaro ignorante soprattutto porre lavoro molto altro luogo oltre uomo spessore infinito uomo comportare grande rispetto così donna volgare ignorante donna spessore alto il odio non portare mai nessuno parte solo catalizzatore altro inevitabile disastro senso screditare milione persono il atto pazzo perdere controllo Nessuno,"['negative', 'disgust']"
k9y9fmu,"Vorrei dire una cosa, che tra quelle che ho letto sotto personalmente ritengo la peggiore: di questa brutta vicenda, tra una settimana nessuno se ne ricorderà più. Il nome della ragazza scenderà nell'oblio e diventerà un numero da riportare in dati ISTAT che saranno dati al supporto del prossimo caso di femminicidio. Non c'è memoria collettiva, non c'è una vera propensione da parte di nessuno a risolvere il problema, è solo fare casino. Il fatto che queste cose diventino casi mediatici all'istante e spariscano dalle nostre menti poco dopo è secondo me la riprova del fatto che siano solo usate per fare caciara. I social ci hanno reso un gregge di pecore, tutti che belano per risolvere un problema ma nessuno che ne analizza le radici, provi ad identificare uno schema o proponga soluzioni. E mentre sui social divampa la polemica, nella nostra mente piano piano si spenge il volto della ragazza, il suo nome, la vicenda. Tra un mese il ciclo si ripeterà, ma nessuno farà mai effettivamente qualcosa, continueranno solo a sfruttare i nomi delle vittime e il dolore delle famiglie per fare casino finché la gente non si dimenticherà di loro. Che tristezza","['negative', 'sadness']",volere dire cosa leggere sotto personalmente ritenere peggiore brutto vicenda settimana nessuno ricordare più il nome ragazzare scendere in il oblio diventare numero riportare dato ISTAT dato supporto prossimo caso femminicidio non ci essere memoria collettivo non ci essere vero propensione parte nessuno risolvere problema solo fare casino il fatto cosa diventino caso mediatico a il istante spariscare mente poco dopo secondo me riprovare fare solo usata fare caciaro il social rendere gregge pecora belare risolvere problema nessuno analizza radice provi identificare schema propongare soluzione e mentre social divampa polemica mente piano piano spenge volto ragazzare nome vicenda Tra mese ciclo ripetare nessuno mai effettivamente qualcosa continuare solo sfruttare nome vittima dolore famiglia fare casino finché gente non dimentichere Che tristezzare,"['negative', 'sadness']"
k9wwpa2,Chi scrive #yesallman sono delle 104 mancate,"['neutral', 'none']",chi scrivere # yesallman 104 mancare,"['neutral', 'none']"
k9y4eev,"Spesso, le voci più assillanti nei momenti di tragedia sono quelle di chi non ne ha fatto parte, mentre nella quiete rimangono la disperazione di una famiglia che ha perso una figlia e di genitori che dovranno convivere con il senso di colpa delle azioni del proprio figlio.
È importante discutere di queste tematiche, ma alcune conversazioni creano solo danni e diffondono stereotipi. Gli uomini non sono tutti mostri, e le donne non sono tutti angeli, personalmente mi piacerebbe vedere il discorso affrontato da una prospettiva e non come il solito ""al rogo il mostro"". perché questo gesto del ragazzo? Vi era forse qualche disturbo psicologico mai diagnosticato per negligenza? O forse era un concetto di ""relazione e amore"" sbagliato?. Trattare l'argomento così, potrebbe aiutarci anche a riflettere sul bisogno di educare i ragazzi alle relazioni, non solo da un punto di vista sessuale ma anche emotivo e aprirebbe anche la possibilità di prendere veramente sul serio la salute mentale dei giovani. 
Ma a nessuno importa veramente di cambiare qualcosa, vogliamo tutti sentirci gli eroi del momento, dalla parte del giusto, e senza queste tragedie non potremmo.","['positive', 'sadness']",spesso voce più assillanto momento tragedio non fare parte mentre quieto rimanere disperazione famiglia perso figlio genitore dovere convivere senso colpa azione proprio figlio essere importante discutere tematico alcuno conversazione creare solo danno diffondono stereotipo il uomo non mostro donna non angelo personalmente piacere vedere discorso affrontare prospettiva non solire rogo mostro gesto ragazzo vi forse qualche disturbo psicologico mai diagnosticare negligenza O forse concetto relazione amore sbagliato Trattare il argomento così potere aiutare ci riflettere bisogno educare ragazzo relazione non solo punto vista sessuale emotivo apriere possibilità prendere veramente serio salute mentale giovane ma nessuno importare veramente cambiare qualcosa volere sentire ci eroe momento parte giusto senza tragedia non potere,"['positive', 'fear']"
ka012fg,"Un uomo uccide la sua ex --> tutti gli uomini vanno rieducati

Un immigrato ruba --> tutti gli immigrati sono delinquenti

Io sta generalizzazione non la capirò mai. Tanta colpa è dei media in generale","['neutral', 'disgust']",uno uomo uccidere ex -- > uomo andare rieducare uno immigrato ruba -- > immigrato delinquente io generalizzazione non capire mai tanta colpa medio generale,"['negative', 'anger']"
k9x9z3j,"E niente, presunzione di innocenza rip

https://preview.redd.it/ypw5gjrsvc1c1.jpeg?width=1080&format=pjpg&auto=webp&s=f29df6e1c59a6625b1946549720b1e5e9c478820","['neutral', 'none']",e niente presunzione innocenzo rip https://preview.redd.it/ypw5gjrsvc1c1.jpeg?width=1080&format=pjpg&auto=webp&s=f29df6e1c59a6625b1946549720b1e5e9c478820,"['negative', 'none']"
k9xd13t,"Ho visto talmente tanti post e commenti che si schierano ai due poli opposti. Donne e uomini che gridando alla pena di morte, non capendo che perpetuano la stessa violenza che la ragazza ha subito. La morte del tipo non cambia nulla anzi izerebbe solo odio. La pena di morte e da società primitiva, il carcere serve proprio a questo a farti penare per riacquistare l umanità che hai perso. (funziona o non funziona lo scopo è questo). Il bello è che le stesse donne, una piccola parte di queste, incoraggano questa morte anzi addirittura l evirazione, non accorgendosi che non sarebbero diverse dal tizio.

Un altra categoria è quella che scrivi post sui segnali d' allarme, che lo prevedevano e io qui aggiungo che invece di fare i detective conan su internet perché non si alzano e non vanno a manifestare in piazza per introdurre una funzione scolastica dove si insegna l educazione sessuale, intesa anche come educazione affettiva, perché protestare quando si può fare la saccente sui social. 

Ci stanno donne che dicono che TUTTI gli uomini sono violenti e che stanno venendo massacrate, vabbè qui nemmeno bisogna aggiungere altro.

 Ho letto uomini che si scusano di essere uomini, che deficenti porcodio, ma che l hai uccisa tu. Ma che sei stato tu a compiere questo omicidio, una stupidità clamorosa. 

Io da uomo l unico cosa che posso fare è condannare un azione palesemente da deviante, ma non mi devo scusare di nulla. Certe che sui social fino al giorno prima erano gelose, volevano il ragazzo possessivo, geloso etc... Oggi che fanno? Condividono questa robba. Boh di una bassezza infinita. Io non do nessuna colpa alla ragazza perché che colpe ha? Condanno il tipo? Certamente. I social inibiscono l abilità critica delle persone, il fatto che tutti possano avere una voce poi così positivo non è, si genera solo un odio inutile, verso l altro sesso in questo caso.","['negative', 'sadness']",avere vedere talmente tanto post commento schierare due pole opposto Donne uomo gridare pena morto non capere perpetuare stesso violenza ragazzare subito il morte tipo non cambiare nulla anzi izere solo odiare il pena morto società primitivo carcere servire proprio farto penare riacquistare umanità perso funzionare non funzionare scopo il bello donna piccolo parte incoraggare morto anzi addirittura evirazione non accorgendoso non diverso tizio uno altro categoria scrivo post segnale d allarme prevedere qui aggiungere invece fare detectivo conan internet non alzare non andare manifestare piazza introdurre funzione scolastico insegna educazione sessuale intesa educazione affettire protestare quando potere fare saccente social Ci donna dire TUTTI uomo violento venire massacrare vabbè qui nemmeno bisognare aggiungere altro avere leggere uomino scusano essere uomo deficente porcodio uccidere ma essere compiere omicidio stupidità clamoroso io uomo unico cosa potere fare condannare azione palesemente deviante non dovere scusare nulla certe social fino giorno prima gelosa volere ragazzo possessivo geloso etc ... oggi Condividono robbao Boh bassezza infinitare Io non do nessuno colpa ragazzare colpe Condanno tipo certamente il social inibiscere abilità critico persona fare potere avere voce poi così positivo non generare solo odio inutile verso altro sesso caso,"['negative', 'sadness']"
k9xochb,"Io non so mai cosa dire a riguardo. Quindi mi ricordo che in questi casi è meglio stare zitti. Ma ho l'ansia per il giorno in cui qualcuno/a mi rinfaccerà questa situazione, e penso che l'unica cosa intelligente sarà appunto chiedere scusa o sviare il discorso.

Onestamente sono pure abbastanza turbato, perché ultimamente mi sono dato un po' al true crime e vedendo casi tipo Junko furuta o un altro di cui non voglio fare il nome per evitare sciacallaggio, e con questo caso di Giulia, mi viene solo un nodo allo stomaco, pure pensando che era molto giovane e in procinto di iniziare la fase seria della sua crescita personale.

Forse davvero penso troppo a pararmi il culo da accuse che effettivamente non mi toccano, e non penso abbastanza a ragazze che sono con questa paura. Effettivamente io penso di non conoscere nessuna ragazza che non abbia subito violenze o molestie in qualche modo.

Dall'altro canto tutto ciò mi sembra qualcosa a livello di terrorismo psicologico. Come quando c'erano scandali con stranieri e allora tutti gli extracomunitari erano bestie da tenere sotto controllo. 

Non volevo fare questo papiro lol, mi sono lasciato trascinare.","['positive', 'trust']",io non sapere mai cosa dire riguardo Quindi ricordo caso meglio stare zitto ma il ansia giorno qualcuno rinfaccare situazione pensare il unico cosa intelligente appunto chiedere scusa sviare discorso onestamente pure abbastanza turbare ultimamente dare po true crime vedere caso tipo Junko furutere altro non volere fare nome evitare sciacallaggio caso Giulia venire solo nodo stomaco pure pensare molto giovane procinto iniziare fase serio crescita personale forse davvero pensare troppo parare mi culo accuso effettivamente non toccare non pensare abbastanza ragazzo paurare Effettivamente pensare non conoscere nessuno ragazza non subito violenza molestio qualche modo Da il altro canto ciò sembrare qualcosa livello terrorismo psicologico come quando ci essere scandale straniero allora extracomunitare bestia tenere sotto controllo Non volere fare Papiro lol lasciare trascinare,"['neutral', 'fear']"
k9zrewy,"A prescindere dal genere, uomo o donna che sia, una persona che ha anche solo il pensiero di uccidere un’altra persona non dovrebbe appartenere a questa terra. La colpa non è di nessuno, se non del soggetto che commette queste atrocità. E per me parlare di “raptus” in questi casi è semplicemente una paraculata, una persona normale non commetterebbe mai e poi mai un omicidio, non le passerebbe neanche per l’anticamera del cervello.","['negative', 'anticipation']",a prescindere genere uomo donnare persona solo pensiero uccidere ’ altro persona non dovere appartenere terra il colpa non nessuno non soggetto commettere atrocità E me parlare “ raptus ” caso semplicemente paraculare persona normale non commettare mai poi mai omicidio non passare neanche ’ anticamerare cervello,"['negative', 'sadness']"
k9zv87l,"A me sembrano assurdi gli insulti atroci ai genitori di lui, come se l'avessero allevato con l'obiettivo di diventare il nuovo Ted Bundy. Questi poveri cristi hanno probabilmente un figlio psicopatico narcisista che ha nascosto per anni la sua vera natura.","['negative', 'anticipation']",a me sembrare assurdo insulto atroce genitore lo avere allevare il obiettivo diventare nuovo Ted Bundy questo povero crista probabilmente figlio psicopatico narcisista nascosto anno vero natura,"['negative', 'anticipation']"
k9x0g2l,"A me il post che sta girando su Instagram che fa più paura da una parte, e mi infastidisce come uomo dall’altra è quello che dice: “potevamo essere tutte noi” che secondo me generalizza incredibilmente e dipinge TUTTI gli uomini come assassini. O anche quello che dice “incredibile ritenersi fortunata che non sia successo a me”, come se fosse “normale” per un uomo uccidere una donna","['neutral', 'anticipation']",a me post girare Instagram fare più paura parte infastidire uomo ’ altro dire “ potere essere tutto ” secondo me generalizzare incredibilmente dipingere TUTTI uomo assassino O dire “ incredibile ritenere si fortunare non successo me ” “ normale ” uomo uccidere donna,"['negative', 'anger']"
k9zp7fh,"1. l'ex ragazzo non è un idiota, è un assassino di m..da.

2. tutta la pubblicità ci fa pensare che l'italia è molto pericolosa e che le cose vanno sempre peggio.

Invece non è vero per niente: 

1. omicidi in italia sono a una rata più bassa oggi, paragonato agli ultimi 30 anni.

2. dalla prospettiva del' omicidio, l'italia è il paese più sicuro in assoluto di *tutti paesi* UE, tranne Lussemburgo (che per me non conta come un paese normale).

https://www.statista.com/statistics/1268504/homicide-rate-europe-country/","['positive', 'anger']",1 il ex ragazzo non idiotare assassino m .. 2 tutto pubblicità fare pensare il Italia molto pericoloso cosa andare sempre peggio invece non vero niente 1 omicidi Italia rare più basso oggi paragonare ultimo 30 anno 2 prospettiva omicidio il Italia paese più sicuro assoluto paese UE tranne lussemburgo me non contare paese normale Https://www.statista.com/statistics/1268504/homicide-rate-europe-country/,"['positive', 'fear']"
k9zlwc7,Io mi chiedo cosa porti un ragazzo ad uccidere la propria ex ragazza. Io non riuscirei neanche a immaginare una cosa così… non c’è modo alcuno di vedere che una persona è disturbata a questo livello?,"['negative', 'anger']",io chiedere cosa portare ragazzo uccidere proprio ex ragazza Io non riuscire neanche immaginare cosa così … non ’ modo alcuno vedere persona disturbare livello,"['neutral', 'anger']"
k9yd84g,"Sfumature e ragionamenti complessi non sono compatibili con la velocità dei social. 
Non puoi aspettarti di riuscire a intravedere la reale stratificazione delle opinioni umane attraverso reddit/instagram/facebook e aggregatori vari. 
Questi strumenti, per come sono strutturati, fanno emergere solo posizioni più radicali, che per loro natura sono più adatte a generare il  traffico e le interazioni che sono la linfa di ogni piattaforma social.
Più ciò che dici è radicale e infiammatorio, più traffico e interazioni generi. 
Se le tue opinioni sono tiepide e moderate passi in sordina. 

Cosa c'è realmente da dire su questa tragedia? 
Nulla. Non c'è nulla da dire. Un ragazzo malato e  violento ha ucciso una ragazza. 

Vuoi avere più commenti? 
Allora aggiungi che lui è un incel, che tutti gli uomini sono violenti, il femminicidio ecc ecc. 

Oppure aggiungi che lei se l'è cercata, che gli uomini sono oppressi dalla società ecc ecc. 

E allora vedi che la gente comincia a far rumore, a cliccare, a condividere.","['negative', 'disgust']",sfumature ragionamento complesso non compatibile velocità social Non potere aspettare ti riuscire intravedere reale stratificazione opinione umano attraverso reddit instagram Facebook aggregatore vario questo strumento strutturato emergere solo posizione più radicale natura più adatto generare traffico interazione linfa ogni piattaforma social Più ciò dici radicale infiammatorio più traffico interazione genere se opinione tiepido moderato passo sordinere Cosa ci essere realmente dire tragedia Nulla Non ci essere nulla dire uno ragazzo malato violento uccidere ragazzo Vuoi avere più commento Allora aggiungi incelo uomo violento femminicidio ecc ecc oppure aggiungi lo essere cercare uomo oppresso società ecc ecco e allora vedere gente cominciare fare rumore cliccare condividere,"['negative', 'anger']"
k9zw9fx,"Aggiungiamo che ho letto di femmine che dicevano cose come ""oh, ho un'ansia assurda all'idea di crescere un figlio maschio e educarlo a dovere"". Luride. Immagina angosciarsi perchè la tua progenie potrebbe essere di un sesso che, secondo la tua deviata percezione della realtà, è naturalmente colpevole ed incline al male in quanto maschio. Augurerei loro tanti figli maschi, se non fosse che quei poretti avrebbero un'infanzia orribile con simili donne come madri. Senza contare tutti gli uomini che dovrebbero vergognarsi di essere tali perchè una minoranza di essi ha fatto cose. Io invece continuo a sentirmi fiero di essere uomo e tale orgoglio aumenta quando vedo quanto si umiliano stoltemente quei folli scusarsi per colpe altrui. E prima che le femministe inizino con l'insulto classico che mi definirebbe incel a cui le donne non la danno, sono omo e le donne mi fanno effettivamente ribrezzo.","['positive', 'trust']",Aggiungiamo leggere femmina dicevare cosa oh uno ansia assurdo a il idea crescere figlio maschio educare lo dovere Luride Immagina angosciare si perché progenie potere essere sedere secondo deviare perceziorre realtà naturalmente colpevole incline male maschio Augurerei tanto figlio maschio non quello poretto uno infanzia orribile simile donna madre Senza contare uomo dovere vergognare si essere tale perché minoranza esso fare cosa io invece continuo sentire mi fiero essere uomo tale orgoglio aumentare quando vedere umiliare stoltemente quello follo scusare si colpe altrui e prima femministe inizino il insulto classico definire incel donna non dare omo donna effettivamente ribrezzo,"['neutral', 'sadness']"
k9y2frg,"Ma sì ora spolpano l'osso, poi rimarrà solo il dolore e la sofferenza di parenti e familiari.
Nella speranza che quell'escremento arrestato, diventi a breve il tutor anale di un grosso criminale con una lacrima tatuata sotto l'occhio, tipo compagni di cella x l'ergastolo.","['negative', 'fear']",ma sì ora spolpare il osso poi rimarre solo dolore sofferenza parente familiare in il speranza quello escremento arrestare diventare breve tutor anale grosso criminale Lacrima tatuare sotto il occhio tipo compagno cello x il ergastolo,"['negative', 'fear']"
