comment_id,comment_body,myscore,preprocessed_comment,myscore_preprocessed
k9ydmik,"La condanna dell'assassino va fatta senza ombra di dubbio. Nella mia condizione nello specifico , io ho 23 anni e non ho mai avuto una ragazza, mai nemmeno baciata. Mi fa provare un forte dolore interiore vedere che i ragazzi violenti e che compiono questi atti hanno sempre una vita sentimentale quando io invece vengono solo rifiutato in ogni modo.  Dai violenti e gli assassini io prendo ogni distanza possibile. Non è nel mio modo di essere fare del male o avere un comportamento possessivo. Però molte donne questo comportamento dominante lo apprezzano. Molte cose sarebbero diverse se si desse meno importanza a queste qualità. Dire che sia data troppa importanza alle qualità sbagliata non vuole in alcun modo togliere agli assassini le loro colpe. Però se c'è una cosa su cui le donne dovrebbero riflettere è questa. Di uomini ""beta"" rifiutati e non voluti da nessuna ce n'è davvero un esercito.  E se le donne sbagliano nell'apprezzamento di cose frivole, anche gli uomini sbagliano pensando sostanzialmente solo a scopare che di per sé non è una cosa di chissà quale valore se svuotata di tutto il resto... 

Ma forse qui qualcuno voleva sapere più esattamente cos'è che induce a compiere atti di questo tipo. Se escludiamo la predisposizione, io ritengo che lo stato attuale delle relazioni umane è una ricetta per il disastro. Di base qual è l'essenza delle relazioni oggi? Si punta al matrimonio? Si punta a trovare l'amore eterno? Da quello che vedo l'unico fine è l'edonismo. A volte si finge che ci sia dell'altro ma nei fatti ormai c'è solo questo. In questo gioco perverso, anche se tutto va bene subentra la noia, diventa una gara a chi ottiene di più e va a finire spesso che alcuni uomini per questa rabbia di restare a bocca asciutta arrivino alla violenza. Ma ancora una volta io da costoro prendo ogni distanza possibile perchè la mia disperazione è data dal fatto che l'amore è impossibile. Le vicende della mia vita, il modo in cui le ragazze hanno rifiutato me per mettersi insieme a chi le ha picchiate e uccise lo dimostra in modo inequivocabile. Io piango perchè l'amore dei poeti e della letteratura è una grossa bugia. Dell'edonismo nichilista che oggi si finge amore non so che farmene esso non ha alcun valore. Quindi concretamente, quale può essere la soluzione? La logica è sicuramente una soluzione, perchè abbandonarsi alle proprie emozioni porta poi ad atti violenti e orribili...","['positive', 'trust']",il condanna di il assassino andare fare senza ombra dubbio in il condizione specifico 23 anno non mai ragazzare mai nemmeno baciato Mi fare provare forte dolore interiore vedere ragazzo violento compiere atto sempre vita sentimentale quando invece venire solo rifiutare ogni modo da il violento assassino prere ogni distanza possibile non modo essere fare male avere comportamento possessivo Però molto donna comportamento dominante apprezzare molto cosa diverso dere meno importanza qualità Dire dare troppo importanza qualità sbagliato non volere alcuno modo togliere assassino colpe Però ci essere cosa donna dovere riflettere Di uomo beta rifiutare non volere nessuna ce ne essere davvero esercito e donna sbagliare in il apprezzamento cosa frivolo uomo sbagliare pensare sostanzialmente solo scopare sé non cosa chissà valore svuotare resto . ma forse qui qualcuno volere sapere più esattamente cos' essere indurre compiere atto tipo Se escludiamo predisposizione ritenere essere attuale relazione umano ricetta disastro Di base quale il essenza relazione oggi Si puntare matrimonio Si puntare trovare il amore eterno Da vedere il unico fine il edonismo A volta fingere di il altro fatto ormai ci essere solo in gioco perverso andare bene subentrare noia diventare gara ottenere più andare finire spesso alcuno uomo rabbia restare bocca asciutta arrivare violenza ma ancora volgere costoro prere ogni distanza possibile perché disperazione dare fare il amore impossibile il vicenda vita modo ragazzo rifiutare me mettere si insieme picchiato uccidere dimostrare modo inequivocabile io piangere perché il amore poetare letteratura grosso bugia di il edonismo nichilista oggi fingere amore non sapere farmene esso non alcun valore Quindi concretamente potere essere soluzione il logica sicuramente soluzione perché abbandonarso proprio emozione portare poi atto violento orribile ...,"['negative', 'anger']"
k9zyqsv,"e quindi, ne fai un altro .. tutto regolare","['positive', 'none']",quindi altro .. regolare,"['positive', 'none']"
ka0x6d4,"""ho visto troppi post su avvenimento X""

Procede a fare un post su avvenimento X.
Certe volte non capisco se è egocentrismo, farming di karma o voglia di fare i bastian contrari.","['neutral', 'none']",vedere troppo post avvenimento X Procede fare post avvenimento X certe volta non capisco egocentrismo farming karma voglia fare bastian contrario,"['negative', 'none']"
ka1c4zf,Io ho intenzione di denunciare la sorellina per discriminazione dato che l'ho vista in TV dire che é colpa degli uomini.,"['negative', 'disgust']",io intenzionere denunciare sorellino discriminazione dare lo avere vedere TV dire é colpa uomo,"['negative', 'disgust']"
k9yhn61,"Ok. Continuate a farci paura.
No, serio, senza snob e protagonismo.","['neutral', 'none']",Ok Continuate fare ci paura No serio senza snob protagonismo,"['negative', 'anticipation']"
k9xdxdm,"Si guarda, hai pienamente ragione, sembra che non sia mai avvenuto un femminicidio, eddai, sono sempre successi, e sempre succederanno, non in quanto maschio vs femmine, ma in quanto anima contro anima....anche le coppie gay si ammazzano eh ma non fanno 15 giorni di lutto nazionale e non fanno campagne di educazione ""per rispettare l'uomo""....un politico di cui non ricordo il nome oggi ha dichiarato al TG2 ""importante insegnare a scuola il rispetto della donna""....non sarebbe meglio dire ""il rispetto verso il prossimo""?","['positive', 'trust']",si guardare pienamente ragione sembrare non mai avvenire femminicidio eddai sempre successo sempre succedare non maschio vs femmina anima anima ... coppia gay ammazzano eh non 15 giorno lutto nazionale non campagna educazione rispettare il uomo ... politico non ricordare nome oggi dichiarare TG2 importante insegnare scuola rispetto donna ... non meglio dire rispetto verso prossimo,"['positive', 'trust']"
k9xugmn,"Invece lo #YesAllMan ha senso, perché i cimiteri sono pieni di ragazze che sono andate ""all'ultimo appuntamento""

Ma quello non sarebbe stato l'ultimo (almeno non con l'accezione di fatale) se la fogna antropomorfa che hanno deciso di incontrare non le avesse uccise. Invece diventano cronaca nera e non è che non l'avessero letta la cronaca nera, non è che ignorassero tutte le altre notizie di ragazze ammazzate, ma andando all'incontro avranno pensato ""ma no, lui non è così... #NotAllMan"".

La cronaca nera è una situazione statisticamente improbabile, con numeri bassissimi rispetto alla quotidianità di rapporti che si logorano e si rompono senza sangue, ma di fatto il finirci dentro, in quella piccola percentuale di vittime all'anno rispetto alla popolazione complessiva, è un fatto che solo a posteriori puoi definire e dire con certezza ""lui non era come quello dei giornali""

Capisci che i tuoi sentimenti offesi da un hashtag contano un po' meno della sicurezza delle persone? Pure in questo caso dove non pare sia stato un incontro pianificato ci sono le dichiarazioni dei genitori di lui di qualche giorno fa che cercavano di smorzare i toni dicendo che ""sì era geloso, ma non in modo preoccupante"".

Allora va bene estremizzare; se si continua a sminuire i segnali di pericolo si alimenta la bolla di ""ma no, mica m'ammazza""","['positive', 'trust']",invece # YesAllMan senso cimiterare pieno ragazzo andare a il ultimo appuntamento Ma non essere il ultimo almeno non il accezione fatale fogna antropomorfa decidere incontrare non uccidere Invece diventare cronaca nero non non lo avere leggere cronaca nero non ignorassero tutto altro notizia ragazzo ammazzare andare a il incontro pensato no non così ... # NotAllMan il cronaca nero situazione statisticamente improbabile numero bassissimo rispetto quotidianità rapporto logorare rompere senza sangue fare finire ci dentro piccolo percentuale vittima a il anno rispetto popolazione complessivo fare solo posteriore potere definire dire certezza non giornale Capisci sentimento offese Hashtag contare po meno sicurezza persona Pure caso non parere essere incontro pianificare dichiarazione genitore qualche giorno fa cercare smorzare tono dire sì geloso non modo preoccupante Allora andare bene estremizzare continuare sminuire segnale pericolo alimentare Bolla no mica mi ammazza,"['negative', 'trust']"
k9zyjnc,"Tutti bravi ragazzi oh. Chissà come, però, quelle che ci rimettono la pelle sono sempre le donne. Mhhhhh","['neutral', 'none']",tutto bravo ragazzo oh chissà però rimettere pelle sempre donna Mhhhhh,"['neutral', 'none']"
ka05k60,"Pff, vuoi vedere come ci si prende veramente i downvote? Ecco qua: Turetta è un tipo normale, fino a poco tempo fa davvero un bravo ragazzo, che, molto semplicemente, ha preso male la fine di una relazione ed è caduto in una spirale di odio nei confronti della ex. Quasi sicuramente non è un mostro e non è sempre stato così, ""marcio"". Il motivo? Siate sinceri con voi stessi, lo sapete; per quasi tutti c'è stata/o l'ex che proprio non siete riusciti ad andare oltre per X mesi, magari facendo pensieri orribili nel mentre, alcuni, spero pochi, arrivando a pensare al suicidio o perfino peggio; alcuni magari sono passati in macchina sotto casa sua più del dovuto; alcuni hanno bucato le gomme della macchina; alcuni hanno fatto stalking, alcuni chissà che altre cose MOLTO creepy che neanche mi vengono in mente. Ecco, il 99.99% di questi, dopo quegli orribili X mesi di odio e/o sofferenza, finalmente vanno oltre. Lo 00.01% no. Lo 00.01% si suicida o uccide. Turetta è quello 00.01%.","['negative', 'fear']",pff volere vedere prendere veramente downvota Ecco qua Turetta tipo normale fino poco tempo fare davvero bravo ragazzo molto semplicemente prendere male fine relazione cadere spirale odio confronto ex quasi sicuramente non mostro non sempre essere così marcio il motivo siate sincere sapere quasi ci essere essere il ex proprio non riuscire andare oltre X mese magari pensiero orribile mentre alcuno sperare poco arrivare pensare suicidio perfino peggio alcuno magari passato macchina sotto casa più dovere alcuno bucare gomma macchina alcuno fare stalking alcuno chissà altro cosa MOLTO creepyre neanche venire mengere Ecco 99.99 dopo quello orribile X mese odiare sofferenza finalmente andare oltre iL 00.01 no il 00.01 suicida uccidere Turetta 00.01,"['negative', 'fear']"
k9ykanu,[L'altra faccia della medaglia](https://www.guidapsicologi.it/articoli/pi-suicidi-tra-gli-uomini-dopo-una-rottura-amorosa-perche),"['neutral', 'none']",il altro medaglia https://www.guidapsicologi.it/articoli/pi-suicidi-tra-gli-uomini-dopo-una-rottura-amorosa-perco,"['neutral', 'none']"
k9zu630,Quello che ho imparato in casi del genere è che in acqua o sottoterra non funziona...,"['neutral', 'none']",quello imparare caso genere acqua sottoterro non funzionare ...,"['neutral', 'fear']"
k9zx348,"Sono dell'idea che la notizia sia stata data in modo errato: il modo corretto, secondo me ovviamente, sarebbe ""coglione imbecille ammazza la sua ex fidanzata perché è uno sfigato che si sente troppo coglione per accettare un cambiamento"".
Messa così, questa notizia, occuperebbe il posto che merita. È vero che lei, per chi le era vicino, era tutto, ma per noi che siamo la società, deve occupare il posto giusto: un allarme per capire che c'è gente che ha problemi seri ed intervenire per fare sì che le generazioni future (quindi sì, tra venti e passa anni) non abbiano ancora in circolazione dei ""coglioni imbecilli sfigati che sono troppo coglioni per accettare un cambiamento"".
Quello che viene chiamato ""femminicidio"" (Dio mi punisca per aver usato questo neologismo idiota) è una boiata per fare parlare chi non ha idea di cosa sia il codice penale e farlo lagnare con i giudici. O peggio ancora, fargli credere che introdurre un nuovo reato sia la soluzione a qualsiasi tipo di problema. Roba da chiodi.","['positive', 'fear']",essere di il idea notizia essere dare modo errato modo corretto secondo me ovviamente coglione imbecille ammazza ex fidanzato sfigare sentire troppo coglione accettare cambiamento Messa così notizia occupeere posto meritare essere vero vicino società dovere occupare posto giusto allarme capire ci essere gente problema serio intervenire fare sì generazione futuro quindi sì venti passa anno non ancora circolazionere coglione imbecille sfigare troppo coglione accettare cambiamento quello venire chiamare femminicidio dio punire avere usare neologismo idioto boiato fare parlare non idea cosa codice penale fare lo lagnare giudice O peggio ancora fargli credere introdurre nuovo reato soluzionere qualsiasi tipo problema Roba chiodo,"['positive', 'fear']"
ka03z8r,Un altro chiodo nella bara che contiene le speranze degli ingegneri di trovarsi una donna.,"['negative', 'fear']",uno altro chiodo bara contenere speranza ingegnere trovare si donna,"['negative', 'fear']"
k9y7s2b,L'ex ragazzo è un figlio sano del patriarcato.,"['positive', 'joy']",il ex ragazzo figlio sano patriarcare,"['positive', 'joy']"
ka0xilj,Tipico post e commenti da tipo simil incel,"['neutral', 'none']",tipico post commento tipo simil incel,"['neutral', 'none']"
k9xatbx,"L'Italia in quanto a affettività sta diventando uno scandalo, ma d'altronde chi sa sa (anche in Italia) perché la psiche delle persone non è così variabile.

Giusto parlare di maltrattamenti, sbagliato generalizzare su un ragazzo che potrebbe essere sessualmente insoddisfatto parlando di come fosse un bruto con le donne da una vita.","['neutral', 'anger']",il Italia affettività diventare scandalo di altronde sapere sapere Italia psico persona non così variabile giusto parlare maltrattamente sbagliare generalizzare ragazzo potere essere sessualmente insoddisfatto parlare brere donna vita,"['positive', 'fear']"
k9y5fwi,"Perdi troppo tempo a leggere cronaca che non serve a nulla. 

I temi che mi interessano e credo siano rilevanti siano i dettagli processuali per fare in modo che le norme migliorino e che PM e giudici non siano corruttibili.","['positive', 'trust']",Perdi troppo tempo leggere cronaca non servire nulla il tema interessare credere rilevante dettaglio processuale fare modo norma migliorino PM giudice non corruttibile,"['neutral', 'trust']"
k9zu3am,"Troppa cronaca nei giornali in Italia, niente di nuovo.","['positive', 'trust']",troppa cronaca giornale Italia niente nuovo,"['positive', 'trust']"
k9zw9ra,"Un classico, poi succede al contrario e si fanno le battutine e la storia finisce lì. Ricordo ancora le notizie di quando avevo quei tumori di social di uomini maltrattati o uccisi dalle compagne per gelosia, la maggior parte delle reaction erano risate e la sezione commenti piena di battute.","['neutral', 'none']",uno classico poi succedere contrario Battutine storia finire lì ricordare ancora notizia quando quello tumore social uomo maltrattato uccidere compagno gelosia maggiore parte reaction risare sezione commento pieno battuto,"['positive', 'anger']"
k9zwjd6,"Per citare Ravidememe:

Tra quanti giorni torniamo a romanticizzare la figura del “malessere”?","['negative', 'sadness']",per citare Ravidememe tra giorno tornare romanticizzare figura “ malessere ”,"['negative', 'sadness']"
k9zwlxw,Piccolo OT: ma da dove deriva il fastidioso uso dell'articolo con i nomi.,"['negative', 'anger']",Piccolo OT derivare fastidioso uso di il articolo nome,"['negative', 'anger']"
ka4kn7d,"Tutti eroi, tutti pronti a tutto. Loro si che hanno la soluzione e devono dire la loro importantissima opinione e partecipare con ""sincero"" dolore alle tragedie altrui...  poi tra una settimana passa la moda e non gliene frega più un cazzo a nessuno. L'importante è trovare subito un altro carrozzone di tragedie/avvenimenti per potersi mettere in mostra nei media e sui social. Che vomito.","['negative', 'fear']",tutto eroe pronto Loro soluzione dovere dire importantissimo opinione partecipare sincero dolore tragedia altrui . poi settimana passare moda non glenire fregare più cazzo nessuno il importante trovare subito altro carrozzone tragedia avvenimento potere si mettere mostra medio social Che vomire,"['positive', 'surprise']"
ka67lj4,"Il fatto che il femminicidio sia strettamente correlato alla misoginia è un dato di fatto. E vorrei anche ricordare agli uomini che io non ce l'ho con loro, ma con i ""maschilisti"". E se questo termine vi fa venire i brividi ogni volta che lo pronuncio, vuol dire che vi sentite, anche se poco, chiamati in causa. 

Dovremmo essere tutti femministi e lottare contro la violenza di genere. Questo non significa non lottare per la giustizia di quella piccola parte di uomini che sono vittime di violenza domestica, assolutamente. La violenza di genere avviene da entrambe le parti, MA statisticamente parlando, sono le donne ad essere le maggiori vittime. Questo spiega perché si sente parlare di ""donna uccisa dal fidanzato per gelosia"" (e su questo avrei MOLTISSIMO da ridire e non il contrario. Come si spiega il perché le donne siano le maggiori vittime di catcalling, battute sessiste (dette anche da donne), stalking, stupri.

Detto questo, invito chi è in disaccordo a riflettere su quanto il sistema patriarcale manipoli psicologicamente la società e ci spinga a normalizzare e sminuire tutto questo. Posso capire che per l'uomo, che fino a adesso ha goduto di molti privilegi sociali si senta surclassato e spodestato dalla donna: beh, non p esattamente così. Per quanto esistano delle donne che si vogliono vendicare dei millenni di oppressione da parte del patriarcato, le VERE femministe lottano per l'abbattimento di questi lussi e per porre finalmente fine alla misoginia tanto giustificata dai reazionari, al fine di ricostruire da zera una società dove una donna non ha più paura di:

\-uscire da sola senza venir molestata

\-lasciare il proprio ragazzo per paura di venir uccisa

\-attirare l'attenzione degli stupratori soltanto perché è vestita in un modo che ai loro occhi giustifica lo stupro

\-dire la sua senza venir tempestata di commenti sessisti in cui vengono messi in mezzo la propria vita personale e il proprio aspetto fisico 

Si, lo so, ANCHE gli uomini sono vittime di violenza, ma vi prego, guardatevi intorno: quanti uomini vengono stalkerati per anni, stuprati in gruppo, sfregiati con l'acido, uccisi a coltellate, fucilate, fatti a pezzi o, come in questo caso, gettati in un lago? Quanti, per mano di una donna? Ah, ecco, pochissimi. E mi pare pure che quando se ne parla, la donna viene messa alla gogna e demonizzata. Non mi pare che all'inverso la situazione sia la stessa. Mi pare, anzi, che ci sia molta gente pronta a sminuire l'atto, a colpevolizzare la vittima, dicendo ""se avesse fatto x, non sarebbe successo y"", ""lui l'amava troppo"", ""lui adesso sta soffrendo come un cane in prigione"", ""lei se l'è cercata"". 

Traete le vostre conclusioni.","['negative', 'anger']",il fatto femminicidio strettamente correlato Misoginia dare fatto e volere ricordare uomo non ce lo avere maschilista E termine fare venire brivido ogni volta pronuncio volere dire sentire poco chiamare causa Dovremmo essere femminista lottare violenza genere questo non significare non lottare giustizia piccolo parte uomo vittima violenza domestico assolutamente il violenza genere avvenire entrambo parte MA statisticamente parlare donna essere maggiore vittima questo spiegare sentire parlare donna uccidere fidanzare gelosia MOLTISSIMO ridire non contrario come spiegare donna maggiore vittima Catcalling battuto sessista detto donna stalking stupri Detto invito disaccordo riflettere sistema patriarcale manipolo psicologicamente società spinga normalizzare sminuire Posso capire il uomo fino adesso godere molto privilegio sociale senta surclassare spodestare donna Beh non p esattamente così per esistare donna volere vendicare millenno oppressione parte patriarcare VERE femminista lottare il abbattimento lusso porre finalmente fine Misoginia tanto giustificato reazionare fine ricostruire zera società donnare non più paura uscire solo senza venire molestare lasciare proprio ragazzo paurare venir uccidere attirare il attenzione stupratore soltanto vestire modo occhio giustifica stupro dire senza venire tempestata commento sessisto venire mettere mezzo proprio vita personale proprio aspetto fisico si sapere ANCHE uomo vittima violenza pregare guardateve intorno uomo venire stalkerare anno stuprare gruppo sfregiare il acido uccidere coltellato fucilare fare pezzo caso gettato lago Quanti mano donna ah ecco poco e parere pure quando parlare donna venire mettere gogna demonizzato non parere a il inverso situazione stesso mi parere anzi molto gente pronto sminuire il atto colpevolizzare vittima dire fare x non successo y lo amare troppo adesso soffrere cane prigionere lo essere cercare Traete conclusione,"['negative', 'anger']"
k9x8tvb,"Non so niente della vita personale delle due persone ma non mi piace la mancanza di sfumature nel modo in cui è stato presentato la vicenda.

Sicuramente questo uomo deve aver sofferto moltissimo in qualche modo, e non è stato aiutato. Molti uomini quando cercano aiutato vengono trattati male perché ci si aspetta che non provino sofferenza e quindi smettono di cercare aiuto. Se si dipinge lui come un mostro insensibile e non si cerca di capire quali problemi aveva che lo hanno spinto a comportarsi così allora non si fa altro che peggiorare questa dinamica.","['negative', 'disgust']",non sapere niente vita personale due persona non piacere mancanza sfumatura modo essere presentare vicenda Sicuramente uomo dovere avere soffrire molto qualche modo non essere aiutare molto uomo quando cercare aiutare venire trattare male aspettare non provino sofferenza quindi smettere cercare aiuto se dipingere mostro insensibile non cercare capire quale problema spintire comportare si così allora non fare altro peggiorare dinamico,"['negative', 'anticipation']"
k9zxtjh,"Manca solo un particolare, le troppe donne che denunziano per reati detti spia per due messaggi ricevuti, magari di servizio, del tipo ""volevo solo dirti che l'amico comune Caio ha contratto un tumore"" distogliendo le forze dell'ordine dal cogliere segnali concreti che erano ben visibili anche in questo caso...","['negative', 'none']",Manca solo particolare troppo donna denunziare reato dire spiare due messaggio ricevuto magari servizio tipo volere solo dire ti il amico comune Caio contrarre tumore distogliere forza di il ordine cogliere segnale concreto bene visibile caso ...,"['positive', 'trust']"
ka1knmq,"Io è da tempo che noto una sempre crescente schiettezza nel raccontare come sono accaduti i fatti (tizio accoltellato, tizia stuprata e fatta a pezzi), una morbosità che a mio parere sta desensibilizzando gli italiani di fronte a queste atrocità.","['positive', 'anticipation']",io tempo noto sempre crescere schiettezza raccontare accaduto fare tizio accoltellare tizia stuprato fare pezzo morbosità parere desensibilizzare italiano fronte atrocità,"['positive', 'anticipation']"
