comment_id,comment_body,myscore,preprocessed_comment,myscore_preprocessed
k9ye58f,"Parlo di chi ammazza persone e spesso ti ritrovi il parente o il vicino di casa che dice ""non farebbe del male a nessuno"", ""salutava sempre"", ""era educato"". 

Il fatto che qualcuno sembri non pericoloso non è garanzia di sicurezza, bisogna prestare attenzione a certi campanelli di allarme, che in questo caso tanti avevano notato, ma nessuno ha provato ad occuparsene.","['negative', 'trust']",Parlo ammazzare persona spesso ritrovare parente vicino casa dire non male nessuno salutare sempre educato il fatto qualcuno sembro non pericoloso non garanzia sicurezza bisognare prestare attenzione certo campanello allarme caso tanto notato nessuno provare occupare se ne,"['positive', 'trust']"
k9zqqpn,"Se guardi bene tra le righe molto spesso ha un sacco a che fare col patriarcato, lo puoi potenzialmente ricondurre alla sua educazione dentro o fuori la famiglia, se per esempio segue i guru del dating o certi ambienti adiacenti alla red pill, hai la pistola fumante. Puoi guardare anche quali sono le sue dinamiche familiari.

Btw adoro il tuo nick, sotto il sole ti spacchi le nocche presumo","['positive', 'trust']",se guardare bene rigo molto spesso sacco fare patriarcato potere potenzialmente ricondurre educazione dentro fuori famiglia esempio seguire guru dating certo ambiente adiacente red pill pistola fumante Puoi guardare quale dinamica familiare Btw adoro nie ck sotto solo spaccare nocche presumo,"['positive', 'trust']"
ka5g7zr,"Quindi sei convinta al 100% che Giulia sarebbe viva se il suo Ex avesse fatto educazione affettiva alle elementari? Volete capirlo o no che queste cose sono sempre esistite e sempre esisteranno? Siete maniaci del controllo, non si può controllare uno psicopatico ne si può prevedere quando ucciderà. Non è insegnandogli a volere bene agli altri e facendogli disegnare fiorellini che gli si fa passare la psicopatia. Vi illudete di poter controllare tutto, non potete. La ""massa informe"" ha ragione.","['positive', 'trust']",quindi convincere 100 Giulia vivere Ex fatto educazione affettire elementare Volete capire lo no cosa sempre esistito sempre esistare Siete maniace controllo non potere controllare psicopatico potere prevedere quando uccidare Non insegnandogli volere bene altro facendoglio disegnare fiorellino fare passare psicopatia vi illudere potere controllare non potere il massa informe ragione,"['positive', 'trust']"
k9znikz,Pensi che ci sia abuso unilaterale nella maggior parte delle relazioni?,"['negative', 'anger']",Pensi abuso unilaterale maggiore parte relazione,"['neutral', 'anger']"
ka01xb7,"No, è statistica. Ci sono 25 milioni di uomini adulti in Italia. Gli assassini della compagna negli ultimi 50 anni sono in totale non più di 5.000. Quelli che hanno alzato le mani sulla compagna o su una donna in generale quanti saranno? 100.000? 500.000? 1 milione? Sono comunque una ristretta minoranza, comunque la si guardi.","['positive', 'trust']",no statisticare ci 25 milione uomo adulto Italia il assassino compagnare ultimo 50 anno totale non più 5.000 Quello alzare mano compagnare donna generale 100.000 500.000 1 milione essere comunque ristretto minoranza comunque guardare,"['negative', 'anger']"
ka05hm3,"Il claim molto forte è sostenere che le relazioni connotate da violenza dell’uomo verso la donna non siano una minoranza.

Ovviamente se hai dati a sostegno sono tutto orecchie","['negative', 'anger']",il claim molto forte sostenere relazione connotare violenza ’ uomo verso donna non minoranza ovviamente dato sostegno orecchio,"['negative', 'anger']"
ka0fzsy,"Io sono serenissimo, ma proprio non riesco a cogliere la mia responsabilità. Deve essere di tutti, come società fatta di persone, ed invece stiamo ancora una volta confermando che il patriarcato c’è, e che siamo lontani dal raggiungere un punto di incontro, presupponendo tante cose. 

Tra l’altro se mi azzardo a dire che i segnali ci sono e che si poteva capire (non di questo caso specifico) ovviamente la donna in quel caso non ha responsabilità nelle decisioni. E non mi dire che la donna ha paura di mollare perché tra tutte le relazioni che finiscono credo che solo lo 0,0000001% finisca in questo modo. 

E ti dirò di più, questa sorta di colpevolizzazione è classica dei paesi cattolici, dove quando nasci devi rimediare ai peccati originali. Per la quale ci deve essere indignazione. Poveri noi, siamo alla deriva.

Edit: scusa ma mi ero dimenticato. Per risponderti, certo, ad un mio amico glielo dico che non è giusto, MA TE LO FAI CON TUTTE LE PERSONE CHE INCONTRI? È quella la differenza sostanziale. In questo modo puoi paragonarmi i discorsi, dicendo “io sono coerente e se c’è una persona che commette un reato dovevo fare qualcosa”. Ma tutte, sempre per coerenza. Altrimenti stai facendo cherrypicking col primo stronzo che ti risponde.","['negative', 'sadness']","io serene proprio non riesco cogliere responsabilità dovere essere società fare persona invece ancora volgere confermare patriarcare ’ Lontani raggiungere punto incontro presupponere tanto cosa tra ’ altro azzardo dire segnale potere capire non caso specifico ovviamente donnare quello caso non responsabilità decisione e non dire donna paurare mollare tutto relazione finire credere solo 0,0000001 finire modo e dire più sorto colpevolizzazione classico paese cattolico quando nare dovere rimediare peccato originale Per dovere essere indignazione Poveri derivare Edit scusa dimenticare per rispondertare certo amico glielo dire non giusto MA TE LO FAI CON TUTTE LE PERSONE CHE INCONTRI essere differenza sostanziale in modo potere paragonarmio discorso dicire “ coerente ’ persona commettere reato dovere fare qualcosa ” ma tutto sempre coerenzare Altrimenti cherrypicking primo stronzo rispondere","['negative', 'sadness']"
ka6a7x3,"Come spieghi la mia eterosessualità, allora? Idiota e maschilista.","['negative', 'anger']",come spiego eterosessualità allora Idiota maschilisto,"['negative', 'anger']"
k9xgffw,"Ok quindi io non ho mai detto niente e tu hai dedotto tutto questo del mio pensiero. Complimenti, sei proprio un mago veggente! Madonna santa che disagio. 

P.s.: quel che volevo dire era solo che c'è anche gente che usa queste situazioni che sono chiaramente gravissime come pretesto per suggerire che sia giusto ignorare i diritti umani di un'intera categoria di persone (uomini) solo perché uno ha commesso un crimine","['negative', 'trust']",Ok quindi non mai dire niente dedotto pensiero complimenti proprio mago veggente Madonna santare disagio P s quello volere dire solo ci essere gente usare situazione chiaramente grave pretesre suggerire giusto ignorare diritto umano uno intero categoria persona uomo solo commettere crimine,"['negative', 'anticipation']"
k9xubs1,Probabilmente le campagne che hai citato te sarebbero più che sufficienti a diminuire la frequenza di eventi di violenza sulle donne piuttosto che una campagna sul femminicidio.,"['negative', 'anger']",probabilmente campagna citare te più sufficiente diminuire frequenza evento violenza donna piuttosto campagna femminicidio,"['negative', 'anger']"
k9xvb0u,L'idea è stata proposta dalla [Schlein](http://www.ansa.it/sito/notizie/politica/2023/11/18/schlein-contro-i-femminicidi-una-legge-per-educare-a-scuola_a7cff8d7-07b7-4076-8689-1039b6ed8993.html) non dal Presidente Meloni.,"['positive', 'trust']",il idea essere proporre Schlein http://www.ansa.it/sito/notizie/politica/2023/11/18/schlein-contro-i-femminicidi-una-legge-per-educare-a-scuola_a7cff8d7-07b7-4076-8689-1039b6ed8993.html non Presidente Meloni,"['positive', 'trust']"
k9yvpbd,"C’è perché tutti gli studi scientifici indicano che l’uomo è più aggressivo per natura, chiamarsi testosterone. Per quanto il comportamento umano, grazie al cielo, sia dettato anche da una fortissima componente culturale, resterà sempre questa tendenza di fondo che evidenzierà una sproporzione dei criminali violenti sul lato degli uomini, proprio perché per questa predisposizione naturale. 

Ora, fare campagne di sensibilizzazione va benissimo, ma bisogna comprendere che non si eliminerà mai il problema del femminicidio però del tutto, probabilmente resterebbe sempre un limite insuperabile statisticamente parlando di persone che ucciderebbero donne.","['negative', 'fear']",C ’ studio scientifico indicare ’ uomo più aggressivo natura chiamare si testosterone per comportamento umano grazie cielo dettare fortissimo componente culturale restare sempre tendenza fondo evidenziare sproporzione criminale violento lare uomo proprio predisposizione naturale ora fare campagna sensibilizzazione andare bene bisognare comprendere non eliminere mai problema femminicidio però probabilmente restere sempre limite insuperabile statisticamente parlare persona ucciderebbero donna,"['positive', 'fear']"
k9zz9a1,"Ma i dati vanno contestualizzati, ad esempio secondo le ricerche le donne fanno più violenza psicologica, mentre gli uomini più quella fisica, ma questo ha un motivo molto banale, semplicemente l'uomo è molto più forte fisicamente delle donne, da quando il mondo ha iniziato ad esistere è il forte ad esercitare la maggior parte della violenza, non avrebbe avuto senso da punti di vista evoluti una donna fisicamente aggressiva, ma non si può dire che sia una questione morale, ma potrebbe semplicemente essere una mancanza di opportunità.  


Il problema è il fenomeno mediatico eccessivo, ma la vogliamo o no questa uguaglianza? Statisticamente si mette in risalto molto più quello che accade alla donna. Il fenomeno reale è statisticamente trascurabile, c'è chi muore ucciso da un fulmine, chi perché gli cade un vaso in testa.  
Il tasso degli omicidi in Italia è bassissimo, quello dei femminicidi ancora molto più basso, c'è più probabilità a nascere alti, belli e ricchi che a venire uccisi per femminicidio in Italia.   
Per dire in Italia ogni anno 20 persone muoiono folgorate da un fulmine, 1/5 delle donne uccise per femminicidio, ma non vedo nessuno che si preoccupi un quinto di venire folgorato da un fulmine quando piove rispetto alla paura che hanno le donne su internet di venire uccise dal proprio fidanzato.","['negative', 'anticipation']",ma dato andare contestualizzare esempio secondo ricerca donna più violenza psicologico mentre uomo più fisico motivo molto banale semplicemente il uomo molto più forte fisicamente donna quando mondo iniziare esistere forte esercitare maggiore parte violenza non senso punto vedere evoluto donna fisicamente aggressivo non potere dire questione morale potere semplicemente essere mancanza opportunità il problema fenomeno mediatico eccessivo volere no uguaglianza Statisticamente mettere risalgere molto più accadere donna il fenomeno reale statisticamente trascurabile ci essere morire uccidere fulmine cadere vaso testare il tasso omicidi Italia basso femminicidi ancora molto più basso ci essere più probabilità nascere alto bello ricco venire uccidere femminicidiare Italia Per dire Italia ogni anno 20 persona morire folgorare fulmina 1/5 donna uccidere femminicidio non vedere nessuno preoccupi quinto venire folgorare fulmine quando piovere rispetto paura donna internet venire uccidere proprio fidanzare,"['negative', 'anger']"
ka00hd4,"Sono principalmente gli uomini ad uccidere, e basta. Ovvio che poi ogni statistica confermi questa tendenza.","['positive', 'trust']",essere principalmente uomo uccidere bastare Ovvio poi ogni statistica confere mi tendenza,"['positive', 'anger']"
k9zuudb,[deleted],"['neutral', 'none']",deleted,"['neutral', 'none']"
ka1liw5,"Ti direi ""le relazioni arricchiscono l'animo"", ma se vuoi qualcosa di scientifico posso al massimo citare l'apertura verso l'ambiente esterno ed evitare il regressismo.","['neutral', 'trust']",ti dire relazione arricchisce il animo volere qualcosa scientifico potere massimo citare il apertura verso il ambiente esterno evitare regressismo,"['neutral', 'fear']"
ka00pwk,">Perché devi metterti al centro tu? Fare tu dei distinguo?

Probabilmente perchè essere lombrosianamente etichettati in continuazione come potenziali assassini/stupratori ogni volta che succede un fatto simile metterebbe chiunque sulla difensiva, la butto lì eh.","['positive', 'trust']",perché dovere metterto centro Fare distinguo Probabilmente perché essere Lombrosianamente etichettare continuazione potenziale assassino stupratore ogni volta succedere fare simile mettere chiunque difensire butto lì eh,"['neutral', 'anticipation']"
ka02ipa,I maschi sono stati nel discorso fino ad ora,"['positive', 'none']",il maschio stato discorrere fino ora,"['neutral', 'none']"
k9xhdxy,"Ho paura di essere ammazzato in generale, anche solo se giro per strada perché i matti purtroppo esistono. Faccio un ragionamento più amplio. Non tutti ammazzano il partner quando si lasciano anzi sono casi veramente isolati solo che vengo pompati dai media.

Edit: uno è stato sparato perché ha allungato una sigaretta che l altro tipo non gradiva, per farti un esempio.

Se hai paura di essere ammazzata allora non frequentare nessuno che ragionamento è? Se sono tutti una possibile minaccia.","['negative', 'anticipation']",avere paura essere ammazzare generale solo giro strada matti purtroppo esistere fare ragionamento più amplio Non ammazzare partner quando lasciare anzi caso veramente isolare solo vengo pompare medio Edit stato sparare allungare sigaretta altro tipo non gradire farto esempio se paurare essere ammazzare allora non frequentare nessuno ragionamento se possibile minacciare,"['negative', 'fear']"
k9xrzcp,"Se hai paura di cio' indipendentemente da chi sia il tuo partner, allora hai una percezione estremamente spropositata del rischio","['negative', 'anticipation']",se paurare cio indipendentemente partner allora perceziorre estremamente spropositare rischio,"['negative', 'anticipation']"
k9xm9u1,"Se parti dal presupposto che qualsiasi uomo sia un potenziale femminicida, essere selettive non serve proprio a nulla.

Sono un uomo e sono gay. Non approvo gesti di violenza indipendentemente dal tipo e dalla gravità. Ma la narrazione che scaturisce da questa e da altre vicende a me non piace e francamente mi intimorisce. Il problema non è il genere, il problema sta ancora più a monte.","['negative', 'fear']",se parte presupporre qualsiasi uomo potenziale femminicidare essere selettivo non servire proprio nulla eSsere uomo gay Non approvo gesto violenza indipendentemente tipo gravità Ma narrazione scaturire altro vicenda me non piacere francamente intimorire Il problema non genere problema ancora più monte,"['negative', 'fear']"
k9xhsmb,"Lo sarà. Non farti paranoie.

Le domande sono lecite se hai qualche ""campanello"", altrimenti sono solo paranoie. 

Se scoprissi che il tuo compagno non si fida di te, o che addirittura, ha paura che tu possa ucciderlo come la prenderesti? Non fanno bene queste cose.","['positive', 'anticipation']",lo non farto paranoie il domanda lecito qualche campanello altrimenti solo paranoio Se scoprissare compagno non fidare te addirittura paura potere uccidere lo prenderesto non bene cosa,"['positive', 'anticipation']"
k9y1jpt,E io non ti permetto di dire che anche tutti noi in quanto uomini siamo assassini,"['neutral', 'none']",e non permettere dire uomo assassino,"['neutral', 'anger']"
ka0hx0m,"La differenza è che lo ammetto e sono perfettamente consapevole di quanto sia sbagliato e continuo a farlo per farmi il sangue amaro. E per far notare l'ipocrisia di fondo del ragionamento. Loro agitano il dito dicendo che le loro generalizzazioni non ci feriscono? Perchè non generalizzare il mio disgusto estetico nei loro confronti, tanto...","['negative', 'disgust']",il differenza ammetgere perfettamente consapevole sbagliare continuo fare lo Farmi sangue amaro e fare notare il ipocrisia fondo ragionamento Loro agitare dire dire generalizzazione non ferire Perchè non generalizzare disgusto estetico confronto tanto ...,"['negative', 'anger']"
ka0h8lt,E..?,"['neutral', 'none']",e ..,"['neutral', 'none']"
ka0wn1n,Ah quindi non è possibile abolire gli omicidi e i femminicidi per decreto? /s,"['negative', 'anger']",ah quindi non possibile abolire omicidio femminicidio decreto s,"['negative', 'anger']"
k9xvlra,"non ho scritto solo ""classico uomo"" ma ""*classico uomo che non sa accettare una rottura, non capisce che no è no, vuole controllare e possedere la donna come se fosse sua* "". sai leggere?","['neutral', 'anticipation']",non scrivere solo classico uomo classico uomo non sapere accettare rottura non capire no no volere controllare possedere donna sai leggere,"['neutral', 'anticipation']"
k9xym9g,troppo facile così ![gif](emote|free_emotes_pack|shrug),"['neutral', 'none']",troppo facile così gif emota free_emotes_pack shrug,"['neutral', 'none']"
k9xzp4o,"Appunto, mi sembra che fosse una bomba pronta ad esplodere","['negative', 'anger']",Appunto sembrare bomba pronto esplodere,"['negative', 'anger']"
k9y428m,"Invece non sono affatto puttanate.
É la merda woke from usa che ti dire che sono inutili.

L'identità crea tessuto sociale che non esiste in una società multi etnica.

Dove l'immigrazione arriva massiccia disintegra questo strato e crea disastri. Distruzione di edifici, illegalità.  Sveglia.","['negative', 'anger']",invece non affatto puttanato É Merda Woke from usare dire inutile il identità creare tessuto sociale non esistere società multo etnico Dove il immigrazione arrivare massiccio disintegro strato creare disastro distruzione edificio illegalità Sveglia,"['negative', 'anger']"
k9zrvcs,"Il 25 Novembre è la giornata internazionale contro la violenza sulle donne, certo che ci sono manifestazioni. Come per l'8 marzo. Ma a parlare con il maschio medio su Internet sembra che ci sono rivolte femministe su strada un giorno sì e l'altro pure. Ma magari.","['negative', 'anger']",il 25 Novembre giornata internazionale violenza donna certo manifestazione come 8 marzo ma parlare maschio medio Internet sembrare rivolgere femministe strada giorno sì il altro pure ma magari,"['positive', 'fear']"
ka0949i,"Ma quindi numeri e statistiche vanno guardate solo quando fanno comodo a una tesi piuttosto che a un’altra? È ovvio che il femminicidio sia la manifestazione estrema di quello che sto dicendo, ma bisogna veramente tapparsi gli occhi per non sapere, nel 2023, che per esempio una donna su tre dice di aver subito violenza fisica o sessuale nella sua vita.

E poi di morti bianche maschili che sono stati anche casi mediatici me ne vengono in mente varie, lì semmai a fare più notizia per l’effetto shock sono le morti dei più giovani (così come nei femminicidi).

È veramente scoraggiante cercare di gettare luce su un problema culturale e sentirsi rispondere “eh però gli uomini”. Se ti preoccupano problemi in cui le vittime sono prevalentemente uomini (tipo le morti bianche) crea spazi appositi per discuterne, sarò la prima a venire a darti il mio supporto, a votare chi promuove leggi sulla sicurezza sul lavoro più ferree e a stringermi al cordoglio delle vittime innocenti di questo problema. Perché non estendi la stessa gentilezza alle donne che dicono per favore, cambiamo la cultura così ci saranno sempre meno di noi abusate, picchiate o ammazzate dai loro compagni?","['positive', 'fear']",ma quindi numero statistico andare guardare solo quando comodo tesi piuttosto ’ altro essere ovvio femminicidio manifestazione estremo dire bisogna veramente tappare si occhio non sapere 2023 esempio donnare tre dire avere subire violenza fisico sessuale vita E poi morire bianco maschile stato caso mediatico me venire mengere vario lì semmai fare più notizia ’ effetto shock morire più giovane così femminicidio essere veramente scoraggiante cercare gettare luce problema culturale sentire si rispondere “ eh però uomo ” se preoccupare problema vittima prevalentemente uomo tipo morto bianco creare spazio apposito discutere ne prima venire darto supporto votare promuovere legge sicurezza lavoro più ferreo stringermo cordoglio vittima innocente problema perché non estendare stesso gentilezza donne dire favore cambare Cultura così sempre meno abusare picchiare ammazzare compagno,"['neutral', 'fear']"
ka05m4j,"Le donne sono 107. Una donna è stata uccisa. Riusciamo a fare, come uomini, un mea culpancollettivo e capire cosa si sta sbagliando? No, certo..","['neutral', 'none']",il donna 107 uno donna essere uccidere Riusciamo fare uomo mea culpancollettivo capire cosa sbagliare no certo ..,"['negative', 'anger']"
ka0m35f,"Allora mi ripeto.

Appunto, “not all men ma tutti i men potrebbero usare situazioni del genere per capire cosa c’è che non va”

E mi trovi più che d’accordo, però per fare questo serve coalizzarsi tra uomini e donne.

Insegnare come funzionano le relazioni, insegnare a gestire e elaborare le emozioni, insegnare il rispetto per gli altri, insegnare a individuare comportamenti pericolosi/ red flags, come chiedere aiuto e come allontanarsi. 

Invece di fare tutto questo si cade nelle solite e inutili discussioni ( come quella che stiamo facendo).

Ovviamente (e fortunatamente) questo omicidio è considerato deplorevole da tutti, sia uomini che donne.

Siamo tutti d’accordo non doveva succedere e siamo tutti d’accordo non ne dovrebbero succedere altri.

Siamo tutti dalla stessa parte.

Però poi arrivano i post con generalizzazioni ed ecco creati due schieramenti che litigano per puttanate quando il problema alla base persiste.

Qui finisce il mio piccolo rant, semplicemente non sopporto vedere sempre le solite discussioni e litigate partire da questo genere di tragedie invece che “utilizzarle” per discussioni sensate e utili","['positive', 'surprise']",allora ripetere Appunto “ not Men Men potere usare situazione genere capire cosa ’ non andare ” e trovare più d ’ accordo però fare servire coalizzare si uomo donna Insegnare funzionare relazione insegnare gestire elaborare emozione insegnare rispetto altro insegnare individuare comportamento pericoloso red flags chiedere aiuto allontanare si invece fare cade solito inutile discussione Ovviamente fortunatamente omicidio considerare deplorevole uomo donna essere d ’ accordo non dovere succedere d ’ accordo non dovere succedere altro essere stesso parte Però poi arrivare post generalizzazione ecco creare due schieramente litigano puttanare quando problema base persistere qui finire piccolo rant semplicemente non sopporto vedere sempre solito discussione litigare partire genere tragedia invece “ utilizzare le ” discussione sensare utile,"['positive', 'trust']"
k9ztkxv,"Perché il politico turno deve appropriarsi della storia e iniziare ad parlare alla pancia del popolo .

C'è anche che devono far spostare i problemi reali del paesa quindi parlano di questa storia","['positive', 'none']",perché politico turno dovere appropriare si storia iniziare parlare pancia Popolo C' essere dovere fare spostare problema reale paendere quindi parlare storia,"['neutral', 'fear']"
ka08fw4,"Il “fastidio” che provi nella narrazione della vicenda e della risposta delle donne invece che farti andare sulla difensiva dovresti vederla come una opportunità per crescere e migliorarti. Ti dovrebbe spingere ad approfondire. 

Invece hai aperto l’ennesimo thread dove lo scopo é parlare di noi poveri maschi che siamo discriminati. 

Può darsi che tu sia sessista (lo siamo stati tutti, inconsapevolmente) ma se ti chiudi a riccio non accettando commenti che non ti danno conferme non so cosa potrai cavarne","['positive', 'anticipation']",il “ fastidio ” provare narrazione vicenda risposta donna invece fartare andare difensivo dovresti vedere la opportunità crescere migliorarto Ti dovere spingere approfondire Invece aprire ’ ennesimo thread scopo é parlare povero maschio discriminato potere dare si sessista stato inconsapevolmente chiudere riccio non accettare commento non dare conferme non sapere cosa potere cavare ne,"['positive', 'anticipation']"
k9y6dio,Ma che cazzo ti leggi. Non ho mai letto niente di simile da nessuna parte.,"['negative', 'anger']",ma cazzo legge non mai leggere niente simile nessuno parte,"['negative', 'anger']"
k9y68is,Ma chi cazzo se ne frega scusa non so nemmeno di cosa parli,"['negative', 'anger']",ma cazzo fregare scusa non sapere nemmeno cosa parlare,"['negative', 'anger']"
ka4x9mx,"Terrorismo mai visto fatto dai bianchi, si sa.","['negative', 'anger']",terrorismo mai vedere fare bianco sapere,"['neutral', 'anticipation']"
k9y1bxo,"No, a giudicare da ciò che hai scritto direi che non hai capito un cazzo","['negative', 'fear']",no giudicare ciò scritto dire non capire cazzo,"['negative', 'fear']"
