comment_id,comment_body,myscore,preprocessed_comment,myscore_preprocessed
k9x5539,"Così però si finisce per evitare legami sentimentali because killing patriarcato. In generale, estremizzare non è mai bene, ma sui social hai letteralmente solo tifo da stadio che poi non risolve nulla e anzi costringe molt* a non avere proprio nulla a che fare con l'altro sesso.","['negative', 'fear']",così però finire evitare legame sentimentale becauso killing patriarcare in generale estremizzare non mai bene social letteralmente solo tifo stadio poi non risolvere nulla anzi costringere molt non avere proprio nulla fare il altro sesso,"['positive', 'trust']"
ka03tij,"Che è come vive una donna normalmente, in genere. Sì, è atroce.","['neutral', 'none']",che vivere donna normalmente genere sì atroce,"['neutral', 'surprise']"
k9xcni0,"Citazione di Margaret Atwood.
Niente di più vero.","['neutral', 'anticipation']",citazione Margaret Atwood niente più vero,"['positive', 'anticipation']"
k9zzeam,"Dipende in quale paese, un conto in Brasile nelle favelas, un conto in Italia, in Italia essere derisi è un problema molto più probabile e concreto visto che il tasso di omicidi è bassissimo.","['negative', 'trust']",dipendere paese conto Brasile favelasre conto Italia Italia essere derindere problema molto più probabile concreto vedere tasso omicidi basse,"['negative', 'trust']"
k9xg96n,A me non interessa essere deriso. A me interessa che se ho dei meriti che mi vengano dati. Gli uomini non hanno solo demeriti,"['neutral', 'none']",a me non interessare essere deriso a me interessare merito venire dare il uomo non solo demerite,"['positive', 'trust']"
k9xqbb4,Ci sono più omicidi di uomini che di donne. Sono comunque molto pochi in entrambi i casi.,"['neutral', 'none']",ci più omicidio uomo donna essere comunque molto poco entrambi caso,"['negative', 'fear']"
k9xfl7z,"Pure io ho paura di essere ammazzato, eppure sono un uomo. Il fatto che sia una donna a morire è irrilevante in molti casi perché non sei morta perché sei donna sei morta perché accanto avevi una persona violenta e una persona violenta la riconosci subito. È rilevante essere donna se la persona in questione uccide solo donne. Come i delitti razziali, di base ti uccidono perché sei nero. Probabilmente se il tipo fosse stato omosessuale il compagno sarebbe morto comunque, è un ipotesi. Però non diamo troppa attenzione a queste cose per favore, usiamo un po la testa e cerchiamo di capire che l aggravante non è essere donna o meno ma frequentare, anche in senso amichevole una persona che ha sempre esercito violenza, da quella verbale a quella fisica. Insomma un tipo che fa risse in giro per il meme non bisogna essere dei fenomeni per capirne la pericolosità, in caso soprattutto di un legame affettivo dove entrano in gioco fattori anche psicologici.","['negative', 'fear']",pure paura essere ammazzare eppure uomo il fatto donna morire irrilevante molto caso non morire donna morire accanto persona violento persona violento riconoscare subito essere rilevante essere donnare persona questione uccidere solo donna come delitto razziale base uccidere nero Probabilmente tipo stato omosessuale compagno morire comunque ipotesi però non dare troppo attenzione cosa favore usare po testa cercare capire aggravante non essere donnare meno frequentare senso amichevole personare sempre esercire violenza verbale fisico insomma tipo fare rire giro meme non bisognare essere fenomeno capire ne pericolosità caso soprattutto legame affettivo entrare gioco fattore psicologico,"['negative', 'fear']"
k9x8nx5,[deleted],"['neutral', 'none']",deleted,"['neutral', 'none']"
k9xerm9,"Me ne rendo conto. Esistono donne possessive e narcisiste. Esistono donne che uccidono il proprio compagno. I casi sono minori, è vero, ma ci sono e si ripetono ogni anno. Quindi che facciamo?

Il problema non è l'uomo o la donna, a patto che si possa ancora fare questa distinzione, ma l'incapacità di costruire una relazione, manca il ""saper voler bene"".

Personalmente trovo giusto e doveroso parlare di violenza sulle donne ma creare fobie e stereotipi non aiuta.

Ti auguro il meglio, spero che tu trova un brav'uomo.

EDIT: Sarebbe interessante scavare nel passato di questo ragazzo, magari da adolescente. Non si nasce narcisisti o assassini. Oltre a fare propaganda su questi temi sarebbe da chiedersi cosa diavolo spinga una persona ad essere così. Si devono risolvere i problemi alla radice.","['positive', 'fear']",me rere conto esistere donna possessivo narcisisto esistere donna uccidere proprio compagno il caso minore vero ripetire ogni anno quindi il problema non il uomo donnare patto potere ancora fare distinzione il incapacità costruire relazione mancare sapere volere bene Personalmente trovare giusto doveroso parlare violenza donna creare fobia stereotipo non aiutare Ti augurare meglio spero trovare bravo uomo EDIT essere interessante scavare passare ragazzo magari adolescente non nascere narcisisto assassino oltre fare propaganda tema chiedere si cosa diavolo Spinga persona essere così si dovere risolvere problema raode,"['positive', 'fear']"
k9xtpkx,"Guarda, da come scrivi tu mi pari una di quelle che non farà violenza fisica, ma la fa mentale. É vero, ci sono molti più uomini violenti che donne, ma vorrei contare quanti uomini si sono ammazzati perché la loro donna li ha tirati matti","['neutral', 'anger']",Guarda scrivo pari non violenza fisico fare mentale É vero molto più uomo violento donna volere contare uomo ammazzato donna tirato matto,"['neutral', 'anger']"
ka0g2q6,"Risposta ottima e pertinente. Come la fierezza di essere nato in uno stato, non puoi perchè non è un tuo merito o colpa. Semplicemente, è bello andare contro la febbre del sentirsi in colpa, sentendosi invece fiero(poi, potrei essere fiero del fatto che non avverta la minima necessità di scusarmi per qualcosa che non ho fatto).","['positive', 'trust']",rispostare ottimo pertinente Come fierezza essere nascere essere non potere perché non merire colpa Semplicemente bello andare febbre sentire si colpa sentere si invece fiero poi potere essere fiero fatto non avvertare minimo necessità scusarmo qualcosa non fare,"['negative', 'sadness']"
ka0hj3e,"Perchè no? Ora generalizzare su un intero genere va male? Pessima battuta a parte, in teoria no. In pratica, perchè no? Ammetto la mia repulsione fisica senza problemi. E non compio attività contro di loro. Perchè dovrebbero preoccuparsi del giudizio fisico da parte di uno omo?","['negative', 'anticipation']",perchè no ora generalizzare intero genere andare male Pessima battutare parte teorio no in pratica perché no ammetto repulsione fisico senza problema E non compiare attività Perchè dovere preoccupare si giudizio fisico parte omo,"['negative', 'anticipation']"
ka07j8y,"Ho capito benissimo. Ho capito che saranno particolarmente in ansia nel caso procreino un maschio perché credono che tutto il mondo premerà perché diventi un assassino stupratore seriale, con esse che si crederanno l'unico baluardo contro ciò che renderà traviato il loro figlio. Gli inculcheranno dunque che sarà intrinsecamente colpevole di privilegio solo perché maschio e dovrà sentirsi in colpa per ciò che fanno altri. E ti ringrazio per il tuo disgusto, ulteriore prova di virtù.","['negative', 'sadness']",avere capire bene avere capire particolarmente ansia caso procreino maschio credere mondo premare diventare assassino stupratore seriale esso credare il unico baluardo ciò rendare traviare figlio il inculchare dunque intrinsecamente colpevole privilegio solo maschio dovere sentire si colpa ciò altro e ringraziare disgusto ulteriore prova virtù,"['negative', 'sadness']"
k9xht85,"era geloso, possessivo, ovunque lei andasse c'era anche lui, le diceva che non poteva vivere senza di lei, era andato a prenderla anche se lei non voleva vederlo, i segnali c'erano tutti e la sorella l'aveva capito. questo è l'identikit del classico uomo che non sa accettare una rottura, non capisce che no è no, vuole controllare e possedere la donna come se fosse sua. tu dici ""non ha imparato a gestire le proprie emozioni"" come se avesse avuto un raptus, ma lui aveva pianificato tutto. non gli andava giù che non potesse controllare la ex, che lei si stesse facendo una vita senza di lui.","['positive', 'trust']",geloso possessivo ovunque andare ci essere dire non potere vivere senza andare prendere la non volere vedere lo segnale ci essere sorella lo avere capire il identikit classico uomo non sapere accettare rottura non capire no no volere controllare possedere donna dici non imparare gestire proprio emozione raptus pianificare non andare giù non potere controllare ex vita senza,"['neutral', 'anger']"
k9xbya5,[deleted],"['neutral', 'none']",deleted,"['neutral', 'none']"
k9xzl0p,"Piccola differenza è che il post di Salvini ha come fine l'istigare la gente contro l'immigrato, la influencer femminista lo fa se in malafede per farsi pubblicità. L'uno è odio l'altro mero egoismo. A voi la scelta di cosa sia peggio.","['negative', 'anger']",Piccola differenza post Salvini fine il istigare gente il immigrato influencer femminista fare malafede fare si pubblicità il uno odio il altro mero egoismo A scelta cosa peggio,"['negative', 'fear']"
k9xuy1g,"Ironicamente, sì. 

Se parli di come ""argomento X"" ti stia stufando, stai parlando dell'argomento X e stai alimentando l'afflusso verso tale argomento. 

Se non vuoi sentire più un argomento, una ideologia o qualsiasi cosa che vuoi evitare, l'unica ""cura"" è ignorarlo. 

Farci dei rant crea traffico sull'argomento, lo alimenta. Funziona la stessa cosa sui politici vari, che fanno a gara a chi fa più rumore, poiché sanno che l'opposizione farà rumore ed è ""pubblicità"". 

Un esempio sono i politici che si svegliano garantisti in questa circostanza, dicendo ""Se"" e ""ma"".

I parenti si infuriano (mi pare palese su chi sia il colpevole, dire ""se"" è stato lui, deve andare in carcere a vita, è un insulto...) e fanno pubblicità gratuita al politico che sghignazza essendosi fatto pubblicità grazie ad un femminicio (termine che odio, perché un omicidio è un omicidio, ma in questo caso la ragazza è stata uccisa per uno specifico motivo, ergo è l'esempio più lampante di femminicidio.)","['negative', 'anger']",ironicamente sì se parlare argomento X stufare parlare di il argomento X alimentare il afflusso verso tale argomento se non volere sentire più argomento ideologiare qualsiasi cosa volere evitare il unico cura ignorare lo Farci rant creare traffico su il argomento alimentare funzionare stesso cosa politico vario gara fare più rumore poiché sapere il opposizione rumore pubblicità uno esempio politico svegliare garantisto circostanza dire se il parente infuriano parere palendere colpevole dire stato dovere andare carcere vita insulto ... pubblicità gratuito politico sghignazzare essere si fare pubblicità grazie femminicio termine odio omicidio omicidio caso ragazzare essere uccidere specifico motivo ergo il esempio più lampante femminicidio,"['negative', 'anger']"
k9y17f4,"Assolutamente si.
Primo laureato in famiglia, lavoro per preservare l'acqua potabile, volontario per 20 anni,sposato e 2 figli.


Se poi studi storia e antropologia non puoi non esserlo.
Guardando alla società?

Morire di malattie per la nostra società é l'eccezione, lrima era la normalità.
La nostra società é tra le più eque e con una maggior rete di sicurezza nel mondo e nella storia. Devo davvero andare avanti?

Ci sono disparità, ma fa parte della natura umana. Ci sono un sacco di ingiustizie? Certo!! Ma se preferisci vivere altrove dimmi che sono curioso!!


Guarda che é successo in Zimbabwe...

Purtroppo siamo in decadenza ormai.... e quelli che hanno appoggiato ciò soffriranno maggiormente.","['positive', 'sadness']",assolutamente Primo laureato famiglia lavoro preservare il acqua potabile volontario 20 anno sposare 2 figlio se poi studio storia antropologio non potere non essere lo Guardare società Morire malattia società é il eccezione lrimo normalità il società é più eque maggiore rete sicurezza more storia Devo davvero andare avanti ci disparità fare parte natura umano ci saccare ingiustizie certo Ma preferire vivere altrove dimmi curioso Guarda é successo Zimbabwe ... purtroppo decadenza ormai ... appoggiare ciò soffrari maggiormente,"['positive', 'sadness']"
k9y6344,Queste donne che vanno a protestare facendo questo e quello ve le sognate di notte. Dove minchia sono tutte queste femministe che scendono in piazza a manifestare per ogni minima cosa? Me lo dite per favore così mi aggrego a loro?,"['neutral', 'none']",questo donna andare protestare ve sognare notte Dove minchiare tutto femminista scendere piazza manifestare ogni minimo cosa me dire favore così Aggrego,"['negative', 'none']"
k9zoi6s,"Quando succedono queste cose, perché  non se ne parla come una questione di responsabilità ANCHE maschile? Se sto tizio era possessivo e ultra geloso, e nessuno nella sua famiglia gliel’ha fatto notare come problema? I suoi amici non gli hanno mai detto niente? L’unica che si è accorta è la sorella di Giulia Cecchettin? 

Dov’è la rete sociale di questi uomini violenti? Sono tutti in un club loro e non si dicono niente? Non hanno amici? Gli amici ignorano i lati problematici della loro personalità? Forse è il caso che si cominci a parlare di certi temi tra di noi “nella vita reale” (perché condividere un post sui social lascia il tempo che trova) anche prima che finiscano in cronaca.","['neutral', 'sadness']",quando succedere cosa non parlare questione responsabilità ANCHE maschile se tizio possessivo ultra geloso nessuno famiglia gliel ’ fare notare problema il amico non mai dire niente L ’ unico accorto sorella Giulia Cecchettin Dov ’ rete sociale uomo violento essere club non dire niente Non amico il amico ignorare lato problematico personalità forse caso cominci parlare certo tema “ vita reale ” condividere post social lasciare tempo trovare prima finire cronaca,"['positive', 'fear']"
k9yhhnz,"Per me è un problema culturale che va cambiato dall'alto, è umiliante il fatto che io debba andare in piazza per cambiare la mentalità dei cavernicoli. Anche perchè non farebbe effetto, chi è cresciuto con dei valori marci non viene cambiato con degli slogan, si deve puntare alle prossime generazioni","['negative', 'disgust']",per me problema culturale andare cambiare da il alto umiliante fare dovere andare piazza cambiare mentalità cavernicolo anche perché non effetto cresciuto valore marce non venire cambiare slogan dovere puntare prossimo generazione,"['neutral', 'disgust']"
k9zn0bm,"letteralmente ""lmaoing @ u""","['neutral', 'none']",letteralmente lmaoing u,"['neutral', 'none']"
k9zxppd,"Penso che questo discorso manchi il punto - non c’è (a mia conoscenza) nessuno studio che colleghi i suicidi maschili alle donne, e francamente dubito che riuscirei a trovare studi che dicano che depressione e suicidio possano essere causati da UNA persona, piuttosto che da un mix di fattori.

C’è invece l’evidenza che, quando una donna viene uccisa, è per la stragrande maggioranza per mano di un uomo - e le statistiche mi pare dicano che più dell’ottanta per cento viene ammazzata da uomini nella sua sfera affettiva, e circa il cinquanta percento da partner o ex partner.

Prendiamo dei dati Istat 2021: di tutti gli omicidi, la maggior parte delle vittime sono state uomini, e il 39,3 percento donne. Ma il 58% delle donne sono state uccise da partner o ex partner, mentre lo stesso si può dire solo del 4,2%. Parliamo per gli uomini della statistiche riguardante i loro partner, perché quella degli ex partner è così minuta da essere quasi invisibile sul grafico.

Guardando questi numeri, che forse prima non conoscevi (ed è normale, perché i giornali fanno tanta comunicazione sensazionalistica evitando abilmente di parlare del problema sistemico) riesci ad essere d’accordo sul fatto che quello della violenza su partner ed ex partner è un problema su cui sono prevalentemente gli uomini a dover lavorare?

Ci tengo a dire che io sarò sempre s favore di qualsiasi iniziativa che sganci gli uomini dalle pressioni patriarcali - il maschilismo fa male anche a loro, perché propone un range molto limitato di modelli a cui rifarsi, molti dei quali tossici, e gli uomini possono decidere di adeguarsi o rischiare l’esclusione. Anche per questo penso che fare educazione sessuale e sentimentale a scuola possa aiutare molto tutt3 quant3.","['positive', 'trust']","Penso discorso manco punto non ’ conoscenza nessuno studio collega suicida maschile donna francamente dubito riuscire trovare studio dicare depressione suicidio potere essere causare UNA persona piuttosto mix fattore C ’ invece ’ evidenza quando donna venire uccidere stragrande maggioranza mano uomo statistico parere dicare più ’ ottanta cento venire ammazzare uomo sfero affettire circa cinquanta percento partner ex partner Prendiamo dato Istat 2021 omicidio maggiore parte vittima stato uomo 39,3 percento donna ma 58 donna stato uccidere partner ex partner mentre stesso potere dire solo 4,2 Parlare uomo statistico riguardante partner ex partner così minuto essere quasi invisibile grafico Guardando numero forse prima non conoscevare normale giornale tanto comunicazione sensazionalistico evitare abilmente parlare problema sistemico riesci essere d ’ accordo fare violenza partner ex partner problema prevalentemente uomo dovere lavorare Ci tenere dire sempre s favorire qualsiasi iniziativa sgancio uomo pressione patriarcale maschilismo fare male proporre rangere molto limitato modello rifare si molto quale tossico uomo potere decidere adeguare si rischiare ’ esclusione Anche pensare fare educazione sessuale sentimentale scuola potere aiutare molto tutt 3 quant 3","['positive', 'fear']"
k9zlpjc,"Ma ti rendi conto che letteralmente il problema al contratio non esiste? Quanti uomini vengono ammazzatti in italiana dalle donne in quante donne? E quante domne perché ex, compagne o mogli? 

Il punto come dici è proprio la totale incapacità emotiva di molti uomini (sono uomo, comunque). Non è semplice, bisogna ascoltare. E parlare, tanto, fra di noi uomini. 

Se senti una ragazza dire che è stufa di questi uomini e ti atai lamentando che tu “no”, not all man, sei più preoccupato del tuo ego che di quello che è successo. Io son rimasto veramente a terra, pensavo le nuove generazioni fossero diverse, più coscienti","['negative', 'sadness']",ma rendi conto letteralmente problema contratio non esistere quanto uomo venire ammazzatto italiano donna donna e domne ex compagno mogli il punto dici proprio totale incapacità emotivo molto uomo uomo comunque non semplice bisognare ascoltare e parlare tanto fra uomo se sentire ragazzo dire stufa uomo atao lamentare “ no ” not mano più preoccupato ego successo io son rimanere veramente terra pensare nuovo generazione diverso più cosciente,"['neutral', 'sadness']"
k9xcbvk,"I dati sulle mortalità in Italia con l'Istat sono aggiornate al 2020, ma ci sono circa 700'000 morti, di cui solo 13'000 non dovute a malattia o banalmente da avanzata età. 2500 da incidenti sui mezzi di trasporto (2000m 500f),  18'000 incidenti vari (8k m, 9k f), suicidio 4'000 (3k m, 1k f), omicidio 226 (135m, 91f; nota a parte, non corrispondono con i dati del mdi?). Però questo non vuol dire che si possono ignorare delle cause di morte senza fare nulla: sulle malattie ci sono ricerca, indicazioni sulla nutrizione, prevenzione, richieste a non finire per diminuire l'inquinamento e per far smettere di fumare; sui trasporti le indicazioni di non bere e di guidare con attenzione sono omnipresenti (tra l'altro dato interessante che le morti sui trasporti siano perlopiù maschili, quale può esserne la causa?); sul suicidio si spera che le varie campagne aiutino, in caso l'aiuto della psichiatria è sempre presente e più che incitato. E comunque non è una gara a chi ha più ragione o meno a morire e per cosa, l'importante è riconoscere che c'è un problema e serve risolverlo.","['negative', 'fear']",il dato mortalità Italia il Istat aggiornato 2020 circa 700 000 morire solo 13 000 non dovere malattia banalmente avanzare età 2500 incidente mezzo trasporto 2000 m 500f 18 000 incidente vario ( 8 k m 9k f suicidio 4 000 3k m 1k f omicidio 226 135 m 91f noto parte non corrispondere dato mdi Però non volere dire potere ignorare causa morto senza fare nulla malattia ricerca indicazione nutrizione prevenzione richiedere non finire diminuire il inquinamento fare smettere fumare trasporto indicazione non bere guidare attenzione omnipresento il altro dato interessante morto trasporto perlopiù maschile potere essere ne causa ) ; suicidio sperare vario campagna aiutare caso il aiuto psichiatriare sempre presente più incitare E comunque non garare più ragione meno morire cosa il importante riconoscere ci essere problema servire risolvere lo,"['negative', 'fear']"
k9xdcti,"Ho scritto ""se sei uomo la possibilità di essere ucciso da una persona di questo gruppo è il 20%"", quindi il riferimento è 40 su 197, che sono gli uomini uccisi, quindi l'81% fa riferimento alle 127 donne uccise, non è malafede mia, è mancanza della comprensione del contesto tua, dato che ho esplicitamente indicato la popolazione statistica di cui ho fatto riferimento.","['positive', 'trust']",avere scrivere uomo possibilità essere uccidere persona gruppo 20 quindi riferimento 40 197 uomo uccidere quindi 81 fare riferimento 127 donna uccidere non malafedere mancanza comprensione contesto dare esplicitamente indicare popolazione statistico fare riferimento,"['negative', 'anger']"
k9xt0ut,"Verissimo, infatti anche qui è un caso complicato, ci sono media che aggiornano il conteggio ogni giorno, altri che fanno finta di niente. E le morti sono tante perché gli enti che dovrebbero monitorare la sicurezza sono praticamente inesistenti, i datori di lavoro e molte volte anche i lavoratori stessi ignorano bellamente le misure di sicurezza. I sindacati ( o almeno, la CGIL) sono sempre al primo posto per segnalare e richiedere che vengano prese misure, ma non vengono ascoltati.

Credo che la differenza di numero di morti per genere sia dovuta al fatto che i settori a rischio assumono praticamente solo uomini; sarebbe da entrare nel merito di come questa pratica venga gestita, per esempio sono abbastanza sicuro che un datore di lavoro nell'edilizia scarterebbe a prescindere un candidato donna; allo stesso modo direi che è abbastanza certo che nella società attuale una donna cerchi altri lavori prima di scegliere un settore come quello utilizzato nell'esempio.","['positive', 'trust']",verissimo infatti qui caso complicato media aggiornano conteggio ogni giorno altro finta niente E morire tanto ente dovere monitorare sicurezza praticamente inesistente datore lavoro molto volta lavoratore ignorare bellamente misura sicurezza il sindacato almeno CGIL sempre primo posto segnalare richiedere venire prendere misura non venire ascoltare credere differenza numero morire genere dovere fare settore rischio assumere praticamente solo uomo entrare merito pratico venire gestire esempio abbastanza sicuro datore lavoro in il edilizia scarteere prescindere candidato donna stesso modo dire abbastanza certo società attuale donna cercare altro lavoro prima scegliere settore utilizzare in il esempio,"['positive', 'trust']"
ka0yxxd,"Se vuoi metterti a farci un grafico su matlab fai pure. Ho preso i dati dell'ISTAT e ci ho fatto due conti alla mano, probabilmente avresti potuto capire che non è una dissertazione estesa ma un banale post di Reddit, quindi non serve altro. 
Se vuoi farci uno studio fai pure, non ti interrompo mica. E puoi anche leggerlo Nietzsche, anche se sei un ingegnere, credo ti piacerebbe visto che nella boriosità andreste d'accordo.","['positive', 'trust']",se volere mettertio fare ci grafico matlab pure avere prendere dato di il ISTAT fare due conto mano probabilmente potere capire non dissertazione esteso banale post Reddit quindi non servire altro se volere fare ci studio pure non interrompo mica E potere leggere lo Nietzsche ingegnere credo piacere vedere boriosità andresta di accordo,"['positive', 'trust']"
k9y0oqh,"Ma chi se ne frega? I social media sono fatti per le minoranze numerose specialmente twitter, di quell hashtag non frega niente a nessuno. Cioè tu ti incazzi perchè gente che non conosci che esiste solo su internet inizia con gli hashtag e roba del genere? Ti lascio con la citazione; 

""Gli uomini non sono tutti violenti, ma le persone violente sono quasi tutti uomini.""","['positive', 'trust']",ma fregare il social medio fare minoranza numeroso specialmente twitter quell Hashtag non fregare niente nessuno Cioè incazzo perché gente non conoscere esistere solo internet inizia Hashtag roba genere Ti lasciare citazione il uomo non violento persona violento quasi uomo,"['negative', 'surprise']"
